{
  "metadata": {
    "data_geracao": "2026-02-12T12:01:36.781890",
    "data_geracao_br": "12/02/2026 12:01:36",
    "fonte": "API eContador (eContador/Alterdata)",
    "endpoint": "https://dp.pack.alterdata.com.br/api/v1/funcionarios",
    "filtro_usado": "filter[status]=demitido",
    "total_demitidos": 716,
    "total_ativos": 245,
    "observacao": "Este relatorio mostra o que a API retorna ATUALMENTE. Se os dados estiverem desatualizados, pode haver delay de sincronizacao entre Alterdata e a API eContador."
  },
  "funcionarios_demitidos": [
    {
      "id_api": "140",
      "codigo": "000001",
      "matricula": "000001",
      "nome": "VALDEREZA CATIQUE JEAN",
      "cpf": "7700377200",
      "status": "Demitido",
      "data_admissao": "04/01/1996",
      "data_admissao_iso": "1996-01-04T02:00:00Z",
      "data_demissao": "05/04/2020",
      "data_demissao_iso": "2020-04-05T03:00:00Z",
      "email": "",
      "nome_funcao": "000006 - APRENDIZ ASSIST ADM IND"
    },
    {
      "id_api": "599",
      "codigo": "000002",
      "matricula": "000002",
      "nome": "RUI ADRIANO MARTINS DE ALENCAR",
      "cpf": "44188447249",
      "status": "Demitido",
      "data_admissao": "04/01/1996",
      "data_admissao_iso": "1996-01-04T02:00:00Z",
      "data_demissao": "03/01/2014",
      "data_demissao_iso": "2014-01-03T02:00:00Z",
      "email": "",
      "nome_funcao": "000121 - OPERADOR DE MAQ CARTONAGEM"
    },
    {
      "id_api": "711",
      "codigo": "000003",
      "matricula": "000003",
      "nome": "ANTONIO MARTINS DE ALENCAR",
      "cpf": "40489329268",
      "status": "Demitido",
      "data_admissao": "18/06/1996",
      "data_admissao_iso": "1996-06-18T03:00:00Z",
      "data_demissao": "21/06/2018",
      "data_demissao_iso": "2018-06-21T03:00:00Z",
      "email": "",
      "nome_funcao": "000131 - ANALISTA DE DESENVOLVIMENTO"
    },
    {
      "id_api": "1081",
      "codigo": "000005",
      "matricula": "000005",
      "nome": "REGINALDO B DE ALBUQUERQUE",
      "cpf": "25463063249",
      "status": "Demitido",
      "data_admissao": "01/12/2000",
      "data_admissao_iso": "2000-12-01T02:00:00Z",
      "data_demissao": "02/09/2013",
      "data_demissao_iso": "2013-09-02T03:00:00Z",
      "email": "",
      "nome_funcao": "000069 - OPER MAQ CARTONAGEM"
    },
    {
      "id_api": "1095",
      "codigo": "000006",
      "matricula": "000006",
      "nome": "JUBERTO GOMES DA SILVA",
      "cpf": "27405001220",
      "status": "Demitido",
      "data_admissao": "01/07/2003",
      "data_admissao_iso": "2003-07-01T03:00:00Z",
      "data_demissao": "02/09/2013",
      "data_demissao_iso": "2013-09-02T03:00:00Z",
      "email": "",
      "nome_funcao": "000069 - OPER MAQ CARTONAGEM"
    },
    {
      "id_api": "8",
      "codigo": "000007",
      "matricula": "000007",
      "nome": "ELIZANDRO SANTOS DA SILVA",
      "cpf": "51388014220",
      "status": "Demitido",
      "data_admissao": "01/09/2003",
      "data_admissao_iso": "2003-09-01T03:00:00Z",
      "data_demissao": "05/09/2017",
      "data_demissao_iso": "2017-09-05T03:00:00Z",
      "email": "",
      "nome_funcao": "000098 - INSPETOR DE QUALIDADE"
    },
    {
      "id_api": "28",
      "codigo": "000008",
      "matricula": "000008",
      "nome": "JULIMAR SIQUEIRA SOARES",
      "cpf": "72133953272",
      "status": "Demitido",
      "data_admissao": "02/02/2004",
      "data_admissao_iso": "2004-02-02T02:00:00Z",
      "data_demissao": "28/07/2016",
      "data_demissao_iso": "2016-07-28T03:00:00Z",
      "email": "",
      "nome_funcao": "000034 - LIDER DE COLAGEM"
    },
    {
      "id_api": "34",
      "codigo": "000010",
      "matricula": "000010",
      "nome": "FRANCISCO IVAN DE SOUZA LIMA",
      "cpf": "40672581272",
      "status": "Demitido",
      "data_admissao": "15/03/2004",
      "data_admissao_iso": "2004-03-15T03:00:00Z",
      "data_demissao": "04/07/2016",
      "data_demissao_iso": "2016-07-04T03:00:00Z",
      "email": "",
      "nome_funcao": "000126 - GERENTE DE PRODUÇAO"
    },
    {
      "id_api": "35",
      "codigo": "000011",
      "matricula": "000011",
      "nome": "CARLEANDRO DOS REIS SENA",
      "cpf": "72291397249",
      "status": "Demitido",
      "data_admissao": "01/02/2005",
      "data_admissao_iso": "2005-02-01T02:00:00Z",
      "data_demissao": "20/02/2018",
      "data_demissao_iso": "2018-02-20T03:00:00Z",
      "email": "",
      "nome_funcao": "000126 - GERENTE DE PRODUÇAO"
    },
    {
      "id_api": "682",
      "codigo": "000012",
      "matricula": "000012",
      "nome": "CARLOS CESAR LEMOS SOARES",
      "cpf": "64349195220",
      "status": "Demitido",
      "data_admissao": "01/02/2006",
      "data_admissao_iso": "2006-02-01T02:00:00Z",
      "data_demissao": "03/09/2015",
      "data_demissao_iso": "2015-09-03T03:00:00Z",
      "email": "",
      "nome_funcao": "000131 - ANALISTA DE DESENVOLVIMENTO"
    },
    {
      "id_api": "1084",
      "codigo": "000014",
      "matricula": "000014",
      "nome": "JEFSON DA SILVA FERREIRA",
      "cpf": "64858723291",
      "status": "Demitido",
      "data_admissao": "02/05/2006",
      "data_admissao_iso": "2006-05-02T03:00:00Z",
      "data_demissao": "15/03/2020",
      "data_demissao_iso": "2020-03-15T03:00:00Z",
      "email": "",
      "nome_funcao": "000130 - LIDER DE ALMOXARIFE"
    },
    {
      "id_api": "521",
      "codigo": "000015",
      "matricula": "000015",
      "nome": "CAROLINE NYENHUIS",
      "cpf": "76120473220",
      "status": "Demitido",
      "data_admissao": "02/01/2007",
      "data_admissao_iso": "2007-01-02T02:00:00Z",
      "data_demissao": "02/09/2013",
      "data_demissao_iso": "2013-09-02T03:00:00Z",
      "email": "",
      "nome_funcao": "000143 - ASSIST FISCAL"
    },
    {
      "id_api": "1092",
      "codigo": "000016",
      "matricula": "000016",
      "nome": "ELIZIO SANTOS DA SILVA",
      "cpf": "52505731268",
      "status": "Demitido",
      "data_admissao": "01/02/2007",
      "data_admissao_iso": "2007-02-01T02:00:00Z",
      "data_demissao": "03/09/2019",
      "data_demissao_iso": "2019-09-03T03:00:00Z",
      "email": "",
      "nome_funcao": "000104 - FATURISTA"
    },
    {
      "id_api": "632",
      "codigo": "000017",
      "matricula": "000017",
      "nome": "EDNA BARBOSA NYENHUIS",
      "cpf": "30965560244",
      "status": "Demitido",
      "data_admissao": "01/02/2007",
      "data_admissao_iso": "2007-02-01T02:00:00Z",
      "data_demissao": "02/09/2013",
      "data_demissao_iso": "2013-09-02T03:00:00Z",
      "email": "",
      "nome_funcao": "000073 - GERENTE DE RH"
    },
    {
      "id_api": "132",
      "codigo": "000018",
      "matricula": "000018",
      "nome": "JOSE DE NAZARE RAMOS DA SILVA",
      "cpf": "20156693291",
      "status": "Demitido",
      "data_admissao": "01/08/2007",
      "data_admissao_iso": "2007-08-01T03:00:00Z",
      "data_demissao": "09/06/2021",
      "data_demissao_iso": "2021-06-09T03:00:00Z",
      "email": "",
      "nome_funcao": "000049 - LIDER OPERADOR DE MAQ CARTONAGEM"
    },
    {
      "id_api": "37",
      "codigo": "000020",
      "matricula": "000020",
      "nome": "ALAN MACHADO PESSOA",
      "cpf": "52583740253",
      "status": "Demitido",
      "data_admissao": "01/04/2008",
      "data_admissao_iso": "2008-04-01T03:00:00Z",
      "data_demissao": "31/07/2012",
      "data_demissao_iso": "2012-07-31T03:00:00Z",
      "email": "",
      "nome_funcao": "000022 - OP MAQUINA II"
    },
    {
      "id_api": "927",
      "codigo": "000021",
      "matricula": "000021",
      "nome": "BENEDITO SEBASTIAO DA SILVA",
      "cpf": "7878087172",
      "status": "Demitido",
      "data_admissao": "02/06/2008",
      "data_admissao_iso": "2008-06-02T03:00:00Z",
      "data_demissao": "19/02/2013",
      "data_demissao_iso": "2013-02-19T03:00:00Z",
      "email": "",
      "nome_funcao": "000109 - VIGILANTE"
    },
    {
      "id_api": "1104",
      "codigo": "000022",
      "matricula": "000022",
      "nome": "DHYONNE DE CASTILHO VAZ",
      "cpf": "392694263",
      "status": "Demitido",
      "data_admissao": "01/10/2008",
      "data_admissao_iso": "2008-10-01T03:00:00Z",
      "data_demissao": "31/01/2013",
      "data_demissao_iso": "2013-01-31T02:00:00Z",
      "email": "",
      "nome_funcao": "000028 - OPE MAQ COLAGEM"
    },
    {
      "id_api": "561",
      "codigo": "000023",
      "matricula": "000023",
      "nome": "PAULO ALBERTO MIRABAL DA SILVA",
      "cpf": "92996205200",
      "status": "Demitido",
      "data_admissao": "01/10/2008",
      "data_admissao_iso": "2008-10-01T03:00:00Z",
      "data_demissao": "14/04/2014",
      "data_demissao_iso": "2014-04-14T03:00:00Z",
      "email": "",
      "nome_funcao": "000121 - OPERADOR DE MAQ CARTONAGEM"
    },
    {
      "id_api": "38",
      "codigo": "000024",
      "matricula": "000024",
      "nome": "DINAR PINHEIRO DA SILVA",
      "cpf": "66340810268",
      "status": "Demitido",
      "data_admissao": "01/06/2009",
      "data_admissao_iso": "2009-06-01T03:00:00Z",
      "data_demissao": "02/09/2013",
      "data_demissao_iso": "2013-09-02T03:00:00Z",
      "email": "",
      "nome_funcao": "000275 - Chefe de cozinha"
    },
    {
      "id_api": "484",
      "codigo": "000026",
      "matricula": "000026",
      "nome": "WANDER MELO DOS REIS",
      "cpf": "1000024202",
      "status": "Demitido",
      "data_admissao": "01/02/2010",
      "data_admissao_iso": "2010-02-01T02:00:00Z",
      "data_demissao": "09/04/2012",
      "data_demissao_iso": "2012-04-09T03:00:00Z",
      "email": "",
      "nome_funcao": "000048 - AUXILIAR DE PRODUCAO"
    },
    {
      "id_api": "584",
      "codigo": "000027",
      "matricula": "000027",
      "nome": "FERNANDO LEITE DOS SANTOS",
      "cpf": "89001249272",
      "status": "Demitido",
      "data_admissao": "01/02/2010",
      "data_admissao_iso": "2010-02-01T02:00:00Z",
      "data_demissao": "03/06/2015",
      "data_demissao_iso": "2015-06-03T03:00:00Z",
      "email": "",
      "nome_funcao": "000086 - ALMOXARIFE"
    },
    {
      "id_api": "577",
      "codigo": "000028",
      "matricula": "000028",
      "nome": "TATIANA MARTINS DA SILVA",
      "cpf": "44161328249",
      "status": "Demitido",
      "data_admissao": "05/02/2010",
      "data_admissao_iso": "2010-02-05T02:00:00Z",
      "data_demissao": "02/09/2013",
      "data_demissao_iso": "2013-09-02T03:00:00Z",
      "email": "",
      "nome_funcao": "000065 - ASSISTENTE DE PCP"
    },
    {
      "id_api": "928",
      "codigo": "000029",
      "matricula": "000029",
      "nome": "MARINILCE DA SILVA LIMA",
      "cpf": "33677441234",
      "status": "Demitido",
      "data_admissao": "01/03/2010",
      "data_admissao_iso": "2010-03-01T03:00:00Z",
      "data_demissao": "19/03/2012",
      "data_demissao_iso": "2012-03-19T03:00:00Z",
      "email": "",
      "nome_funcao": "000043 - ASSISTENTE FISCAL"
    },
    {
      "id_api": "600",
      "codigo": "000030",
      "matricula": "000030",
      "nome": "JOSE FERREIRA BARBOSA",
      "cpf": "73570877272",
      "status": "Demitido",
      "data_admissao": "01/04/2010",
      "data_admissao_iso": "2010-04-01T03:00:00Z",
      "data_demissao": "26/04/2012",
      "data_demissao_iso": "2012-04-26T03:00:00Z",
      "email": "",
      "nome_funcao": "000275 - Chefe de cozinha"
    },
    {
      "id_api": "545",
      "codigo": "000032",
      "matricula": "000032",
      "nome": "MARIA ERCILA NOGUEIRA DE SOUZA",
      "cpf": "47469528253",
      "status": "Demitido",
      "data_admissao": "01/04/2010",
      "data_admissao_iso": "2010-04-01T03:00:00Z",
      "data_demissao": "02/09/2013",
      "data_demissao_iso": "2013-09-02T03:00:00Z",
      "email": "",
      "nome_funcao": "000062 - SUP DE SERV GER"
    },
    {
      "id_api": "903",
      "codigo": "000033",
      "matricula": "000033",
      "nome": "JADSON ANDRADE PEREIRA",
      "cpf": "84529644200",
      "status": "Demitido",
      "data_admissao": "01/06/2010",
      "data_admissao_iso": "2010-06-01T03:00:00Z",
      "data_demissao": "30/12/2014",
      "data_demissao_iso": "2014-12-30T02:00:00Z",
      "email": "",
      "nome_funcao": "000225 - OPERADOR DE MAQ COLAGEM"
    },
    {
      "id_api": "1077",
      "codigo": "000034",
      "matricula": "000034",
      "nome": "DEMOSTHENIS DA SILVA LOPES",
      "cpf": "60389109215",
      "status": "Demitido",
      "data_admissao": "01/06/2010",
      "data_admissao_iso": "2010-06-01T03:00:00Z",
      "data_demissao": "28/02/2019",
      "data_demissao_iso": "2019-02-28T03:00:00Z",
      "email": "",
      "nome_funcao": "000130 - LIDER DE ALMOXARIFE"
    },
    {
      "id_api": "649",
      "codigo": "000035",
      "matricula": "000035",
      "nome": "JOSE FERNANDES DE OLIVEIRA",
      "cpf": "15375447215",
      "status": "Demitido",
      "data_admissao": "01/06/2010",
      "data_admissao_iso": "2010-06-01T03:00:00Z",
      "data_demissao": "01/10/2014",
      "data_demissao_iso": "2014-10-01T03:00:00Z",
      "email": "",
      "nome_funcao": "000108 - VENDEDOR"
    },
    {
      "id_api": "727",
      "codigo": "000036",
      "matricula": "000036",
      "nome": "AUTEMAR COSTA DE SOUZA",
      "cpf": "61297844220",
      "status": "Demitido",
      "data_admissao": "01/12/2010",
      "data_admissao_iso": "2010-12-01T02:00:00Z",
      "data_demissao": "30/06/2017",
      "data_demissao_iso": "2017-06-30T03:00:00Z",
      "email": "",
      "nome_funcao": "000131 - ANALISTA DE DESENVOLVIMENTO"
    },
    {
      "id_api": "633",
      "codigo": "000037",
      "matricula": "000037",
      "nome": "ANTONIA MARGARETE PINHEIRO DA SILVA",
      "cpf": "60076933253",
      "status": "Demitido",
      "data_admissao": "02/12/2010",
      "data_admissao_iso": "2010-12-02T02:00:00Z",
      "data_demissao": "16/07/2012",
      "data_demissao_iso": "2012-07-16T03:00:00Z",
      "email": "",
      "nome_funcao": "000112 - AUX DE PRODUCAO"
    },
    {
      "id_api": "506",
      "codigo": "000038",
      "matricula": "000038",
      "nome": "DENES CESAR DE OLIVEIRA CASTRO",
      "cpf": "1786122278",
      "status": "Demitido",
      "data_admissao": "18/02/2011",
      "data_admissao_iso": "2011-02-18T02:00:00Z",
      "data_demissao": "17/02/2013",
      "data_demissao_iso": "2013-02-17T03:00:00Z",
      "email": "",
      "nome_funcao": "000079 - ASS ADM INDUSTRIAL"
    },
    {
      "id_api": "74",
      "codigo": "000039",
      "matricula": "000039",
      "nome": "ALEX QUEIROZ DANTAS",
      "cpf": "1000178277",
      "status": "Demitido",
      "data_admissao": "18/02/2011",
      "data_admissao_iso": "2011-02-18T02:00:00Z",
      "data_demissao": "17/02/2013",
      "data_demissao_iso": "2013-02-17T03:00:00Z",
      "email": "",
      "nome_funcao": "000079 - ASS ADM INDUSTRIAL"
    },
    {
      "id_api": "1106",
      "codigo": "000040",
      "matricula": "000040",
      "nome": "WELLINGTON LUIZ SOUZA DA SILVA",
      "cpf": "1204328200",
      "status": "Demitido",
      "data_admissao": "18/02/2011",
      "data_admissao_iso": "2011-02-18T02:00:00Z",
      "data_demissao": "13/02/2012",
      "data_demissao_iso": "2012-02-13T02:00:00Z",
      "email": "",
      "nome_funcao": "000079 - ASS ADM INDUSTRIAL"
    },
    {
      "id_api": "537",
      "codigo": "000041",
      "matricula": "000041",
      "nome": "FLAVIO DA SILVA E SILVA",
      "cpf": "804856265",
      "status": "Demitido",
      "data_admissao": "01/04/2011",
      "data_admissao_iso": "2011-04-01T03:00:00Z",
      "data_demissao": "03/09/2012",
      "data_demissao_iso": "2012-09-03T03:00:00Z",
      "email": "",
      "nome_funcao": "000148 - VENDEDOR EXTERNO"
    },
    {
      "id_api": "460",
      "codigo": "000042",
      "matricula": "000042",
      "nome": "ADALBERTO DA COSTA PINON",
      "cpf": "30712270272",
      "status": "Demitido",
      "data_admissao": "01/08/2011",
      "data_admissao_iso": "2011-08-01T03:00:00Z",
      "data_demissao": "02/09/2013",
      "data_demissao_iso": "2013-09-02T03:00:00Z",
      "email": "",
      "nome_funcao": "000006 - APRENDIZ ASSIST ADM IND"
    },
    {
      "id_api": "1012",
      "codigo": "000044",
      "matricula": "000044",
      "nome": "VANDERCLEY ALVES DE SOUZA",
      "cpf": "32111690244",
      "status": "Demitido",
      "data_admissao": "15/08/2011",
      "data_admissao_iso": "2011-08-15T03:00:00Z",
      "data_demissao": "11/10/2017",
      "data_demissao_iso": "2017-10-11T03:00:00Z",
      "email": "",
      "nome_funcao": "000275 - Chefe de cozinha"
    },
    {
      "id_api": "634",
      "codigo": "000045",
      "matricula": "000045",
      "nome": "IRLEI BATISTA SARMENTO",
      "cpf": "59649194215",
      "status": "Demitido",
      "data_admissao": "15/09/2011",
      "data_admissao_iso": "2011-09-15T03:00:00Z",
      "data_demissao": "02/09/2013",
      "data_demissao_iso": "2013-09-02T03:00:00Z",
      "email": "",
      "nome_funcao": "000275 - Chefe de cozinha"
    },
    {
      "id_api": "1107",
      "codigo": "000046",
      "matricula": "000046",
      "nome": "MARCOS PAULO FREITAS DE ASSIS",
      "cpf": "71527940225",
      "status": "Demitido",
      "data_admissao": "01/12/2011",
      "data_admissao_iso": "2011-12-01T02:00:00Z",
      "data_demissao": "02/09/2013",
      "data_demissao_iso": "2013-09-02T03:00:00Z",
      "email": "",
      "nome_funcao": "000080 - AUXILIAR DE DESENVOLVIMENTO"
    },
    {
      "id_api": "635",
      "codigo": "000047",
      "matricula": "000047",
      "nome": "EDILSON DA SILVA LOBATO",
      "cpf": "60389753220",
      "status": "Demitido",
      "data_admissao": "01/12/2011",
      "data_admissao_iso": "2011-12-01T02:00:00Z",
      "data_demissao": "02/09/2013",
      "data_demissao_iso": "2013-09-02T03:00:00Z",
      "email": "",
      "nome_funcao": "000159 - ENCARREGADO GERAL"
    },
    {
      "id_api": "1097",
      "codigo": "000048",
      "matricula": "000048",
      "nome": "EDUARDO FRANCISCO DOS SANTOS",
      "cpf": "57797412200",
      "status": "Demitido",
      "data_admissao": "10/01/2012",
      "data_admissao_iso": "2012-01-10T02:00:00Z",
      "data_demissao": "20/07/2012",
      "data_demissao_iso": "2012-07-20T03:00:00Z",
      "email": "",
      "nome_funcao": "000108 - VENDEDOR"
    },
    {
      "id_api": "24",
      "codigo": "000051",
      "matricula": "000051",
      "nome": "JOAQUIM DA SILVA OLIVEIRA",
      "cpf": "33652937287",
      "status": "Demitido",
      "data_admissao": "02/02/2004",
      "data_admissao_iso": "2004-02-02T02:00:00Z",
      "data_demissao": "15/02/2012",
      "data_demissao_iso": "2012-02-15T02:00:00Z",
      "email": "",
      "nome_funcao": "000093 - OPER MAQ DE COLAGEM"
    },
    {
      "id_api": "1096",
      "codigo": "000055",
      "matricula": "000055",
      "nome": "LUCILENE SANTANA CALDERARO",
      "cpf": "32038070253",
      "status": "Demitido",
      "data_admissao": "22/09/2008",
      "data_admissao_iso": "2008-09-22T03:00:00Z",
      "data_demissao": "28/03/2012",
      "data_demissao_iso": "2012-03-28T03:00:00Z",
      "email": "",
      "nome_funcao": "000124 - ASSISTENTE CONTABIL"
    },
    {
      "id_api": "485",
      "codigo": "000057",
      "matricula": "000057",
      "nome": "ALEXANDEM MACHADO PESSOA",
      "cpf": "52583732234",
      "status": "Demitido",
      "data_admissao": "15/08/2011",
      "data_admissao_iso": "2011-08-15T03:00:00Z",
      "data_demissao": "21/09/2012",
      "data_demissao_iso": "2012-09-21T03:00:00Z",
      "email": "",
      "nome_funcao": "000108 - VENDEDOR"
    },
    {
      "id_api": "1105",
      "codigo": "000058",
      "matricula": "000058",
      "nome": "JOSE ELADILSON FERREIRA DE ARAGAO",
      "cpf": "43549535287",
      "status": "Demitido",
      "data_admissao": "01/02/2010",
      "data_admissao_iso": "2010-02-01T02:00:00Z",
      "data_demissao": "30/03/2012",
      "data_demissao_iso": "2012-03-30T03:00:00Z",
      "email": "",
      "nome_funcao": "000108 - VENDEDOR"
    },
    {
      "id_api": "683",
      "codigo": "000059",
      "matricula": "000059",
      "nome": "OSVALDO DOS SANTOS VIEIRA JUNIOR",
      "cpf": "1194233244",
      "status": "Demitido",
      "data_admissao": "01/04/2010",
      "data_admissao_iso": "2010-04-01T03:00:00Z",
      "data_demissao": "09/08/2012",
      "data_demissao_iso": "2012-08-09T03:00:00Z",
      "email": "",
      "nome_funcao": "000112 - AUX DE PRODUCAO"
    },
    {
      "id_api": "953",
      "codigo": "000060",
      "matricula": "000060",
      "nome": "ZICO CRUZ LIBORIO",
      "cpf": "73779024268",
      "status": "Demitido",
      "data_admissao": "01/04/2008",
      "data_admissao_iso": "2008-04-01T03:00:00Z",
      "data_demissao": "01/02/2012",
      "data_demissao_iso": "2012-02-01T02:00:00Z",
      "email": "",
      "nome_funcao": "000080 - AUXILIAR DE DESENVOLVIMENTO"
    },
    {
      "id_api": "1091",
      "codigo": "000062",
      "matricula": "000062",
      "nome": "ALISSON SARAIVA DOS SANTOS",
      "cpf": "2022722221",
      "status": "Demitido",
      "data_admissao": "01/02/2012",
      "data_admissao_iso": "2012-02-01T02:00:00Z",
      "data_demissao": "27/07/2020",
      "data_demissao_iso": "2020-07-27T03:00:00Z",
      "email": "",
      "nome_funcao": "000121 - OPERADOR DE MAQ CARTONAGEM"
    },
    {
      "id_api": "1108",
      "codigo": "000063",
      "matricula": "000063",
      "nome": "DIHOGO DOS SANTOS LIMA",
      "cpf": "980490200",
      "status": "Demitido",
      "data_admissao": "01/02/2012",
      "data_admissao_iso": "2012-02-01T02:00:00Z",
      "data_demissao": "26/09/2012",
      "data_demissao_iso": "2012-09-26T03:00:00Z",
      "email": "",
      "nome_funcao": "000016 - SERVENTE"
    },
    {
      "id_api": "918",
      "codigo": "000064",
      "matricula": "000064",
      "nome": "JOCTHAN RAMOS ALVES",
      "cpf": "97526878220",
      "status": "Demitido",
      "data_admissao": "01/02/2012",
      "data_admissao_iso": "2012-02-01T02:00:00Z",
      "data_demissao": "26/07/2012",
      "data_demissao_iso": "2012-07-26T03:00:00Z",
      "email": "",
      "nome_funcao": "000016 - SERVENTE"
    },
    {
      "id_api": "1029",
      "codigo": "000065",
      "matricula": "000065",
      "nome": "JOSE ERIVELTON DE MIRANDA TORRES",
      "cpf": "41322037272",
      "status": "Demitido",
      "data_admissao": "01/02/2012",
      "data_admissao_iso": "2012-02-01T02:00:00Z",
      "data_demissao": "31/07/2016",
      "data_demissao_iso": "2016-07-31T03:00:00Z",
      "email": "",
      "nome_funcao": "000108 - VENDEDOR"
    },
    {
      "id_api": "1109",
      "codigo": "000066",
      "matricula": "000066",
      "nome": "JOSE HELENILSON LIMA MACIEL",
      "cpf": "62713876249",
      "status": "Demitido",
      "data_admissao": "01/02/2012",
      "data_admissao_iso": "2012-02-01T02:00:00Z",
      "data_demissao": "20/02/2013",
      "data_demissao_iso": "2013-02-20T03:00:00Z",
      "email": "",
      "nome_funcao": "000016 - SERVENTE"
    },
    {
      "id_api": "578",
      "codigo": "000067",
      "matricula": "000067",
      "nome": "LUCIANO AUGUSTO DE CASTILHO",
      "cpf": "21949131220",
      "status": "Demitido",
      "data_admissao": "01/02/2012",
      "data_admissao_iso": "2012-02-01T02:00:00Z",
      "data_demissao": "02/09/2013",
      "data_demissao_iso": "2013-09-02T03:00:00Z",
      "email": "",
      "nome_funcao": "000109 - VIGILANTE"
    },
    {
      "id_api": "909",
      "codigo": "000068",
      "matricula": "000068",
      "nome": "PAULO RICARDO ROMAINA PINTO",
      "cpf": "171716280",
      "status": "Demitido",
      "data_admissao": "01/02/2012",
      "data_admissao_iso": "2012-02-01T02:00:00Z",
      "data_demissao": "12/04/2012",
      "data_demissao_iso": "2012-04-12T03:00:00Z",
      "email": "",
      "nome_funcao": "000016 - SERVENTE"
    },
    {
      "id_api": "1076",
      "codigo": "000069",
      "matricula": "000069",
      "nome": "PAULO RODRIGO FERREIRA ALVES",
      "cpf": "164452281",
      "status": "Demitido",
      "data_admissao": "01/02/2012",
      "data_admissao_iso": "2012-02-01T02:00:00Z",
      "data_demissao": "27/04/2012",
      "data_demissao_iso": "2012-04-27T03:00:00Z",
      "email": "",
      "nome_funcao": "000016 - SERVENTE"
    },
    {
      "id_api": "546",
      "codigo": "000070",
      "matricula": "000070",
      "nome": "WELLIOGHIMENSON SILVA CASTRO",
      "cpf": "787408271",
      "status": "Demitido",
      "data_admissao": "01/02/2012",
      "data_admissao_iso": "2012-02-01T02:00:00Z",
      "data_demissao": "16/07/2012",
      "data_demissao_iso": "2012-07-16T03:00:00Z",
      "email": "",
      "nome_funcao": "000016 - SERVENTE"
    },
    {
      "id_api": "673",
      "codigo": "000071",
      "matricula": "000071",
      "nome": "THAIS LIMA DE SOUZA",
      "cpf": "78357080278",
      "status": "Demitido",
      "data_admissao": "02/04/2012",
      "data_admissao_iso": "2012-04-02T03:00:00Z",
      "data_demissao": "21/10/2013",
      "data_demissao_iso": "2013-10-21T02:00:00Z",
      "email": "",
      "nome_funcao": "000143 - ASSIST FISCAL"
    },
    {
      "id_api": "910",
      "codigo": "000072",
      "matricula": "000072",
      "nome": "THALITA PEREIRA DA SILVA",
      "cpf": "29268508249",
      "status": "Demitido",
      "data_admissao": "02/04/2012",
      "data_admissao_iso": "2012-04-02T03:00:00Z",
      "data_demissao": "08/08/2012",
      "data_demissao_iso": "2012-08-08T03:00:00Z",
      "email": "",
      "nome_funcao": "000094 - ASSIST ADMINIST INDUS"
    },
    {
      "id_api": "1070",
      "codigo": "000074",
      "matricula": "000074",
      "nome": "JOAO JOSE SOARES",
      "cpf": "8251606268",
      "status": "Demitido",
      "data_admissao": "02/05/2012",
      "data_admissao_iso": "2012-05-02T03:00:00Z",
      "data_demissao": "31/07/2012",
      "data_demissao_iso": "2012-07-31T03:00:00Z",
      "email": "",
      "nome_funcao": "000129 - MESTRE DE OBRA"
    },
    {
      "id_api": "920",
      "codigo": "000075",
      "matricula": "000075",
      "nome": "MARCIO GONCALVES DE ARAUJO",
      "cpf": "80973469234",
      "status": "Demitido",
      "data_admissao": "03/05/2012",
      "data_admissao_iso": "2012-05-03T03:00:00Z",
      "data_demissao": "02/09/2013",
      "data_demissao_iso": "2013-09-02T03:00:00Z",
      "email": "",
      "nome_funcao": "000064 - OPERADOR DE MAQUINA DE CARTONAGEM"
    },
    {
      "id_api": "919",
      "codigo": "000076",
      "matricula": "000076",
      "nome": "ROSALIA FRANCA BATISTA",
      "cpf": "20088450287",
      "status": "Demitido",
      "data_admissao": "02/05/2012",
      "data_admissao_iso": "2012-05-02T03:00:00Z",
      "data_demissao": "02/09/2013",
      "data_demissao_iso": "2013-09-02T03:00:00Z",
      "email": "",
      "nome_funcao": "000124 - ASSISTENTE CONTABIL"
    },
    {
      "id_api": "921",
      "codigo": "000077",
      "matricula": "000077",
      "nome": "RAYKSON SOUZA DE CARVALHO",
      "cpf": "1649954204",
      "status": "Demitido",
      "data_admissao": "01/06/2012",
      "data_admissao_iso": "2012-06-01T03:00:00Z",
      "data_demissao": "30/07/2012",
      "data_demissao_iso": "2012-07-30T03:00:00Z",
      "email": "",
      "nome_funcao": "000016 - SERVENTE"
    },
    {
      "id_api": "547",
      "codigo": "000078",
      "matricula": "000078",
      "nome": "NAZARENO BARROSO PRAIA",
      "cpf": "29136229253",
      "status": "Demitido",
      "data_admissao": "01/06/2012",
      "data_admissao_iso": "2012-06-01T03:00:00Z",
      "data_demissao": "07/08/2012",
      "data_demissao_iso": "2012-08-07T03:00:00Z",
      "email": "",
      "nome_funcao": "000016 - SERVENTE"
    },
    {
      "id_api": "601",
      "codigo": "000079",
      "matricula": "000079",
      "nome": "CLIUSON AMORIM DA SILVA",
      "cpf": "2121560203",
      "status": "Demitido",
      "data_admissao": "01/06/2012",
      "data_admissao_iso": "2012-06-01T03:00:00Z",
      "data_demissao": "30/07/2012",
      "data_demissao_iso": "2012-07-30T03:00:00Z",
      "email": "",
      "nome_funcao": "000016 - SERVENTE"
    },
    {
      "id_api": "130",
      "codigo": "000080",
      "matricula": "000080",
      "nome": "ADRIANO DA SILVA LELLIS",
      "cpf": "671953265",
      "status": "Demitido",
      "data_admissao": "01/06/2012",
      "data_admissao_iso": "2012-06-01T03:00:00Z",
      "data_demissao": "30/07/2012",
      "data_demissao_iso": "2012-07-30T03:00:00Z",
      "email": "",
      "nome_funcao": "000016 - SERVENTE"
    },
    {
      "id_api": "529",
      "codigo": "000081",
      "matricula": "000081",
      "nome": "RAIMUNDO GOMES DE CARVALHO",
      "cpf": "47582472268",
      "status": "Demitido",
      "data_admissao": "01/06/2012",
      "data_admissao_iso": "2012-06-01T03:00:00Z",
      "data_demissao": "21/02/2013",
      "data_demissao_iso": "2013-02-21T03:00:00Z",
      "email": "",
      "nome_funcao": "000115 - ARMADOR"
    },
    {
      "id_api": "491",
      "codigo": "000082",
      "matricula": "000082",
      "nome": "JOSIAS DA SILVA LIMA",
      "cpf": "56247494220",
      "status": "Demitido",
      "data_admissao": "01/06/2012",
      "data_admissao_iso": "2012-06-01T03:00:00Z",
      "data_demissao": "07/01/2013",
      "data_demissao_iso": "2013-01-07T02:00:00Z",
      "email": "",
      "nome_funcao": "000115 - ARMADOR"
    },
    {
      "id_api": "911",
      "codigo": "000083",
      "matricula": "000083",
      "nome": "RAIMUNDO NONATO DIAS DE SOUZA",
      "cpf": "44117671200",
      "status": "Demitido",
      "data_admissao": "01/06/2012",
      "data_admissao_iso": "2012-06-01T03:00:00Z",
      "data_demissao": "07/01/2013",
      "data_demissao_iso": "2013-01-07T02:00:00Z",
      "email": "",
      "nome_funcao": "000008 - CARPINTEIRO"
    },
    {
      "id_api": "414",
      "codigo": "000084",
      "matricula": "000084",
      "nome": "CESAR CARTEGIANE LIMA DA COSTA",
      "cpf": "64264890268",
      "status": "Demitido",
      "data_admissao": "01/06/2012",
      "data_admissao_iso": "2012-06-01T03:00:00Z",
      "data_demissao": "24/02/2014",
      "data_demissao_iso": "2014-02-24T03:00:00Z",
      "email": "",
      "nome_funcao": "000086 - ALMOXARIFE"
    },
    {
      "id_api": "1110",
      "codigo": "000087",
      "matricula": "000087",
      "nome": "JULIO CESAR SALDANHA",
      "cpf": "33705348272",
      "status": "Demitido",
      "data_admissao": "06/08/2012",
      "data_admissao_iso": "2012-08-06T03:00:00Z",
      "data_demissao": "27/08/2012",
      "data_demissao_iso": "2012-08-27T03:00:00Z",
      "email": "",
      "nome_funcao": "000108 - VENDEDOR"
    },
    {
      "id_api": "616",
      "codigo": "000089",
      "matricula": "000089",
      "nome": "EDVALDO SILVA DE SOUZA",
      "cpf": "47585358253",
      "status": "Demitido",
      "data_admissao": "01/10/2012",
      "data_admissao_iso": "2012-10-01T03:00:00Z",
      "data_demissao": "02/09/2013",
      "data_demissao_iso": "2013-09-02T03:00:00Z",
      "email": "",
      "nome_funcao": "000141 - ENCARREGADO DE SERVIÇOS GERAIS"
    },
    {
      "id_api": "39",
      "codigo": "000099",
      "matricula": "000099",
      "nome": "HIGOR ROMARIO LIMA PEREIRA",
      "cpf": "856349216",
      "status": "Demitido",
      "data_admissao": "01/03/2013",
      "data_admissao_iso": "2013-03-01T03:00:00Z",
      "data_demissao": "03/02/2014",
      "data_demissao_iso": "2014-02-03T02:00:00Z",
      "email": "",
      "nome_funcao": "000004 - APRENDIZ ASSIST ADM IND"
    },
    {
      "id_api": "690",
      "codigo": "000100",
      "matricula": "000100",
      "nome": "LEONARDO SANTOS DE OLIVEIRA",
      "cpf": "2507182270",
      "status": "Demitido",
      "data_admissao": "01/03/2013",
      "data_admissao_iso": "2013-03-01T03:00:00Z",
      "data_demissao": "03/03/2014",
      "data_demissao_iso": "2014-03-03T03:00:00Z",
      "email": "",
      "nome_funcao": "000004 - APRENDIZ ASSIST ADM IND"
    },
    {
      "id_api": "1058",
      "codigo": "000105",
      "matricula": "000105",
      "nome": "MANOEL MESSIAS TAVARES DA SILVA",
      "cpf": "27503550287",
      "status": "Demitido",
      "data_admissao": "02/09/2013",
      "data_admissao_iso": "2013-09-02T03:00:00Z",
      "data_demissao": "31/07/2016",
      "data_demissao_iso": "2016-07-31T03:00:00Z",
      "email": "",
      "nome_funcao": "000103 - VIGIA"
    },
    {
      "id_api": "904",
      "codigo": "000106",
      "matricula": "000106",
      "nome": "ANA KEILA MELO DOS REIS",
      "cpf": "61057509272",
      "status": "Demitido",
      "data_admissao": "02/09/2013",
      "data_admissao_iso": "2013-09-02T03:00:00Z",
      "data_demissao": "03/02/2014",
      "data_demissao_iso": "2014-02-03T02:00:00Z",
      "email": "",
      "nome_funcao": "000196 - AUX. DE COZINHA"
    },
    {
      "id_api": "399",
      "codigo": "000107",
      "matricula": "000107",
      "nome": "EDENILTON DA SILVA PAES",
      "cpf": "1184670269",
      "status": "Demitido",
      "data_admissao": "02/09/2013",
      "data_admissao_iso": "2013-09-02T03:00:00Z",
      "data_demissao": "31/10/2013",
      "data_demissao_iso": "2013-10-31T02:00:00Z",
      "email": "",
      "nome_funcao": "000105 - AUX. DE SERVICOS GERAIS"
    },
    {
      "id_api": "530",
      "codigo": "000108",
      "matricula": "000108",
      "nome": "ELIESSE SURIANO RIBEIRO",
      "cpf": "62654500268",
      "status": "Demitido",
      "data_admissao": "02/09/2013",
      "data_admissao_iso": "2013-09-02T03:00:00Z",
      "data_demissao": "01/10/2014",
      "data_demissao_iso": "2014-10-01T03:00:00Z",
      "email": "",
      "nome_funcao": "000044 - AJUDANTE DE CAMINHAO"
    },
    {
      "id_api": "507",
      "codigo": "000109",
      "matricula": "000109",
      "nome": "IVANILDO DE SOUZA VILHENA",
      "cpf": "92290116220",
      "status": "Demitido",
      "data_admissao": "02/09/2013",
      "data_admissao_iso": "2013-09-02T03:00:00Z",
      "data_demissao": "31/07/2016",
      "data_demissao_iso": "2016-07-31T03:00:00Z",
      "email": "",
      "nome_funcao": "000044 - AJUDANTE DE CAMINHAO"
    },
    {
      "id_api": "691",
      "codigo": "000110",
      "matricula": "000110",
      "nome": "JAN CARLOS DA SILVA NATIVIDADE",
      "cpf": "82424594287",
      "status": "Demitido",
      "data_admissao": "02/09/2013",
      "data_admissao_iso": "2013-09-02T03:00:00Z",
      "data_demissao": "03/02/2014",
      "data_demissao_iso": "2014-02-03T02:00:00Z",
      "email": "",
      "nome_funcao": "000225 - OPERADOR DE MAQ COLAGEM"
    },
    {
      "id_api": "562",
      "codigo": "000111",
      "matricula": "000111",
      "nome": "JANETE MONTEIRO MARQUES",
      "cpf": "59972629287",
      "status": "Demitido",
      "data_admissao": "02/09/2013",
      "data_admissao_iso": "2013-09-02T03:00:00Z",
      "data_demissao": "03/02/2014",
      "data_demissao_iso": "2014-02-03T02:00:00Z",
      "email": "",
      "nome_funcao": "000275 - Chefe de cozinha"
    },
    {
      "id_api": "1111",
      "codigo": "000112",
      "matricula": "000112",
      "nome": "JOAQUIM DA SILVA OLIVEIRA",
      "cpf": "33652937287",
      "status": "Demitido",
      "data_admissao": "02/09/2013",
      "data_admissao_iso": "2013-09-02T03:00:00Z",
      "data_demissao": "16/03/2014",
      "data_demissao_iso": "2014-03-16T03:00:00Z",
      "email": "",
      "nome_funcao": "000225 - OPERADOR DE MAQ COLAGEM"
    },
    {
      "id_api": "538",
      "codigo": "000113",
      "matricula": "000113",
      "nome": "JOSE MARIA MOTA DE CASTRO",
      "cpf": "3023346291",
      "status": "Demitido",
      "data_admissao": "02/09/2013",
      "data_admissao_iso": "2013-09-02T03:00:00Z",
      "data_demissao": "04/04/2014",
      "data_demissao_iso": "2014-04-04T03:00:00Z",
      "email": "",
      "nome_funcao": "000103 - VIGIA"
    },
    {
      "id_api": "624",
      "codigo": "000114",
      "matricula": "000114",
      "nome": "MAICON LOPES DA SILVA",
      "cpf": "99846306253",
      "status": "Demitido",
      "data_admissao": "02/09/2013",
      "data_admissao_iso": "2013-09-02T03:00:00Z",
      "data_demissao": "03/02/2014",
      "data_demissao_iso": "2014-02-03T02:00:00Z",
      "email": "",
      "nome_funcao": "000081 - LIDER SOLDADOR"
    },
    {
      "id_api": "602",
      "codigo": "000116",
      "matricula": "000116",
      "nome": "MARCELO DE LIMA GOMES",
      "cpf": "74821296268",
      "status": "Demitido",
      "data_admissao": "02/09/2013",
      "data_admissao_iso": "2013-09-02T03:00:00Z",
      "data_demissao": "31/07/2016",
      "data_demissao_iso": "2016-07-31T03:00:00Z",
      "email": "",
      "nome_funcao": "000044 - AJUDANTE DE CAMINHAO"
    },
    {
      "id_api": "758",
      "codigo": "000117",
      "matricula": "000117",
      "nome": "EUQUIAS GONCALVES FERNANDES",
      "cpf": "73024546200",
      "status": "Demitido",
      "data_admissao": "03/05/2013",
      "data_admissao_iso": "2013-05-03T03:00:00Z",
      "data_demissao": "24/02/2017",
      "data_demissao_iso": "2017-02-24T03:00:00Z",
      "email": "",
      "nome_funcao": "000029 - ANALISTA DE PCP "
    },
    {
      "id_api": "1083",
      "codigo": "000118",
      "matricula": "000118",
      "nome": "BENEDITO SEBASTIAO DA SILVA",
      "cpf": "7878087172",
      "status": "Demitido",
      "data_admissao": "01/10/2013",
      "data_admissao_iso": "2013-10-01T03:00:00Z",
      "data_demissao": "10/01/2019",
      "data_demissao_iso": "2019-01-10T02:00:00Z",
      "email": "",
      "nome_funcao": "000103 - VIGIA"
    },
    {
      "id_api": "553",
      "codigo": "000119",
      "matricula": "000119",
      "nome": "THICIANE MENEZES GURGEL DA SILVA",
      "cpf": "2159667242",
      "status": "Demitido",
      "data_admissao": "04/12/2013",
      "data_admissao_iso": "2013-12-04T02:00:00Z",
      "data_demissao": "10/01/2014",
      "data_demissao_iso": "2014-01-10T02:00:00Z",
      "email": "",
      "nome_funcao": "000039 - ASSISTENTE FINANCEIRO"
    },
    {
      "id_api": "1103",
      "codigo": "000121",
      "matricula": "000121",
      "nome": "REBECA SOUZA DO NASCIMENTO",
      "cpf": "1570890293",
      "status": "Demitido",
      "data_admissao": "18/03/2013",
      "data_admissao_iso": "2013-03-18T03:00:00Z",
      "data_demissao": "31/12/2014",
      "data_demissao_iso": "2014-12-31T02:00:00Z",
      "email": "",
      "nome_funcao": "000118 - ESTAGIARIO"
    },
    {
      "id_api": "657",
      "codigo": "000122",
      "matricula": "000122",
      "nome": "DEMETRIO JESUS DE MELO",
      "cpf": "57847843234",
      "status": "Demitido",
      "data_admissao": "15/01/2014",
      "data_admissao_iso": "2014-01-15T02:00:00Z",
      "data_demissao": "15/03/2014",
      "data_demissao_iso": "2014-03-15T03:00:00Z",
      "email": "",
      "nome_funcao": "000108 - VENDEDOR"
    },
    {
      "id_api": "930",
      "codigo": "000124",
      "matricula": "000124",
      "nome": "JEAN FEITOSA DE FREITAS",
      "cpf": "1474689221",
      "status": "Demitido",
      "data_admissao": "03/02/2014",
      "data_admissao_iso": "2014-02-03T02:00:00Z",
      "data_demissao": "20/05/2014",
      "data_demissao_iso": "2014-05-20T03:00:00Z",
      "email": "",
      "nome_funcao": "000081 - LIDER SOLDADOR"
    },
    {
      "id_api": "934",
      "codigo": "000127",
      "matricula": "000127",
      "nome": "ROSALIA FRANCA BATISTA",
      "cpf": "20088450287",
      "status": "Demitido",
      "data_admissao": "02/05/2012",
      "data_admissao_iso": "2012-05-02T03:00:00Z",
      "data_demissao": "26/05/2014",
      "data_demissao_iso": "2014-05-26T03:00:00Z",
      "email": "",
      "nome_funcao": "000124 - ASSISTENTE CONTABIL"
    },
    {
      "id_api": "569",
      "codigo": "000128",
      "matricula": "000128",
      "nome": "MAIKON BASTOS DA SILVA",
      "cpf": "95859772220",
      "status": "Demitido",
      "data_admissao": "03/03/2014",
      "data_admissao_iso": "2014-03-03T03:00:00Z",
      "data_demissao": "14/04/2014",
      "data_demissao_iso": "2014-04-14T03:00:00Z",
      "email": "",
      "nome_funcao": "000081 - LIDER SOLDADOR"
    },
    {
      "id_api": "658",
      "codigo": "000129",
      "matricula": "000129",
      "nome": "WENDELL PAULO DE LIMA",
      "cpf": "71972757253",
      "status": "Demitido",
      "data_admissao": "03/03/2014",
      "data_admissao_iso": "2014-03-03T03:00:00Z",
      "data_demissao": "02/06/2015",
      "data_demissao_iso": "2015-06-02T03:00:00Z",
      "email": "",
      "nome_funcao": "000121 - OPERADOR DE MAQ CARTONAGEM"
    },
    {
      "id_api": "539",
      "codigo": "000130",
      "matricula": "000130",
      "nome": "MARIA ELCICLEA ALCANTARA DA SILVA",
      "cpf": "48529745272",
      "status": "Demitido",
      "data_admissao": "03/03/2014",
      "data_admissao_iso": "2014-03-03T03:00:00Z",
      "data_demissao": "28/08/2014",
      "data_demissao_iso": "2014-08-28T03:00:00Z",
      "email": "",
      "nome_funcao": "000058 - COZINHEIRA"
    },
    {
      "id_api": "922",
      "codigo": "000132",
      "matricula": "000132",
      "nome": "RODRIGO DE SOUZA ALENCAR",
      "cpf": "3117273280",
      "status": "Demitido",
      "data_admissao": "05/03/2014",
      "data_admissao_iso": "2014-03-05T03:00:00Z",
      "data_demissao": "31/07/2014",
      "data_demissao_iso": "2014-07-31T03:00:00Z",
      "email": "",
      "nome_funcao": "000004 - APRENDIZ ASSIST ADM IND"
    },
    {
      "id_api": "1038",
      "codigo": "000133",
      "matricula": "000133",
      "nome": "ALFREDO RAULINO DE LIMA FILHO",
      "cpf": "1486090230",
      "status": "Demitido",
      "data_admissao": "07/03/2014",
      "data_admissao_iso": "2014-03-07T03:00:00Z",
      "data_demissao": "03/04/2017",
      "data_demissao_iso": "2017-04-03T03:00:00Z",
      "email": "",
      "nome_funcao": "000081 - LIDER SOLDADOR"
    },
    {
      "id_api": "897",
      "codigo": "000134",
      "matricula": "000134",
      "nome": "LEONARDO SANTOS DE OLIVEIRA",
      "cpf": "2507182270",
      "status": "Demitido",
      "data_admissao": "04/03/2014",
      "data_admissao_iso": "2014-03-04T03:00:00Z",
      "data_demissao": "14/04/2014",
      "data_demissao_iso": "2014-04-14T03:00:00Z",
      "email": "",
      "nome_funcao": "000030 - ASSISTENTE ADMINISTRATIVO"
    },
    {
      "id_api": "847",
      "codigo": "000137",
      "matricula": "000137",
      "nome": "HIGOR ROMARIO LIMA PEREIRA",
      "cpf": "856349216",
      "status": "Demitido",
      "data_admissao": "04/03/2014",
      "data_admissao_iso": "2014-03-04T03:00:00Z",
      "data_demissao": "15/12/2014",
      "data_demissao_iso": "2014-12-15T02:00:00Z",
      "email": "",
      "nome_funcao": "000118 - ESTAGIARIO"
    },
    {
      "id_api": "636",
      "codigo": "000138",
      "matricula": "000138",
      "nome": "ANTONIO CELIO DE CARVALHO VIEIRA",
      "cpf": "40606880291",
      "status": "Demitido",
      "data_admissao": "01/04/2014",
      "data_admissao_iso": "2014-04-01T03:00:00Z",
      "data_demissao": "31/07/2014",
      "data_demissao_iso": "2014-07-31T03:00:00Z",
      "email": "",
      "nome_funcao": "000103 - VIGIA"
    },
    {
      "id_api": "1112",
      "codigo": "000139",
      "matricula": "000139",
      "nome": "LUCAS FERNANDES DE OLIVEIRA",
      "cpf": "2473770239",
      "status": "Demitido",
      "data_admissao": "01/04/2014",
      "data_admissao_iso": "2014-04-01T03:00:00Z",
      "data_demissao": "02/07/2014",
      "data_demissao_iso": "2014-07-02T03:00:00Z",
      "email": "",
      "nome_funcao": "000004 - APRENDIZ ASSIST ADM IND"
    },
    {
      "id_api": "675",
      "codigo": "000140",
      "matricula": "000140",
      "nome": "IVALDO MARANHAO DE SOUZA JUNIOR",
      "cpf": "677516282",
      "status": "Demitido",
      "data_admissao": "05/05/2014",
      "data_admissao_iso": "2014-05-05T03:00:00Z",
      "data_demissao": "03/07/2014",
      "data_demissao_iso": "2014-07-03T03:00:00Z",
      "email": "",
      "nome_funcao": "000081 - LIDER SOLDADOR"
    },
    {
      "id_api": "912",
      "codigo": "000141",
      "matricula": "000141",
      "nome": "LUCIANO LEITE DOS SANTOS",
      "cpf": "1606755293",
      "status": "Demitido",
      "data_admissao": "05/05/2014",
      "data_admissao_iso": "2014-05-05T03:00:00Z",
      "data_demissao": "28/07/2016",
      "data_demissao_iso": "2016-07-28T03:00:00Z",
      "email": "",
      "nome_funcao": "000031 - AUX. DE DESENVOLVIMENTO"
    },
    {
      "id_api": "591",
      "codigo": "000142",
      "matricula": "000142",
      "nome": "SILVI SOARES SAMPAIO",
      "cpf": "72132221200",
      "status": "Demitido",
      "data_admissao": "05/05/2014",
      "data_admissao_iso": "2014-05-05T03:00:00Z",
      "data_demissao": "02/05/2016",
      "data_demissao_iso": "2016-05-02T03:00:00Z",
      "email": "",
      "nome_funcao": "000081 - LIDER SOLDADOR"
    },
    {
      "id_api": "674",
      "codigo": "000143",
      "matricula": "000143",
      "nome": "DERYC TEIXEIRA DA SILVA",
      "cpf": "1711048208",
      "status": "Demitido",
      "data_admissao": "05/05/2014",
      "data_admissao_iso": "2014-05-05T03:00:00Z",
      "data_demissao": "28/07/2016",
      "data_demissao_iso": "2016-07-28T03:00:00Z",
      "email": "",
      "nome_funcao": "000081 - LIDER SOLDADOR"
    },
    {
      "id_api": "684",
      "codigo": "000144",
      "matricula": "000144",
      "nome": "FRANCISCA DAS CHAGAS MATOS DE SOUZA",
      "cpf": "91274729220",
      "status": "Demitido",
      "data_admissao": "05/05/2014",
      "data_admissao_iso": "2014-05-05T03:00:00Z",
      "data_demissao": "02/05/2016",
      "data_demissao_iso": "2016-05-02T03:00:00Z",
      "email": "",
      "nome_funcao": "000110 - ENCARREGADO DE DP"
    },
    {
      "id_api": "146",
      "codigo": "000145",
      "matricula": "000145",
      "nome": "SILVIA CAROLINA DA SILVA SOARES",
      "cpf": "76721337215",
      "status": "Demitido",
      "data_admissao": "05/05/2014",
      "data_admissao_iso": "2014-05-05T03:00:00Z",
      "data_demissao": "02/05/2016",
      "data_demissao_iso": "2016-05-02T03:00:00Z",
      "email": "",
      "nome_funcao": "000133 - ANALISTA DE DP"
    },
    {
      "id_api": "641",
      "codigo": "000147",
      "matricula": "000147",
      "nome": "MARCIA ANDREIA AGUIAR DE OLIVEIRA",
      "cpf": "88270726249",
      "status": "Demitido",
      "data_admissao": "01/07/2014",
      "data_admissao_iso": "2014-07-01T03:00:00Z",
      "data_demissao": "01/01/2015",
      "data_demissao_iso": "2015-01-01T02:00:00Z",
      "email": "",
      "nome_funcao": "000118 - ESTAGIARIO"
    },
    {
      "id_api": "48",
      "codigo": "000148",
      "matricula": "000148",
      "nome": "WEDLEY FERNANDES DOS SANTOS",
      "cpf": "1934949221",
      "status": "Demitido",
      "data_admissao": "01/08/2014",
      "data_admissao_iso": "2014-08-01T03:00:00Z",
      "data_demissao": "15/09/2014",
      "data_demissao_iso": "2014-09-15T03:00:00Z",
      "email": "",
      "nome_funcao": "000143 - ASSIST FISCAL"
    },
    {
      "id_api": "905",
      "codigo": "000149",
      "matricula": "000149",
      "nome": "FRANCISCO DAS CHAGAS BRITO LIMA",
      "cpf": "25079956372",
      "status": "Demitido",
      "data_admissao": "01/08/2014",
      "data_admissao_iso": "2014-08-01T03:00:00Z",
      "data_demissao": "02/05/2016",
      "data_demissao_iso": "2016-05-02T03:00:00Z",
      "email": "",
      "nome_funcao": "000103 - VIGIA"
    },
    {
      "id_api": "570",
      "codigo": "000150",
      "matricula": "000150",
      "nome": "FRANCISMARA FREITAS DE NEVES",
      "cpf": "24018279",
      "status": "Demitido",
      "data_admissao": "01/08/2014",
      "data_admissao_iso": "2014-08-01T03:00:00Z",
      "data_demissao": "30/08/2014",
      "data_demissao_iso": "2014-08-30T03:00:00Z",
      "email": "",
      "nome_funcao": "000196 - AUX. DE COZINHA"
    },
    {
      "id_api": "692",
      "codigo": "000151",
      "matricula": "000151",
      "nome": "JACKSON NEVES DE FRANCA NETO",
      "cpf": "436556294",
      "status": "Demitido",
      "data_admissao": "15/09/2014",
      "data_admissao_iso": "2014-09-15T03:00:00Z",
      "data_demissao": "10/09/2015",
      "data_demissao_iso": "2015-09-10T03:00:00Z",
      "email": "",
      "nome_funcao": "000004 - APRENDIZ ASSIST ADM IND"
    },
    {
      "id_api": "1113",
      "codigo": "000152",
      "matricula": "000152",
      "nome": "JOAB DE SOUZA MARQUES",
      "cpf": "2611682232",
      "status": "Demitido",
      "data_admissao": "15/09/2014",
      "data_admissao_iso": "2014-09-15T03:00:00Z",
      "data_demissao": "14/09/2016",
      "data_demissao_iso": "2016-09-14T03:00:00Z",
      "email": "",
      "nome_funcao": "000004 - APRENDIZ ASSIST ADM IND"
    },
    {
      "id_api": "924",
      "codigo": "000153",
      "matricula": "000153",
      "nome": "AMILY DANDARA DOS SANTOS PIMENTEL",
      "cpf": "84017171249",
      "status": "Demitido",
      "data_admissao": "01/10/2014",
      "data_admissao_iso": "2014-10-01T03:00:00Z",
      "data_demissao": "07/08/2015",
      "data_demissao_iso": "2015-08-07T03:00:00Z",
      "email": "",
      "nome_funcao": "000143 - ASSIST FISCAL"
    },
    {
      "id_api": "540",
      "codigo": "000154",
      "matricula": "000154",
      "nome": "ALINE SILVA GALUCIO",
      "cpf": "3068071224",
      "status": "Demitido",
      "data_admissao": "01/10/2014",
      "data_admissao_iso": "2014-10-01T03:00:00Z",
      "data_demissao": "02/05/2016",
      "data_demissao_iso": "2016-05-02T03:00:00Z",
      "email": "",
      "nome_funcao": "000137 - AUXILIAR FISCAL"
    },
    {
      "id_api": "617",
      "codigo": "000155",
      "matricula": "000155",
      "nome": "LUAN ROSSY DE ALMEIDA",
      "cpf": "2365091288",
      "status": "Demitido",
      "data_admissao": "01/10/2014",
      "data_admissao_iso": "2014-10-01T03:00:00Z",
      "data_demissao": "03/09/2015",
      "data_demissao_iso": "2015-09-03T03:00:00Z",
      "email": "",
      "nome_funcao": "000275 - Chefe de cozinha"
    },
    {
      "id_api": "1005",
      "codigo": "000156",
      "matricula": "000156",
      "nome": "DOUGLAS ISIDORO FERREIRA",
      "cpf": "969881266",
      "status": "Demitido",
      "data_admissao": "01/10/2014",
      "data_admissao_iso": "2014-10-01T03:00:00Z",
      "data_demissao": "30/10/2014",
      "data_demissao_iso": "2014-10-30T02:00:00Z",
      "email": "",
      "nome_funcao": "000081 - LIDER SOLDADOR"
    },
    {
      "id_api": "592",
      "codigo": "000158",
      "matricula": "000158",
      "nome": "HELLEN CESAR UCHOA",
      "cpf": "70349614253",
      "status": "Demitido",
      "data_admissao": "05/01/2015",
      "data_admissao_iso": "2015-01-05T02:00:00Z",
      "data_demissao": "31/07/2016",
      "data_demissao_iso": "2016-07-31T03:00:00Z",
      "email": "",
      "nome_funcao": "000046 - LIDER ALMOXARIFE"
    },
    {
      "id_api": "665",
      "codigo": "000159",
      "matricula": "000159",
      "nome": "LEANDRA PEREIRA DA SILVA",
      "cpf": "74420224215",
      "status": "Demitido",
      "data_admissao": "05/01/2015",
      "data_admissao_iso": "2015-01-05T02:00:00Z",
      "data_demissao": "03/08/2016",
      "data_demissao_iso": "2016-08-03T03:00:00Z",
      "email": "",
      "nome_funcao": "000058 - COZINHEIRA"
    },
    {
      "id_api": "625",
      "codigo": "000160",
      "matricula": "000160",
      "nome": "NEIDE APARECIDA DO CARMO BARBOSA",
      "cpf": "66756588834",
      "status": "Demitido",
      "data_admissao": "02/06/2014",
      "data_admissao_iso": "2014-06-02T03:00:00Z",
      "data_demissao": "05/05/2015",
      "data_demissao_iso": "2015-05-05T03:00:00Z",
      "email": "",
      "nome_funcao": "000037 - ENCARREGADO DE PRODUÇAO"
    },
    {
      "id_api": "659",
      "codigo": "000165",
      "matricula": "000165",
      "nome": "THIAGO LEAL SILVA",
      "cpf": "1214889263",
      "status": "Demitido",
      "data_admissao": "01/07/2015",
      "data_admissao_iso": "2015-07-01T03:00:00Z",
      "data_demissao": "19/10/2015",
      "data_demissao_iso": "2015-10-19T02:00:00Z",
      "email": "",
      "nome_funcao": "000019 - INSPETOR DE QUALIDADE"
    },
    {
      "id_api": "898",
      "codigo": "000166",
      "matricula": "000166",
      "nome": "RONIERY DOS SANTOS OLIVEIRA",
      "cpf": "60952440210",
      "status": "Demitido",
      "data_admissao": "09/11/2015",
      "data_admissao_iso": "2015-11-09T02:00:00Z",
      "data_demissao": "03/07/2018",
      "data_demissao_iso": "2018-07-03T03:00:00Z",
      "email": "",
      "nome_funcao": "000275 - Chefe de cozinha"
    },
    {
      "id_api": "1021",
      "codigo": "000168",
      "matricula": "000168",
      "nome": "CARLOS ALBERTO DA SILVA FILHO",
      "cpf": "51926229215",
      "status": "Demitido",
      "data_admissao": "08/03/2016",
      "data_admissao_iso": "2016-03-08T03:00:00Z",
      "data_demissao": "31/07/2016",
      "data_demissao_iso": "2016-07-31T03:00:00Z",
      "email": "",
      "nome_funcao": "000052 - LIDER OPERADOR DE MAQ IMPRESSORA"
    },
    {
      "id_api": "1047",
      "codigo": "000169",
      "matricula": "000169",
      "nome": "ANA CARLA FREITAS SALABERT DA SILVA",
      "cpf": "71738479234",
      "status": "Demitido",
      "data_admissao": "17/03/2016",
      "data_admissao_iso": "2016-03-17T03:00:00Z",
      "data_demissao": "01/06/2016",
      "data_demissao_iso": "2016-06-01T03:00:00Z",
      "email": "",
      "nome_funcao": "000084 - AUXILIAR DE QUALIDADE"
    },
    {
      "id_api": "1048",
      "codigo": "000170",
      "matricula": "000170",
      "nome": "ROGERIO LIMA DE FREITAS",
      "cpf": "71342214234",
      "status": "Demitido",
      "data_admissao": "02/05/2016",
      "data_admissao_iso": "2016-05-02T03:00:00Z",
      "data_demissao": "31/07/2016",
      "data_demissao_iso": "2016-07-31T03:00:00Z",
      "email": "",
      "nome_funcao": "000108 - VENDEDOR"
    },
    {
      "id_api": "1040",
      "codigo": "000171",
      "matricula": "000171",
      "nome": "CAIO FABIO ROSAS LOPES LIMA",
      "cpf": "2770561286",
      "status": "Demitido",
      "data_admissao": "09/05/2016",
      "data_admissao_iso": "2016-05-09T03:00:00Z",
      "data_demissao": "11/11/2016",
      "data_demissao_iso": "2016-11-11T02:00:00Z",
      "email": "",
      "nome_funcao": "000081 - LIDER SOLDADOR"
    },
    {
      "id_api": "1080",
      "codigo": "000172",
      "matricula": "000172",
      "nome": "SIDNEY DA SILVA PINHEIRO",
      "cpf": "417934203",
      "status": "Demitido",
      "data_admissao": "09/05/2016",
      "data_admissao_iso": "2016-05-09T03:00:00Z",
      "data_demissao": "12/06/2020",
      "data_demissao_iso": "2020-06-12T03:00:00Z",
      "email": "",
      "nome_funcao": "000034 - LIDER DE COLAGEM"
    },
    {
      "id_api": "713",
      "codigo": "000173",
      "matricula": "000173",
      "nome": "FRANCIMAR CARDOSO BENTO",
      "cpf": "1280354208",
      "status": "Demitido",
      "data_admissao": "09/05/2016",
      "data_admissao_iso": "2016-05-09T03:00:00Z",
      "data_demissao": "19/09/2016",
      "data_demissao_iso": "2016-09-19T03:00:00Z",
      "email": "",
      "nome_funcao": "000081 - LIDER SOLDADOR"
    },
    {
      "id_api": "1020",
      "codigo": "000174",
      "matricula": "000174",
      "nome": "JOAO BATISTA DE AZEVEDO MARTINS",
      "cpf": "36677604268",
      "status": "Demitido",
      "data_admissao": "18/01/2016",
      "data_admissao_iso": "2016-01-18T02:00:00Z",
      "data_demissao": "31/07/2016",
      "data_demissao_iso": "2016-07-31T03:00:00Z",
      "email": "",
      "nome_funcao": "000044 - AJUDANTE DE CAMINHAO"
    },
    {
      "id_api": "914",
      "codigo": "000175",
      "matricula": "000175",
      "nome": "GENILSON DE BRITO CARVALHO",
      "cpf": "69342628249",
      "status": "Demitido",
      "data_admissao": "02/03/2015",
      "data_admissao_iso": "2015-03-02T03:00:00Z",
      "data_demissao": "31/07/2016",
      "data_demissao_iso": "2016-07-31T03:00:00Z",
      "email": "",
      "nome_funcao": "000044 - AJUDANTE DE CAMINHAO"
    },
    {
      "id_api": "1031",
      "codigo": "000177",
      "matricula": "000177",
      "nome": "LARISSA KNAUER PENEDO TENEDINI",
      "cpf": "474314235",
      "status": "Demitido",
      "data_admissao": "19/03/2015",
      "data_admissao_iso": "2015-03-19T03:00:00Z",
      "data_demissao": "09/02/2017",
      "data_demissao_iso": "2017-02-09T02:00:00Z",
      "email": "",
      "nome_funcao": "000091 - ANALISTA DE R&S"
    },
    {
      "id_api": "36",
      "codigo": "000178",
      "matricula": "000178",
      "nome": "CAROLINE NIJENHUIS DE SANTIS",
      "cpf": "76120473220",
      "status": "Demitido",
      "data_admissao": "02/01/2007",
      "data_admissao_iso": "2007-01-02T02:00:00Z",
      "data_demissao": "16/08/2018",
      "data_demissao_iso": "2018-08-16T03:00:00Z",
      "email": "",
      "nome_funcao": "000140 - VENDEDOR EXTERNO"
    },
    {
      "id_api": "1072",
      "codigo": "000179",
      "matricula": "000179",
      "nome": "RODRIGO DE SOUZA ALENCAR",
      "cpf": "3117273280",
      "status": "Demitido",
      "data_admissao": "01/09/2014",
      "data_admissao_iso": "2014-09-01T03:00:00Z",
      "data_demissao": "20/02/2020",
      "data_demissao_iso": "2020-02-20T03:00:00Z",
      "email": "",
      "nome_funcao": "000012 - ASSISTENTE ADMINISTRATIVO"
    },
    {
      "id_api": "54",
      "codigo": "000180",
      "matricula": "000180",
      "nome": "THALITA PEREIRA DA SILVA",
      "cpf": "2298321213",
      "status": "Demitido",
      "data_admissao": "02/02/2016",
      "data_admissao_iso": "2016-02-02T02:00:00Z",
      "data_demissao": "03/02/2017",
      "data_demissao_iso": "2017-02-03T02:00:00Z",
      "email": "",
      "nome_funcao": "000030 - ASSISTENTE ADMINISTRATIVO"
    },
    {
      "id_api": "943",
      "codigo": "000181",
      "matricula": "000181",
      "nome": "JOSENILSON VIEIRA DA SILVA",
      "cpf": "1585498211",
      "status": "Demitido",
      "data_admissao": "03/11/2014",
      "data_admissao_iso": "2014-11-03T02:00:00Z",
      "data_demissao": "23/08/2020",
      "data_demissao_iso": "2020-08-23T03:00:00Z",
      "email": "",
      "nome_funcao": "000031 - AUX. DE DESENVOLVIMENTO"
    },
    {
      "id_api": "676",
      "codigo": "000182",
      "matricula": "000182",
      "nome": "DIONE ENCARNACAO ARRUDA",
      "cpf": "99143720234",
      "status": "Demitido",
      "data_admissao": "16/12/2015",
      "data_admissao_iso": "2015-12-16T02:00:00Z",
      "data_demissao": "28/07/2016",
      "data_demissao_iso": "2016-07-28T03:00:00Z",
      "email": "",
      "nome_funcao": "000081 - LIDER SOLDADOR"
    },
    {
      "id_api": "1033",
      "codigo": "000183",
      "matricula": "000183",
      "nome": "LUAN MULLER DA SILVA",
      "cpf": "2937371264",
      "status": "Demitido",
      "data_admissao": "16/12/2015",
      "data_admissao_iso": "2015-12-16T02:00:00Z",
      "data_demissao": "13/04/2017",
      "data_demissao_iso": "2017-04-13T03:00:00Z",
      "email": "",
      "nome_funcao": "000081 - LIDER SOLDADOR"
    },
    {
      "id_api": "609",
      "codigo": "000184",
      "matricula": "000184",
      "nome": "WESLEY IGOR MESQUITA SOARES",
      "cpf": "2634092288",
      "status": "Demitido",
      "data_admissao": "16/12/2015",
      "data_admissao_iso": "2015-12-16T02:00:00Z",
      "data_demissao": "04/07/2016",
      "data_demissao_iso": "2016-07-04T03:00:00Z",
      "email": "",
      "nome_funcao": "000081 - LIDER SOLDADOR"
    },
    {
      "id_api": "461",
      "codigo": "000185",
      "matricula": "000185",
      "nome": "ROSANA DA SILVA BAHIA",
      "cpf": "145112233",
      "status": "Demitido",
      "data_admissao": "01/09/2014",
      "data_admissao_iso": "2014-09-01T03:00:00Z",
      "data_demissao": "28/07/2016",
      "data_demissao_iso": "2016-07-28T03:00:00Z",
      "email": "",
      "nome_funcao": "000196 - AUX. DE COZINHA"
    },
    {
      "id_api": "52",
      "codigo": "000186",
      "matricula": "000186",
      "nome": "ADRIANO MELO GOMES",
      "cpf": "78977592291",
      "status": "Demitido",
      "data_admissao": "10/03/2015",
      "data_admissao_iso": "2015-03-10T03:00:00Z",
      "data_demissao": "13/11/2017",
      "data_demissao_iso": "2017-11-13T02:00:00Z",
      "email": "",
      "nome_funcao": "000116 - OPERADOR DE MAQ IMPRESSORA"
    },
    {
      "id_api": "744",
      "codigo": "000187",
      "matricula": "000187",
      "nome": "ALEXANDRE PEREIRA SANTOS MIRANDA",
      "cpf": "2378562209",
      "status": "Demitido",
      "data_admissao": "14/03/2016",
      "data_admissao_iso": "2016-03-14T03:00:00Z",
      "data_demissao": "12/02/2018",
      "data_demissao_iso": "2018-02-12T02:00:00Z",
      "email": "",
      "nome_funcao": "000081 - LIDER SOLDADOR"
    },
    {
      "id_api": "585",
      "codigo": "000188",
      "matricula": "000188",
      "nome": "EZEQUIEL LOPES DA SILVA",
      "cpf": "439235260",
      "status": "Demitido",
      "data_admissao": "11/11/2015",
      "data_admissao_iso": "2015-11-11T02:00:00Z",
      "data_demissao": "04/07/2016",
      "data_demissao_iso": "2016-07-04T03:00:00Z",
      "email": "",
      "nome_funcao": "000081 - LIDER SOLDADOR"
    },
    {
      "id_api": "1000",
      "codigo": "000190",
      "matricula": "000190",
      "nome": "PAULO CEZAR GOMES CORTEZ",
      "cpf": "77359399220",
      "status": "Demitido",
      "data_admissao": "12/04/2016",
      "data_admissao_iso": "2016-04-12T03:00:00Z",
      "data_demissao": "25/10/2017",
      "data_demissao_iso": "2017-10-25T02:00:00Z",
      "email": "",
      "nome_funcao": "000081 - LIDER SOLDADOR"
    },
    {
      "id_api": "931",
      "codigo": "000191",
      "matricula": "000191",
      "nome": "REGINALDO OLIVEIRA DA SILVA",
      "cpf": "47325615272",
      "status": "Demitido",
      "data_admissao": "01/09/2014",
      "data_admissao_iso": "2014-09-01T03:00:00Z",
      "data_demissao": "28/07/2016",
      "data_demissao_iso": "2016-07-28T03:00:00Z",
      "email": "",
      "nome_funcao": "000081 - LIDER SOLDADOR"
    },
    {
      "id_api": "923",
      "codigo": "000192",
      "matricula": "000192",
      "nome": "SEBASTIAO SILAS NERY SOARES",
      "cpf": "38408317253",
      "status": "Demitido",
      "data_admissao": "25/09/2014",
      "data_admissao_iso": "2014-09-25T03:00:00Z",
      "data_demissao": "28/07/2016",
      "data_demissao_iso": "2016-07-28T03:00:00Z",
      "email": "",
      "nome_funcao": "000081 - LIDER SOLDADOR"
    },
    {
      "id_api": "548",
      "codigo": "000194",
      "matricula": "000194",
      "nome": "IVAN DA SILVA MARTINS",
      "cpf": "27298205234",
      "status": "Demitido",
      "data_admissao": "01/09/2014",
      "data_admissao_iso": "2014-09-01T03:00:00Z",
      "data_demissao": "28/07/2016",
      "data_demissao_iso": "2016-07-28T03:00:00Z",
      "email": "",
      "nome_funcao": "000105 - AUX. DE SERVICOS GERAIS"
    },
    {
      "id_api": "718",
      "codigo": "000195",
      "matricula": "000195",
      "nome": "IZAURO CAMPOS SALVADOR",
      "cpf": "63115840268",
      "status": "Demitido",
      "data_admissao": "16/12/2015",
      "data_admissao_iso": "2015-12-16T02:00:00Z",
      "data_demissao": "21/06/2017",
      "data_demissao_iso": "2017-06-21T03:00:00Z",
      "email": "",
      "nome_funcao": "000105 - AUX. DE SERVICOS GERAIS"
    },
    {
      "id_api": "833",
      "codigo": "000196",
      "matricula": "000196",
      "nome": "MARIA DO CARMO DE SOUZA PORTELA",
      "cpf": "40636100200",
      "status": "Demitido",
      "data_admissao": "02/02/2015",
      "data_admissao_iso": "2015-02-02T02:00:00Z",
      "data_demissao": "30/08/2017",
      "data_demissao_iso": "2017-08-30T03:00:00Z",
      "email": "",
      "nome_funcao": "000196 - AUX. DE COZINHA"
    },
    {
      "id_api": "47",
      "codigo": "000198",
      "matricula": "000198",
      "nome": "ANA CAROLINA TEIXEIRA DA SILVA",
      "cpf": "95673067291",
      "status": "Demitido",
      "data_admissao": "16/05/2014",
      "data_admissao_iso": "2014-05-16T03:00:00Z",
      "data_demissao": "02/05/2019",
      "data_demissao_iso": "2019-05-02T03:00:00Z",
      "email": "",
      "nome_funcao": "000058 - COZINHEIRA"
    },
    {
      "id_api": "666",
      "codigo": "000199",
      "matricula": "000199",
      "nome": "ANA LUCIA DE SOUZA BENTES",
      "cpf": "29101832204",
      "status": "Demitido",
      "data_admissao": "02/03/2015",
      "data_admissao_iso": "2015-03-02T03:00:00Z",
      "data_demissao": "03/09/2018",
      "data_demissao_iso": "2018-09-03T03:00:00Z",
      "email": "",
      "nome_funcao": "000058 - COZINHEIRA"
    },
    {
      "id_api": "1071",
      "codigo": "000200",
      "matricula": "000200",
      "nome": "VITORIO NIJENHUIS",
      "cpf": "43573258204",
      "status": "Demitido",
      "data_admissao": "01/09/2014",
      "data_admissao_iso": "2014-09-01T03:00:00Z",
      "data_demissao": "17/09/2020",
      "data_demissao_iso": "2020-09-17T03:00:00Z",
      "email": "",
      "nome_funcao": "000059 - DIRETOR GERAL DE EMPRESA E ORGANIZACOES"
    },
    {
      "id_api": "51",
      "codigo": "000201",
      "matricula": "000201",
      "nome": "ANTONIO MARCOS SOARES GURGEL",
      "cpf": "64082024204",
      "status": "Demitido",
      "data_admissao": "10/02/2015",
      "data_admissao_iso": "2015-02-10T02:00:00Z",
      "data_demissao": "17/01/2017",
      "data_demissao_iso": "2017-01-17T02:00:00Z",
      "email": "",
      "nome_funcao": "000021 - ENCARREGADO DE LABORATORIO CQ"
    },
    {
      "id_api": "1013",
      "codigo": "000203",
      "matricula": "000203",
      "nome": "ANTONIO CARLOS SOUZA DO NASCIMENTO",
      "cpf": "409409260",
      "status": "Demitido",
      "data_admissao": "03/03/2014",
      "data_admissao_iso": "2014-03-03T03:00:00Z",
      "data_demissao": "17/07/2017",
      "data_demissao_iso": "2017-07-17T03:00:00Z",
      "email": "",
      "nome_funcao": "000119 - FATURISTA"
    },
    {
      "id_api": "1030",
      "codigo": "000204",
      "matricula": "000204",
      "nome": "EMIDIO MAR DE SOUZA",
      "cpf": "64084159204",
      "status": "Demitido",
      "data_admissao": "22/04/2014",
      "data_admissao_iso": "2014-04-22T03:00:00Z",
      "data_demissao": "26/02/2018",
      "data_demissao_iso": "2018-02-26T03:00:00Z",
      "email": "",
      "nome_funcao": "000119 - FATURISTA"
    },
    {
      "id_api": "40",
      "codigo": "000205",
      "matricula": "000205",
      "nome": "HERBERT NYENHUIS",
      "cpf": "34499920230",
      "status": "Demitido",
      "data_admissao": "01/04/2013",
      "data_admissao_iso": "2013-04-01T03:00:00Z",
      "data_demissao": "20/03/2017",
      "data_demissao_iso": "2017-03-20T03:00:00Z",
      "email": "",
      "nome_funcao": "000070 - GERENTE DE LOGISTICA"
    },
    {
      "id_api": "107",
      "codigo": "000206",
      "matricula": "000206",
      "nome": "EDNA BARBOSA NYENHUIS",
      "cpf": "30965560244",
      "status": "Demitido",
      "data_admissao": "01/02/2007",
      "data_admissao_iso": "2007-02-01T02:00:00Z",
      "data_demissao": "15/05/2018",
      "data_demissao_iso": "2018-05-15T03:00:00Z",
      "email": "",
      "nome_funcao": "000073 - GERENTE DE RH"
    },
    {
      "id_api": "773",
      "codigo": "000207",
      "matricula": "000207",
      "nome": "JOAQUIM DA SILVA OLIVEIRA",
      "cpf": "33652937287",
      "status": "Demitido",
      "data_admissao": "02/09/2013",
      "data_admissao_iso": "2013-09-02T03:00:00Z",
      "data_demissao": "13/07/2017",
      "data_demissao_iso": "2017-07-13T03:00:00Z",
      "email": "",
      "nome_funcao": "000034 - LIDER DE COLAGEM"
    },
    {
      "id_api": "1079",
      "codigo": "000208",
      "matricula": "000208",
      "nome": "ROSINALDO SOUZA COSTA",
      "cpf": "53699645215",
      "status": "Demitido",
      "data_admissao": "02/09/2013",
      "data_admissao_iso": "2013-09-02T03:00:00Z",
      "data_demissao": "25/01/2019",
      "data_demissao_iso": "2019-01-25T02:00:00Z",
      "email": "",
      "nome_funcao": "000131 - ANALISTA DE DESENVOLVIMENTO"
    },
    {
      "id_api": "1032",
      "codigo": "000210",
      "matricula": "000210",
      "nome": "ANTONIO CARLOS OLIVEIRA DE VASCONCELOS",
      "cpf": "56471718268",
      "status": "Demitido",
      "data_admissao": "20/03/2015",
      "data_admissao_iso": "2015-03-20T03:00:00Z",
      "data_demissao": "17/05/2018",
      "data_demissao_iso": "2018-05-17T03:00:00Z",
      "email": "",
      "nome_funcao": "000052 - LIDER OPERADOR DE MAQ IMPRESSORA"
    },
    {
      "id_api": "1006",
      "codigo": "000211",
      "matricula": "000211",
      "nome": "ROBENILSON LOPES NOGUEIRA",
      "cpf": "54541646234",
      "status": "Demitido",
      "data_admissao": "03/11/2014",
      "data_admissao_iso": "2014-11-03T02:00:00Z",
      "data_demissao": "04/05/2017",
      "data_demissao_iso": "2017-05-04T03:00:00Z",
      "email": "",
      "nome_funcao": "000281 - MECANICO"
    },
    {
      "id_api": "743",
      "codigo": "000212",
      "matricula": "000212",
      "nome": "MARIO LUCIO BARROS SOARES",
      "cpf": "64408930253",
      "status": "Demitido",
      "data_admissao": "02/09/2013",
      "data_admissao_iso": "2013-09-02T03:00:00Z",
      "data_demissao": "31/07/2016",
      "data_demissao_iso": "2016-07-31T03:00:00Z",
      "email": "",
      "nome_funcao": "000108 - VENDEDOR"
    },
    {
      "id_api": "929",
      "codigo": "000213",
      "matricula": "000213",
      "nome": "RUBEM CELSO PEREIRA DE ASSIS",
      "cpf": "34649077249",
      "status": "Demitido",
      "data_admissao": "15/07/2013",
      "data_admissao_iso": "2013-07-15T03:00:00Z",
      "data_demissao": "31/07/2016",
      "data_demissao_iso": "2016-07-31T03:00:00Z",
      "email": "",
      "nome_funcao": "000001 - MOTORISTA CARRETEIRO"
    },
    {
      "id_api": "1014",
      "codigo": "000214",
      "matricula": "000214",
      "nome": "DEUSIVAM AMAZONAS DA CUNHA",
      "cpf": "3050198214",
      "status": "Demitido",
      "data_admissao": "13/03/2014",
      "data_admissao_iso": "2014-03-13T03:00:00Z",
      "data_demissao": "08/02/2017",
      "data_demissao_iso": "2017-02-08T02:00:00Z",
      "email": "",
      "nome_funcao": "000040 - OPERADOR DE MAQ GRAMPEADEIRA"
    },
    {
      "id_api": "712",
      "codigo": "000215",
      "matricula": "000215",
      "nome": "RAIMUNDO DA SILVA MIRANDA",
      "cpf": "31517960282",
      "status": "Demitido",
      "data_admissao": "14/03/2014",
      "data_admissao_iso": "2014-03-14T03:00:00Z",
      "data_demissao": "14/06/2018",
      "data_demissao_iso": "2018-06-14T03:00:00Z",
      "email": "",
      "nome_funcao": "000040 - OPERADOR DE MAQ GRAMPEADEIRA"
    },
    {
      "id_api": "1059",
      "codigo": "000216",
      "matricula": "000216",
      "nome": "PATRICIO PEREIRA COSTA",
      "cpf": "1463384211",
      "status": "Demitido",
      "data_admissao": "03/02/2015",
      "data_admissao_iso": "2015-02-03T02:00:00Z",
      "data_demissao": "01/06/2017",
      "data_demissao_iso": "2017-06-01T03:00:00Z",
      "email": "",
      "nome_funcao": "000121 - OPERADOR DE MAQ CARTONAGEM"
    },
    {
      "id_api": "42",
      "codigo": "000217",
      "matricula": "000217",
      "nome": "BENEILSO DEVEZAS DE SOUSA",
      "cpf": "729954242",
      "status": "Demitido",
      "data_admissao": "02/09/2013",
      "data_admissao_iso": "2013-09-02T03:00:00Z",
      "data_demissao": "25/09/2018",
      "data_demissao_iso": "2018-09-25T03:00:00Z",
      "email": "",
      "nome_funcao": "000052 - LIDER OPERADOR DE MAQ IMPRESSORA"
    },
    {
      "id_api": "139",
      "codigo": "000218",
      "matricula": "000218",
      "nome": "CARLOS EDUARDO BRAGA DE OLIVEIRA",
      "cpf": "70478066287",
      "status": "Demitido",
      "data_admissao": "01/07/2015",
      "data_admissao_iso": "2015-07-01T03:00:00Z",
      "data_demissao": "11/04/2022",
      "data_demissao_iso": "2022-04-11T03:00:00Z",
      "email": "",
      "nome_funcao": "000049 - LIDER OPERADOR DE MAQ CARTONAGEM"
    },
    {
      "id_api": "1060",
      "codigo": "000219",
      "matricula": "000219",
      "nome": "NIVALDO FURTADO DA SILVA FILHO",
      "cpf": "85129283287",
      "status": "Demitido",
      "data_admissao": "16/12/2015",
      "data_admissao_iso": "2015-12-16T02:00:00Z",
      "data_demissao": "31/10/2016",
      "data_demissao_iso": "2016-10-31T02:00:00Z",
      "email": "",
      "nome_funcao": "000116 - OPERADOR DE MAQ IMPRESSORA"
    },
    {
      "id_api": "1068",
      "codigo": "000220",
      "matricula": "000220",
      "nome": "MARIA ERCILA NOGUEIRA DE SOUZA",
      "cpf": "47469528253",
      "status": "Demitido",
      "data_admissao": "01/04/2010",
      "data_admissao_iso": "2010-04-01T03:00:00Z",
      "data_demissao": "31/08/2021",
      "data_demissao_iso": "2021-08-31T03:00:00Z",
      "email": "",
      "nome_funcao": "000141 - ENCARREGADO DE SERVIÇOS GERAIS"
    },
    {
      "id_api": "1090",
      "codigo": "000221",
      "matricula": "000221",
      "nome": "LUCINEIDE SILVA SOUZA",
      "cpf": "23105569200",
      "status": "Demitido",
      "data_admissao": "01/12/2014",
      "data_admissao_iso": "2014-12-01T02:00:00Z",
      "data_demissao": "20/06/2021",
      "data_demissao_iso": "2021-06-20T03:00:00Z",
      "email": "",
      "nome_funcao": "000148 - VENDEDOR EXTERNO"
    },
    {
      "id_api": "14",
      "codigo": "000223",
      "matricula": "000223",
      "nome": "ARLICLEY CORREA DE CARVALHO",
      "cpf": "95696083234",
      "status": "Demitido",
      "data_admissao": "04/09/2014",
      "data_admissao_iso": "2014-09-04T03:00:00Z",
      "data_demissao": "22/05/2023",
      "data_demissao_iso": "2023-05-22T03:00:00Z",
      "email": "",
      "nome_funcao": "000078 - VIGIA"
    },
    {
      "id_api": "19",
      "codigo": "000224",
      "matricula": "000224",
      "nome": "EDINEY RODRIGUES DE AMORIM",
      "cpf": "90890698287",
      "status": "Demitido",
      "data_admissao": "02/06/2014",
      "data_admissao_iso": "2014-06-02T03:00:00Z",
      "data_demissao": "10/11/2021",
      "data_demissao_iso": "2021-11-10T03:00:00Z",
      "email": "",
      "nome_funcao": "000078 - VIGIA"
    },
    {
      "id_api": "750",
      "codigo": "000225",
      "matricula": "000225",
      "nome": "JADSON ANDRADE PEREIRA",
      "cpf": "84529644200",
      "status": "Demitido",
      "data_admissao": "13/08/2015",
      "data_admissao_iso": "2015-08-13T03:00:00Z",
      "data_demissao": "13/04/2017",
      "data_demissao_iso": "2017-04-13T03:00:00Z",
      "email": "",
      "nome_funcao": "000040 - OPERADOR DE MAQ GRAMPEADEIRA"
    },
    {
      "id_api": "1098",
      "codigo": "000226",
      "matricula": "000226",
      "nome": "LUIS FELIPE FERNANDES MAQUINE",
      "cpf": "2737727243",
      "status": "Demitido",
      "data_admissao": "16/05/2016",
      "data_admissao_iso": "2016-05-16T03:00:00Z",
      "data_demissao": "15/08/2016",
      "data_demissao_iso": "2016-08-15T03:00:00Z",
      "email": "",
      "nome_funcao": "000036 - AUXILIAR DE ELETRICISTA"
    },
    {
      "id_api": "1099",
      "codigo": "000227",
      "matricula": "000227",
      "nome": "JOELLEM FERNANDES DE OLIVEIRA",
      "cpf": "87872048272",
      "status": "Demitido",
      "data_admissao": "16/05/2016",
      "data_admissao_iso": "2016-05-16T03:00:00Z",
      "data_demissao": "18/05/2020",
      "data_demissao_iso": "2020-05-18T03:00:00Z",
      "email": "",
      "nome_funcao": "000010 - CHEFE DE COZINHA"
    },
    {
      "id_api": "1039",
      "codigo": "000228",
      "matricula": "000228",
      "nome": "WILLIAN SILVA DE OLIVEIRA",
      "cpf": "75417855200",
      "status": "Demitido",
      "data_admissao": "20/09/2014",
      "data_admissao_iso": "2014-09-20T03:00:00Z",
      "data_demissao": "21/06/2017",
      "data_demissao_iso": "2017-06-21T03:00:00Z",
      "email": "",
      "nome_funcao": "000275 - Chefe de cozinha"
    },
    {
      "id_api": "693",
      "codigo": "000229",
      "matricula": "000229",
      "nome": "JUAN SOUZA DE BRITO",
      "cpf": "170853225",
      "status": "Demitido",
      "data_admissao": "15/09/2014",
      "data_admissao_iso": "2014-09-15T03:00:00Z",
      "data_demissao": "14/09/2016",
      "data_demissao_iso": "2016-09-14T03:00:00Z",
      "email": "",
      "nome_funcao": "000004 - APRENDIZ ASSIST ADM IND"
    },
    {
      "id_api": "913",
      "codigo": "000230",
      "matricula": "000230",
      "nome": "TIAGO PASCOAL DO NASCIMENTO",
      "cpf": "1512213241",
      "status": "Demitido",
      "data_admissao": "11/08/2014",
      "data_admissao_iso": "2014-08-11T03:00:00Z",
      "data_demissao": "10/08/2016",
      "data_demissao_iso": "2016-08-10T03:00:00Z",
      "email": "",
      "nome_funcao": "000004 - APRENDIZ ASSIST ADM IND"
    },
    {
      "id_api": "141",
      "codigo": "000231",
      "matricula": "000231",
      "nome": "RAIMUNDO NONATO BRITO CORDEIRO",
      "cpf": "59851660230",
      "status": "Demitido",
      "data_admissao": "01/09/2014",
      "data_admissao_iso": "2014-09-01T03:00:00Z",
      "data_demissao": "10/01/2019",
      "data_demissao_iso": "2019-01-10T02:00:00Z",
      "email": "",
      "nome_funcao": "000078 - VIGIA"
    },
    {
      "id_api": "11",
      "codigo": "000232",
      "matricula": "000232",
      "nome": "REBECA SOUZA DO NASCIMENTO",
      "cpf": "1570890293",
      "status": "Demitido",
      "data_admissao": "06/02/2015",
      "data_admissao_iso": "2015-02-06T02:00:00Z",
      "data_demissao": "01/02/2022",
      "data_demissao_iso": "2022-02-01T03:00:00Z",
      "email": "",
      "nome_funcao": "000117 - ANALISTA FINANCEIRO"
    },
    {
      "id_api": "782",
      "codigo": "000234",
      "matricula": "000234",
      "nome": "MARIO BRUCE COELHO",
      "cpf": "44523149291",
      "status": "Demitido",
      "data_admissao": "01/06/2016",
      "data_admissao_iso": "2016-06-01T03:00:00Z",
      "data_demissao": "26/06/2018",
      "data_demissao_iso": "2018-06-26T03:00:00Z",
      "email": "",
      "nome_funcao": "000271 - AUXILIAR DE MANUTENÇÃO"
    },
    {
      "id_api": "1022",
      "codigo": "000235",
      "matricula": "000235",
      "nome": "ELIANDRO BARROSO DE ALMEIDA",
      "cpf": "55881017234",
      "status": "Demitido",
      "data_admissao": "01/06/2016",
      "data_admissao_iso": "2016-06-01T03:00:00Z",
      "data_demissao": "05/07/2016",
      "data_demissao_iso": "2016-07-05T03:00:00Z",
      "email": "",
      "nome_funcao": "000001 - MOTORISTA CARRETEIRO"
    },
    {
      "id_api": "774",
      "codigo": "000236",
      "matricula": "000236",
      "nome": "JOSE FERREIRA BARBOSA",
      "cpf": "73570877272",
      "status": "Demitido",
      "data_admissao": "14/06/2016",
      "data_admissao_iso": "2016-06-14T03:00:00Z",
      "data_demissao": "25/10/2017",
      "data_demissao_iso": "2017-10-25T02:00:00Z",
      "email": "",
      "nome_funcao": "000105 - AUX. DE SERVICOS GERAIS"
    },
    {
      "id_api": "1061",
      "codigo": "000237",
      "matricula": "000237",
      "nome": "ARETHA KAROLINE SARMENTO BARROSO",
      "cpf": "70284020290",
      "status": "Demitido",
      "data_admissao": "14/06/2016",
      "data_admissao_iso": "2016-06-14T03:00:00Z",
      "data_demissao": "17/01/2017",
      "data_demissao_iso": "2017-01-17T02:00:00Z",
      "email": "",
      "nome_funcao": "000004 - APRENDIZ ASSIST ADM IND"
    },
    {
      "id_api": "1062",
      "codigo": "000238",
      "matricula": "000238",
      "nome": "EDGAR MELO DE ARAUJO JUNIOR",
      "cpf": "74082973249",
      "status": "Demitido",
      "data_admissao": "04/07/2016",
      "data_admissao_iso": "2016-07-04T03:00:00Z",
      "data_demissao": "31/07/2017",
      "data_demissao_iso": "2017-07-31T03:00:00Z",
      "email": "",
      "nome_funcao": "000060 - COORDENADOR (A) DE TI"
    },
    {
      "id_api": "915",
      "codigo": "000239",
      "matricula": "000239",
      "nome": "JEAN FEITOSA DE FREITAS",
      "cpf": "1474689221",
      "status": "Demitido",
      "data_admissao": "04/07/2016",
      "data_admissao_iso": "2016-07-04T03:00:00Z",
      "data_demissao": "06/01/2017",
      "data_demissao_iso": "2017-01-06T02:00:00Z",
      "email": "",
      "nome_funcao": "000112 - AUX DE PRODUCAO"
    },
    {
      "id_api": "719",
      "codigo": "000242",
      "matricula": "000242",
      "nome": "RAYNAH JOANA CUNHA DE ALMEIDA",
      "cpf": "3272652213",
      "status": "Demitido",
      "data_admissao": "12/08/2016",
      "data_admissao_iso": "2016-08-12T03:00:00Z",
      "data_demissao": "30/09/2016",
      "data_demissao_iso": "2016-09-30T03:00:00Z",
      "email": "",
      "nome_funcao": "000128 - COORDENADOR DE SGI"
    },
    {
      "id_api": "1034",
      "codigo": "000243",
      "matricula": "000243",
      "nome": "ELIZANGELA AMORIM DOS SANTOS",
      "cpf": "67738222204",
      "status": "Demitido",
      "data_admissao": "12/08/2016",
      "data_admissao_iso": "2016-08-12T03:00:00Z",
      "data_demissao": "30/09/2016",
      "data_demissao_iso": "2016-09-30T03:00:00Z",
      "email": "",
      "nome_funcao": "000128 - COORDENADOR DE SGI"
    },
    {
      "id_api": "765",
      "codigo": "000244",
      "matricula": "000244",
      "nome": "MADSON CARNEIRO DOS SANTOS",
      "cpf": "52342743220",
      "status": "Demitido",
      "data_admissao": "12/08/2016",
      "data_admissao_iso": "2016-08-12T03:00:00Z",
      "data_demissao": "16/05/2017",
      "data_demissao_iso": "2017-05-16T03:00:00Z",
      "email": "",
      "nome_funcao": "000128 - COORDENADOR DE SGI"
    },
    {
      "id_api": "55",
      "codigo": "000245",
      "matricula": "000245",
      "nome": "ELIANA CORDEIRO DE CARVALHO",
      "cpf": "33709823234",
      "status": "Demitido",
      "data_admissao": "12/08/2016",
      "data_admissao_iso": "2016-08-12T03:00:00Z",
      "data_demissao": "09/02/2017",
      "data_demissao_iso": "2017-02-09T02:00:00Z",
      "email": "",
      "nome_funcao": "000085 - COORDENADORA DE VENDA"
    },
    {
      "id_api": "916",
      "codigo": "000248",
      "matricula": "000248",
      "nome": "LUCAS EDUARDO DE CARVALHO VIEIRA",
      "cpf": "4123134211",
      "status": "Demitido",
      "data_admissao": "12/09/2016",
      "data_admissao_iso": "2016-09-12T03:00:00Z",
      "data_demissao": "01/08/2017",
      "data_demissao_iso": "2017-08-01T03:00:00Z",
      "email": "",
      "nome_funcao": "000004 - APRENDIZ ASSIST ADM IND"
    },
    {
      "id_api": "1114",
      "codigo": "000249",
      "matricula": "000249",
      "nome": "VINICIUS RAMOS MARIALVES",
      "cpf": "1333839200",
      "status": "Demitido",
      "data_admissao": "12/09/2016",
      "data_admissao_iso": "2016-09-12T03:00:00Z",
      "data_demissao": "11/04/2017",
      "data_demissao_iso": "2017-04-11T03:00:00Z",
      "email": "",
      "nome_funcao": "000004 - APRENDIZ ASSIST ADM IND"
    },
    {
      "id_api": "925",
      "codigo": "000250",
      "matricula": "000250",
      "nome": "WESLEY DE OLIVEIRA NASCIMENTO",
      "cpf": "5564224221",
      "status": "Demitido",
      "data_admissao": "12/09/2016",
      "data_admissao_iso": "2016-09-12T03:00:00Z",
      "data_demissao": "01/06/2017",
      "data_demissao_iso": "2017-06-01T03:00:00Z",
      "email": "",
      "nome_funcao": "000004 - APRENDIZ ASSIST ADM IND"
    },
    {
      "id_api": "1015",
      "codigo": "000251",
      "matricula": "000251",
      "nome": "ANA ODETE DE CARVALHO",
      "cpf": "42198224020",
      "status": "Demitido",
      "data_admissao": "12/09/2016",
      "data_admissao_iso": "2016-09-12T03:00:00Z",
      "data_demissao": "05/12/2016",
      "data_demissao_iso": "2016-12-05T02:00:00Z",
      "email": "",
      "nome_funcao": "000058 - COZINHEIRA"
    },
    {
      "id_api": "476",
      "codigo": "000252",
      "matricula": "000252",
      "nome": "PAULO ALBERTO MIRABAL DA SILVA",
      "cpf": "92996205200",
      "status": "Demitido",
      "data_admissao": "19/09/2016",
      "data_admissao_iso": "2016-09-19T03:00:00Z",
      "data_demissao": "22/01/2018",
      "data_demissao_iso": "2018-01-22T02:00:00Z",
      "email": "",
      "nome_funcao": "000116 - OPERADOR DE MAQ IMPRESSORA"
    },
    {
      "id_api": "775",
      "codigo": "000253",
      "matricula": "000253",
      "nome": "ELION DE SOUZA RIOS",
      "cpf": "2921035227",
      "status": "Demitido",
      "data_admissao": "23/09/2016",
      "data_admissao_iso": "2016-09-23T03:00:00Z",
      "data_demissao": "21/11/2016",
      "data_demissao_iso": "2016-11-21T02:00:00Z",
      "email": "",
      "nome_funcao": "000105 - AUX. DE SERVICOS GERAIS"
    },
    {
      "id_api": "977",
      "codigo": "000254",
      "matricula": "000254",
      "nome": "CELIO RICARDO COSTA DA SILVA",
      "cpf": "76424880259",
      "status": "Demitido",
      "data_admissao": "23/09/2016",
      "data_admissao_iso": "2016-09-23T03:00:00Z",
      "data_demissao": "08/02/2017",
      "data_demissao_iso": "2017-02-08T02:00:00Z",
      "email": "",
      "nome_funcao": "000112 - AUX DE PRODUCAO"
    },
    {
      "id_api": "945",
      "codigo": "000255",
      "matricula": "000255",
      "nome": "EWERTON CORREIA DE OLIVEIRA",
      "cpf": "74826271204",
      "status": "Demitido",
      "data_admissao": "23/09/2016",
      "data_admissao_iso": "2016-09-23T03:00:00Z",
      "data_demissao": "21/11/2016",
      "data_demissao_iso": "2016-11-21T02:00:00Z",
      "email": "",
      "nome_funcao": "000112 - AUX DE PRODUCAO"
    },
    {
      "id_api": "53",
      "codigo": "000256",
      "matricula": "000256",
      "nome": "EVERTON NONATO DE OLIVEIRA PEREIRA",
      "cpf": "189920211",
      "status": "Demitido",
      "data_admissao": "23/09/2016",
      "data_admissao_iso": "2016-09-23T03:00:00Z",
      "data_demissao": "04/05/2020",
      "data_demissao_iso": "2020-05-04T03:00:00Z",
      "email": "",
      "nome_funcao": "000034 - LIDER DE COLAGEM"
    },
    {
      "id_api": "1041",
      "codigo": "000257",
      "matricula": "000257",
      "nome": "EDINEY DE SOUZA RIBEIRO",
      "cpf": "64993272200",
      "status": "Demitido",
      "data_admissao": "23/09/2016",
      "data_admissao_iso": "2016-09-23T03:00:00Z",
      "data_demissao": "26/12/2016",
      "data_demissao_iso": "2016-12-26T02:00:00Z",
      "email": "",
      "nome_funcao": "000112 - AUX DE PRODUCAO"
    },
    {
      "id_api": "1042",
      "codigo": "000258",
      "matricula": "000258",
      "nome": "WANDESILDO LOPES DIAS",
      "cpf": "1492767298",
      "status": "Demitido",
      "data_admissao": "03/10/2016",
      "data_admissao_iso": "2016-10-03T03:00:00Z",
      "data_demissao": "05/03/2018",
      "data_demissao_iso": "2018-03-05T03:00:00Z",
      "email": "",
      "nome_funcao": "000271 - AUXILIAR DE MANUTENÇÃO"
    },
    {
      "id_api": "936",
      "codigo": "000259",
      "matricula": "000259",
      "nome": "ALANNA SILVA GALUCIO",
      "cpf": "2318914230",
      "status": "Demitido",
      "data_admissao": "03/10/2016",
      "data_admissao_iso": "2016-10-03T03:00:00Z",
      "data_demissao": "29/08/2018",
      "data_demissao_iso": "2018-08-29T03:00:00Z",
      "email": "",
      "nome_funcao": "000275 - Chefe de cozinha"
    },
    {
      "id_api": "554",
      "codigo": "000260",
      "matricula": "000260",
      "nome": "JOAB DE SOUZA MARQUES",
      "cpf": "2611682232",
      "status": "Demitido",
      "data_admissao": "21/10/2016",
      "data_admissao_iso": "2016-10-21T02:00:00Z",
      "data_demissao": "18/11/2016",
      "data_demissao_iso": "2016-11-18T02:00:00Z",
      "email": "",
      "nome_funcao": "000030 - ASSISTENTE ADMINISTRATIVO"
    },
    {
      "id_api": "942",
      "codigo": "000261",
      "matricula": "000261",
      "nome": "JUAN SOUZA DE BRITO",
      "cpf": "170853225",
      "status": "Demitido",
      "data_admissao": "25/10/2016",
      "data_admissao_iso": "2016-10-25T02:00:00Z",
      "data_demissao": "26/05/2017",
      "data_demissao_iso": "2017-05-26T03:00:00Z",
      "email": "",
      "nome_funcao": "000118 - ESTAGIARIO"
    },
    {
      "id_api": "1049",
      "codigo": "000262",
      "matricula": "000262",
      "nome": "ANA LUZIELMA FONSECA DE SOUZA",
      "cpf": "32168578249",
      "status": "Demitido",
      "data_admissao": "01/11/2016",
      "data_admissao_iso": "2016-11-01T02:00:00Z",
      "data_demissao": "05/09/2017",
      "data_demissao_iso": "2017-09-05T03:00:00Z",
      "email": "",
      "nome_funcao": "000056 - VENDEDOR"
    },
    {
      "id_api": "783",
      "codigo": "000263",
      "matricula": "000263",
      "nome": "DANIEL GOMES DA SILVA",
      "cpf": "2347347284",
      "status": "Demitido",
      "data_admissao": "01/11/2016",
      "data_admissao_iso": "2016-11-01T02:00:00Z",
      "data_demissao": "13/03/2017",
      "data_demissao_iso": "2017-03-13T03:00:00Z",
      "email": "",
      "nome_funcao": "000271 - AUXILIAR DE MANUTENÇÃO"
    },
    {
      "id_api": "1087",
      "codigo": "000264",
      "matricula": "000264",
      "nome": "SINTIA KELLY LIMA DA COSTA",
      "cpf": "62310054291",
      "status": "Demitido",
      "data_admissao": "01/11/2016",
      "data_admissao_iso": "2016-11-01T02:00:00Z",
      "data_demissao": "21/02/2020",
      "data_demissao_iso": "2020-02-21T03:00:00Z",
      "email": "",
      "nome_funcao": "000032 - COZINHEIRA"
    },
    {
      "id_api": "586",
      "codigo": "000267",
      "matricula": "000267",
      "nome": "ANDREW RODRIGUES DE CASTRO",
      "cpf": "78282063215",
      "status": "Demitido",
      "data_admissao": "01/12/2016",
      "data_admissao_iso": "2016-12-01T02:00:00Z",
      "data_demissao": "27/03/2017",
      "data_demissao_iso": "2017-03-27T03:00:00Z",
      "email": "",
      "nome_funcao": "000103 - VIGIA"
    },
    {
      "id_api": "1023",
      "codigo": "000268",
      "matricula": "000268",
      "nome": "MARIA ELCICLEIA  ALCANTARA DA SILVA",
      "cpf": "48529745272",
      "status": "Demitido",
      "data_admissao": "01/12/2016",
      "data_admissao_iso": "2016-12-01T02:00:00Z",
      "data_demissao": "29/12/2016",
      "data_demissao_iso": "2016-12-29T02:00:00Z",
      "email": "",
      "nome_funcao": "000275 - Chefe de cozinha"
    },
    {
      "id_api": "1066",
      "codigo": "000269",
      "matricula": "000269",
      "nome": "JANETE MONTEIRO MARQUES",
      "cpf": "59972629287",
      "status": "Demitido",
      "data_admissao": "02/12/2016",
      "data_admissao_iso": "2016-12-02T02:00:00Z",
      "data_demissao": "14/02/2020",
      "data_demissao_iso": "2020-02-14T03:00:00Z",
      "email": "",
      "nome_funcao": "000267 - CHEFE DE COZINHA"
    },
    {
      "id_api": "728",
      "codigo": "000270",
      "matricula": "000270",
      "nome": "SERGIO MOREIRA  BARBOSA",
      "cpf": "71981349200",
      "status": "Demitido",
      "data_admissao": "05/12/2016",
      "data_admissao_iso": "2016-12-05T02:00:00Z",
      "data_demissao": "25/04/2017",
      "data_demissao_iso": "2017-04-25T03:00:00Z",
      "email": "",
      "nome_funcao": "000116 - OPERADOR DE MAQ IMPRESSORA"
    },
    {
      "id_api": "1050",
      "codigo": "000271",
      "matricula": "000271",
      "nome": "WILLIAM FLORES DE OLIVEIRA",
      "cpf": "97510769272",
      "status": "Demitido",
      "data_admissao": "12/12/2016",
      "data_admissao_iso": "2016-12-12T02:00:00Z",
      "data_demissao": "07/04/2017",
      "data_demissao_iso": "2017-04-07T03:00:00Z",
      "email": "",
      "nome_funcao": "000133 - ANALISTA DE DP"
    },
    {
      "id_api": "1024",
      "codigo": "000273",
      "matricula": "000273",
      "nome": "WASHINGTON TEIXEIRA DE LIMA",
      "cpf": "3635144223",
      "status": "Demitido",
      "data_admissao": "09/01/2017",
      "data_admissao_iso": "2017-01-09T02:00:00Z",
      "data_demissao": "21/02/2018",
      "data_demissao_iso": "2018-02-21T03:00:00Z",
      "email": "",
      "nome_funcao": "000048 - AUXILIAR DE PRODUCAO"
    },
    {
      "id_api": "946",
      "codigo": "000274",
      "matricula": "000274",
      "nome": "JONAS GONÇALVES PIMENTEL",
      "cpf": "74111248268",
      "status": "Demitido",
      "data_admissao": "09/01/2017",
      "data_admissao_iso": "2017-01-09T02:00:00Z",
      "data_demissao": "04/06/2018",
      "data_demissao_iso": "2018-06-04T03:00:00Z",
      "email": "",
      "nome_funcao": "000048 - AUXILIAR DE PRODUCAO"
    },
    {
      "id_api": "56",
      "codigo": "000275",
      "matricula": "000275",
      "nome": "DARLISON FERREIRA DE SOUZA",
      "cpf": "99341093287",
      "status": "Demitido",
      "data_admissao": "09/01/2017",
      "data_admissao_iso": "2017-01-09T02:00:00Z",
      "data_demissao": "25/09/2018",
      "data_demissao_iso": "2018-09-25T03:00:00Z",
      "email": "",
      "nome_funcao": "000020 - AJUSTADOR / ALIMENTADOR DE MAQ IMPRESSOR"
    },
    {
      "id_api": "720",
      "codigo": "000276",
      "matricula": "000276",
      "nome": "MARCIO BATISTA DE OLIVEIRA",
      "cpf": "95650970220",
      "status": "Demitido",
      "data_admissao": "09/01/2017",
      "data_admissao_iso": "2017-01-09T02:00:00Z",
      "data_demissao": "18/08/2017",
      "data_demissao_iso": "2017-08-18T03:00:00Z",
      "email": "",
      "nome_funcao": "000048 - AUXILIAR DE PRODUCAO"
    },
    {
      "id_api": "932",
      "codigo": "000277",
      "matricula": "000277",
      "nome": "CARLOS CEZAR LEMOS SOARES",
      "cpf": "64349195220",
      "status": "Demitido",
      "data_admissao": "10/01/2017",
      "data_admissao_iso": "2017-01-10T02:00:00Z",
      "data_demissao": "25/10/2018",
      "data_demissao_iso": "2018-10-25T03:00:00Z",
      "email": "",
      "nome_funcao": "000052 - LIDER OPERADOR DE MAQ IMPRESSORA"
    },
    {
      "id_api": "1001",
      "codigo": "000278",
      "matricula": "000278",
      "nome": "LEONARDO BERREDO SANTOS",
      "cpf": "1234548240",
      "status": "Demitido",
      "data_admissao": "17/01/2017",
      "data_admissao_iso": "2017-01-17T02:00:00Z",
      "data_demissao": "06/07/2017",
      "data_demissao_iso": "2017-07-06T03:00:00Z",
      "email": "",
      "nome_funcao": "000048 - AUXILIAR DE PRODUCAO"
    },
    {
      "id_api": "1043",
      "codigo": "000279",
      "matricula": "000279",
      "nome": "JOYCE VIANA DE SOUZA",
      "cpf": "87901374268",
      "status": "Demitido",
      "data_admissao": "17/01/2017",
      "data_admissao_iso": "2017-01-17T02:00:00Z",
      "data_demissao": "13/03/2017",
      "data_demissao_iso": "2017-03-13T03:00:00Z",
      "email": "",
      "nome_funcao": "000105 - AUX. DE SERVICOS GERAIS"
    },
    {
      "id_api": "1025",
      "codigo": "000280",
      "matricula": "000280",
      "nome": "ADRIANO TRINDADE DA SILVA",
      "cpf": "464002222",
      "status": "Demitido",
      "data_admissao": "17/01/2017",
      "data_admissao_iso": "2017-01-17T02:00:00Z",
      "data_demissao": "21/09/2017",
      "data_demissao_iso": "2017-09-21T03:00:00Z",
      "email": "",
      "nome_funcao": "000048 - AUXILIAR DE PRODUCAO"
    },
    {
      "id_api": "199",
      "codigo": "000281",
      "matricula": "000281",
      "nome": "ARETHA KAROLINE BARROSO DE SOUSA",
      "cpf": "70284020290",
      "status": "Demitido",
      "data_admissao": "19/01/2017",
      "data_admissao_iso": "2017-01-19T02:00:00Z",
      "data_demissao": "17/11/2025",
      "data_demissao_iso": "2025-11-17T03:00:00Z",
      "email": "karolinearetha@gmail.com",
      "nome_funcao": "000108 - VENDEDOR"
    },
    {
      "id_api": "1044",
      "codigo": "000282",
      "matricula": "000282",
      "nome": "LEANDRO BENTES TAVARES",
      "cpf": "86001680230",
      "status": "Demitido",
      "data_admissao": "18/01/2017",
      "data_admissao_iso": "2017-01-18T02:00:00Z",
      "data_demissao": "03/07/2017",
      "data_demissao_iso": "2017-07-03T03:00:00Z",
      "email": "",
      "nome_funcao": "000275 - Chefe de cozinha"
    },
    {
      "id_api": "1045",
      "codigo": "000283",
      "matricula": "000283",
      "nome": "EDUARDO JORGE OLIVEIRA DA ROCHA",
      "cpf": "41624424287",
      "status": "Demitido",
      "data_admissao": "23/01/2017",
      "data_admissao_iso": "2017-01-23T02:00:00Z",
      "data_demissao": "23/02/2017",
      "data_demissao_iso": "2017-02-23T03:00:00Z",
      "email": "",
      "nome_funcao": "000075 - ASSISTENTE DE SGI"
    },
    {
      "id_api": "1016",
      "codigo": "000285",
      "matricula": "000285",
      "nome": "MARIA RAIMUNDA DE FIGUEIREDO",
      "cpf": "27672131249",
      "status": "Demitido",
      "data_admissao": "01/02/2017",
      "data_admissao_iso": "2017-02-01T02:00:00Z",
      "data_demissao": "11/04/2017",
      "data_demissao_iso": "2017-04-11T03:00:00Z",
      "email": "",
      "nome_funcao": "000275 - Chefe de cozinha"
    },
    {
      "id_api": "522",
      "codigo": "000286",
      "matricula": "000286",
      "nome": "JARDEL BORGES DE OLIVEIRA",
      "cpf": "1852714212",
      "status": "Demitido",
      "data_admissao": "01/02/2017",
      "data_admissao_iso": "2017-02-01T02:00:00Z",
      "data_demissao": "13/04/2017",
      "data_demissao_iso": "2017-04-13T03:00:00Z",
      "email": "",
      "nome_funcao": "000275 - Chefe de cozinha"
    },
    {
      "id_api": "1051",
      "codigo": "000287",
      "matricula": "000287",
      "nome": "RAIDELSON LIMA DOS SANTOS",
      "cpf": "64874192220",
      "status": "Demitido",
      "data_admissao": "05/02/2017",
      "data_admissao_iso": "2017-02-05T02:00:00Z",
      "data_demissao": "26/08/2017",
      "data_demissao_iso": "2017-08-26T03:00:00Z",
      "email": "",
      "nome_funcao": "000018 - ANALISTA DE DESENVOLVIMENTO"
    },
    {
      "id_api": "1063",
      "codigo": "000289",
      "matricula": "000289",
      "nome": "GEOVANE COSTA GOIS",
      "cpf": "3412045284",
      "status": "Demitido",
      "data_admissao": "07/02/2017",
      "data_admissao_iso": "2017-02-07T02:00:00Z",
      "data_demissao": "06/02/2019",
      "data_demissao_iso": "2019-02-06T02:00:00Z",
      "email": "",
      "nome_funcao": "000004 - APRENDIZ ASSIST ADM IND"
    },
    {
      "id_api": "825",
      "codigo": "000290",
      "matricula": "000290",
      "nome": "MARCELO FERREIRA MARCELINO",
      "cpf": "1369439261",
      "status": "Demitido",
      "data_admissao": "09/02/2017",
      "data_admissao_iso": "2017-02-09T02:00:00Z",
      "data_demissao": "10/03/2017",
      "data_demissao_iso": "2017-03-10T03:00:00Z",
      "email": "",
      "nome_funcao": "000275 - Chefe de cozinha"
    },
    {
      "id_api": "1017",
      "codigo": "000291",
      "matricula": "000291",
      "nome": "BRUNO PEREIRA LIBORIO",
      "cpf": "93415028291",
      "status": "Demitido",
      "data_admissao": "09/02/2017",
      "data_admissao_iso": "2017-02-09T02:00:00Z",
      "data_demissao": "07/05/2018",
      "data_demissao_iso": "2018-05-07T03:00:00Z",
      "email": "",
      "nome_funcao": "000031 - AUX. DE DESENVOLVIMENTO"
    },
    {
      "id_api": "1069",
      "codigo": "000292",
      "matricula": "000292",
      "nome": "DHEIVERSON DA SILVA QUEIROZ",
      "cpf": "392123274",
      "status": "Demitido",
      "data_admissao": "14/02/2017",
      "data_admissao_iso": "2017-02-14T02:00:00Z",
      "data_demissao": "13/12/2022",
      "data_demissao_iso": "2022-12-13T03:00:00Z",
      "email": "",
      "nome_funcao": "000002 - Almoxarife"
    },
    {
      "id_api": "784",
      "codigo": "000293",
      "matricula": "000293",
      "nome": "ROBSON VIEIRA MOREIRA",
      "cpf": "991095227",
      "status": "Demitido",
      "data_admissao": "14/02/2017",
      "data_admissao_iso": "2017-02-14T02:00:00Z",
      "data_demissao": "07/06/2018",
      "data_demissao_iso": "2018-06-07T03:00:00Z",
      "email": "",
      "nome_funcao": "000081 - LIDER SOLDADOR"
    },
    {
      "id_api": "531",
      "codigo": "000294",
      "matricula": "000294",
      "nome": "ROBERVAL DA SILVA",
      "cpf": "95732195220",
      "status": "Demitido",
      "data_admissao": "14/02/2017",
      "data_admissao_iso": "2017-02-14T02:00:00Z",
      "data_demissao": "11/12/2019",
      "data_demissao_iso": "2019-12-11T03:00:00Z",
      "email": "",
      "nome_funcao": "000272 - AUXILIAR DE LOGISTICA"
    },
    {
      "id_api": "108",
      "codigo": "000295",
      "matricula": "000295",
      "nome": "LUIZ FELIPE SANTOS GALHEIRO",
      "cpf": "1993912207",
      "status": "Demitido",
      "data_admissao": "14/02/2017",
      "data_admissao_iso": "2017-02-14T02:00:00Z",
      "data_demissao": "19/03/2018",
      "data_demissao_iso": "2018-03-19T03:00:00Z",
      "email": "",
      "nome_funcao": "000112 - AUX DE PRODUCAO"
    },
    {
      "id_api": "937",
      "codigo": "000296",
      "matricula": "000296",
      "nome": "JEAN AFONSO DA SILVA",
      "cpf": "1588983200",
      "status": "Demitido",
      "data_admissao": "14/02/2017",
      "data_admissao_iso": "2017-02-14T02:00:00Z",
      "data_demissao": "15/03/2017",
      "data_demissao_iso": "2017-03-15T03:00:00Z",
      "email": "",
      "nome_funcao": "000112 - AUX DE PRODUCAO"
    },
    {
      "id_api": "983",
      "codigo": "000297",
      "matricula": "000297",
      "nome": "JAKESON MODESTO AGUIAR MONTEIRO",
      "cpf": "72345004215",
      "status": "Demitido",
      "data_admissao": "14/02/2017",
      "data_admissao_iso": "2017-02-14T02:00:00Z",
      "data_demissao": "16/08/2022",
      "data_demissao_iso": "2022-08-16T03:00:00Z",
      "email": "",
      "nome_funcao": "000153 - AJUSTADOR/ALIMENTADOR DE MAQ CARTONAGEM"
    },
    {
      "id_api": "955",
      "codigo": "000298",
      "matricula": "000298",
      "nome": "MARCOS ANTONIO LINS DE OLIVEIRA",
      "cpf": "46414886220",
      "status": "Demitido",
      "data_admissao": "14/02/2017",
      "data_admissao_iso": "2017-02-14T02:00:00Z",
      "data_demissao": "27/01/2022",
      "data_demissao_iso": "2022-01-27T03:00:00Z",
      "email": "",
      "nome_funcao": "000049 - LIDER OPERADOR DE MAQ CARTONAGEM"
    },
    {
      "id_api": "1007",
      "codigo": "000299",
      "matricula": "000299",
      "nome": "SIDNEY GAMA NASCIMENTO",
      "cpf": "62489445200",
      "status": "Demitido",
      "data_admissao": "14/02/2017",
      "data_admissao_iso": "2017-02-14T02:00:00Z",
      "data_demissao": "18/07/2018",
      "data_demissao_iso": "2018-07-18T03:00:00Z",
      "email": "",
      "nome_funcao": "000112 - AUX DE PRODUCAO"
    },
    {
      "id_api": "1035",
      "codigo": "000300",
      "matricula": "000300",
      "nome": "JEFFERSON RAMOS MESQUITA",
      "cpf": "282572279",
      "status": "Demitido",
      "data_admissao": "16/02/2017",
      "data_admissao_iso": "2017-02-16T02:00:00Z",
      "data_demissao": "16/04/2017",
      "data_demissao_iso": "2017-04-16T03:00:00Z",
      "email": "",
      "nome_funcao": "000081 - LIDER SOLDADOR"
    },
    {
      "id_api": "766",
      "codigo": "000301",
      "matricula": "000301",
      "nome": "CARLOS ANDRE NOGUEIRA CORREA",
      "cpf": "339281260",
      "status": "Demitido",
      "data_admissao": "16/02/2017",
      "data_admissao_iso": "2017-02-16T02:00:00Z",
      "data_demissao": "24/07/2017",
      "data_demissao_iso": "2017-07-24T03:00:00Z",
      "email": "",
      "nome_funcao": "000271 - AUXILIAR DE MANUTENÇÃO"
    },
    {
      "id_api": "1057",
      "codigo": "000302",
      "matricula": "000302",
      "nome": "WALTENCY DE MAGALHAES OZORIO",
      "cpf": "59948647220",
      "status": "Demitido",
      "data_admissao": "16/02/2017",
      "data_admissao_iso": "2017-02-16T02:00:00Z",
      "data_demissao": "18/10/2019",
      "data_demissao_iso": "2019-10-18T03:00:00Z",
      "email": "",
      "nome_funcao": "000131 - ANALISTA DE DESENVOLVIMENTO"
    },
    {
      "id_api": "938",
      "codigo": "000303",
      "matricula": "000303",
      "nome": "GIOVAN GOMES DE LIMA",
      "cpf": "2482173213",
      "status": "Demitido",
      "data_admissao": "21/02/2017",
      "data_admissao_iso": "2017-02-21T03:00:00Z",
      "data_demissao": "22/03/2017",
      "data_demissao_iso": "2017-03-22T03:00:00Z",
      "email": "",
      "nome_funcao": "000112 - AUX DE PRODUCAO"
    },
    {
      "id_api": "90",
      "codigo": "000304",
      "matricula": "000304",
      "nome": "FABRICIO ALVES WECKNER",
      "cpf": "1988555248",
      "status": "Demitido",
      "data_admissao": "21/02/2017",
      "data_admissao_iso": "2017-02-21T03:00:00Z",
      "data_demissao": "22/03/2017",
      "data_demissao_iso": "2017-03-22T03:00:00Z",
      "email": "",
      "nome_funcao": "000071 - ASSISTENTE DE DP"
    },
    {
      "id_api": "751",
      "codigo": "000305",
      "matricula": "000305",
      "nome": "EWERTON DE MATOS MENDONCA",
      "cpf": "77882083291",
      "status": "Demitido",
      "data_admissao": "21/02/2017",
      "data_admissao_iso": "2017-02-21T03:00:00Z",
      "data_demissao": "18/09/2017",
      "data_demissao_iso": "2017-09-18T03:00:00Z",
      "email": "",
      "nome_funcao": "000112 - AUX DE PRODUCAO"
    },
    {
      "id_api": "1100",
      "codigo": "000306",
      "matricula": "000306",
      "nome": "CLEMERSON DIAS DUARTE",
      "cpf": "1740413229",
      "status": "Demitido",
      "data_admissao": "21/02/2017",
      "data_admissao_iso": "2017-02-21T03:00:00Z",
      "data_demissao": "23/09/2021",
      "data_demissao_iso": "2021-09-23T03:00:00Z",
      "email": "",
      "nome_funcao": "000049 - LIDER OPERADOR DE MAQ CARTONAGEM"
    },
    {
      "id_api": "947",
      "codigo": "000307",
      "matricula": "000307",
      "nome": "ADONIAS PRATA MAGALHAES",
      "cpf": "97596710263",
      "status": "Demitido",
      "data_admissao": "21/02/2017",
      "data_admissao_iso": "2017-02-21T03:00:00Z",
      "data_demissao": "13/06/2018",
      "data_demissao_iso": "2018-06-13T03:00:00Z",
      "email": "",
      "nome_funcao": "000112 - AUX DE PRODUCAO"
    },
    {
      "id_api": "1008",
      "codigo": "000308",
      "matricula": "000308",
      "nome": "SALLAAN SEIXAS ALFAIA",
      "cpf": "1151449270",
      "status": "Demitido",
      "data_admissao": "21/02/2017",
      "data_admissao_iso": "2017-02-21T03:00:00Z",
      "data_demissao": "06/07/2017",
      "data_demissao_iso": "2017-07-06T03:00:00Z",
      "email": "",
      "nome_funcao": "000112 - AUX DE PRODUCAO"
    },
    {
      "id_api": "767",
      "codigo": "000309",
      "matricula": "000309",
      "nome": "CLEDSON LUIZ FREITAS DIAS",
      "cpf": "84980168272",
      "status": "Demitido",
      "data_admissao": "21/02/2017",
      "data_admissao_iso": "2017-02-21T03:00:00Z",
      "data_demissao": "31/03/2018",
      "data_demissao_iso": "2018-03-31T03:00:00Z",
      "email": "",
      "nome_funcao": "000112 - AUX DE PRODUCAO"
    },
    {
      "id_api": "1027",
      "codigo": "000310",
      "matricula": "000310",
      "nome": "SANDREI PINTO MORAIS",
      "cpf": "1579545289",
      "status": "Demitido",
      "data_admissao": "22/02/2017",
      "data_admissao_iso": "2017-02-22T03:00:00Z",
      "data_demissao": "24/05/2018",
      "data_demissao_iso": "2018-05-24T03:00:00Z",
      "email": "",
      "nome_funcao": "000112 - AUX DE PRODUCAO"
    },
    {
      "id_api": "1052",
      "codigo": "000311",
      "matricula": "000311",
      "nome": "RAFAEL MUNHOZ ALVES",
      "cpf": "96104023215",
      "status": "Demitido",
      "data_admissao": "22/02/2017",
      "data_admissao_iso": "2017-02-22T03:00:00Z",
      "data_demissao": "18/07/2018",
      "data_demissao_iso": "2018-07-18T03:00:00Z",
      "email": "",
      "nome_funcao": "000112 - AUX DE PRODUCAO"
    },
    {
      "id_api": "1009",
      "codigo": "000312",
      "matricula": "000312",
      "nome": "JOSE ARLISON BIRINO DOS SANTOS",
      "cpf": "70028774299",
      "status": "Demitido",
      "data_admissao": "22/02/2017",
      "data_admissao_iso": "2017-02-22T03:00:00Z",
      "data_demissao": "22/04/2017",
      "data_demissao_iso": "2017-04-22T03:00:00Z",
      "email": "",
      "nome_funcao": "000112 - AUX DE PRODUCAO"
    },
    {
      "id_api": "906",
      "codigo": "000313",
      "matricula": "000313",
      "nome": "IGO BENTES DE ARAUJO",
      "cpf": "79718639268",
      "status": "Demitido",
      "data_admissao": "22/02/2017",
      "data_admissao_iso": "2017-02-22T03:00:00Z",
      "data_demissao": "13/04/2017",
      "data_demissao_iso": "2017-04-13T03:00:00Z",
      "email": "",
      "nome_funcao": "000112 - AUX DE PRODUCAO"
    },
    {
      "id_api": "1036",
      "codigo": "000314",
      "matricula": "000314",
      "nome": "MARCELO PEREIRA DE LIMA",
      "cpf": "59840269291",
      "status": "Demitido",
      "data_admissao": "22/02/2017",
      "data_admissao_iso": "2017-02-22T03:00:00Z",
      "data_demissao": "23/03/2017",
      "data_demissao_iso": "2017-03-23T03:00:00Z",
      "email": "",
      "nome_funcao": "000112 - AUX DE PRODUCAO"
    },
    {
      "id_api": "1026",
      "codigo": "000315",
      "matricula": "000315",
      "nome": "DARLAN BRUNO DE OLIVEIRA ROCHA",
      "cpf": "1834198208",
      "status": "Demitido",
      "data_admissao": "22/02/2017",
      "data_admissao_iso": "2017-02-22T03:00:00Z",
      "data_demissao": "23/03/2017",
      "data_demissao_iso": "2017-03-23T03:00:00Z",
      "email": "",
      "nome_funcao": "000112 - AUX DE PRODUCAO"
    },
    {
      "id_api": "1067",
      "codigo": "000316",
      "matricula": "000316",
      "nome": "LEANDRO WILDSON LESKO TAVARES",
      "cpf": "88766691249",
      "status": "Demitido",
      "data_admissao": "23/02/2017",
      "data_admissao_iso": "2017-02-23T03:00:00Z",
      "data_demissao": "06/07/2021",
      "data_demissao_iso": "2021-07-06T03:00:00Z",
      "email": "",
      "nome_funcao": "000064 - OPERADOR DE MAQUINA DE CARTONAGEM"
    },
    {
      "id_api": "1073",
      "codigo": "000318",
      "matricula": "000318",
      "nome": "NATANAEL DA SILVA GOMES",
      "cpf": "1102111201",
      "status": "Demitido",
      "data_admissao": "20/02/2017",
      "data_admissao_iso": "2017-02-20T03:00:00Z",
      "data_demissao": "08/01/2020",
      "data_demissao_iso": "2020-01-08T03:00:00Z",
      "email": "",
      "nome_funcao": "000015 - ASSISTENTE CONTABIL"
    },
    {
      "id_api": "776",
      "codigo": "000320",
      "matricula": "000320",
      "nome": "ELLITON DE MOURA SOUZA",
      "cpf": "830647295",
      "status": "Demitido",
      "data_admissao": "21/02/2017",
      "data_admissao_iso": "2017-02-21T03:00:00Z",
      "data_demissao": "22/03/2017",
      "data_demissao_iso": "2017-03-22T03:00:00Z",
      "email": "",
      "nome_funcao": "000275 - Chefe de cozinha"
    },
    {
      "id_api": "939",
      "codigo": "000323",
      "matricula": "000323",
      "nome": "WALVERINY FELLIPE ALMEIDA SILVA",
      "cpf": "96495790287",
      "status": "Demitido",
      "data_admissao": "08/03/2017",
      "data_admissao_iso": "2017-03-08T03:00:00Z",
      "data_demissao": "11/06/2018",
      "data_demissao_iso": "2018-06-11T03:00:00Z",
      "email": "",
      "nome_funcao": "000112 - AUX DE PRODUCAO"
    },
    {
      "id_api": "735",
      "codigo": "000324",
      "matricula": "000324",
      "nome": "DAVID VINICIUS DE OLIVEIRA GOMES",
      "cpf": "2627823248",
      "status": "Demitido",
      "data_admissao": "08/03/2017",
      "data_admissao_iso": "2017-03-08T03:00:00Z",
      "data_demissao": "06/04/2017",
      "data_demissao_iso": "2017-04-06T03:00:00Z",
      "email": "",
      "nome_funcao": "000112 - AUX DE PRODUCAO"
    },
    {
      "id_api": "555",
      "codigo": "000325",
      "matricula": "000325",
      "nome": "PAULO GABRIEL BELEM MARTINS",
      "cpf": "1550669273",
      "status": "Demitido",
      "data_admissao": "14/03/2017",
      "data_admissao_iso": "2017-03-14T03:00:00Z",
      "data_demissao": "30/08/2017",
      "data_demissao_iso": "2017-08-30T03:00:00Z",
      "email": "",
      "nome_funcao": "000112 - AUX DE PRODUCAO"
    },
    {
      "id_api": "91",
      "codigo": "000326",
      "matricula": "000326",
      "nome": "ADAM CRISTIAN DE OLIVEIRA RODRIGUES",
      "cpf": "1574449290",
      "status": "Demitido",
      "data_admissao": "15/03/2017",
      "data_admissao_iso": "2017-03-15T03:00:00Z",
      "data_demissao": "22/01/2018",
      "data_demissao_iso": "2018-01-22T02:00:00Z",
      "email": "",
      "nome_funcao": "000112 - AUX DE PRODUCAO"
    },
    {
      "id_api": "768",
      "codigo": "000327",
      "matricula": "000327",
      "nome": "ELI DA SILVA BARCELOS",
      "cpf": "63108356291",
      "status": "Demitido",
      "data_admissao": "15/03/2017",
      "data_admissao_iso": "2017-03-15T03:00:00Z",
      "data_demissao": "08/08/2017",
      "data_demissao_iso": "2017-08-08T03:00:00Z",
      "email": "",
      "nome_funcao": "000112 - AUX DE PRODUCAO"
    },
    {
      "id_api": "1053",
      "codigo": "000328",
      "matricula": "000328",
      "nome": "RUBENS LIMA BRITO",
      "cpf": "78619211234",
      "status": "Demitido",
      "data_admissao": "15/03/2017",
      "data_admissao_iso": "2017-03-15T03:00:00Z",
      "data_demissao": "06/12/2017",
      "data_demissao_iso": "2017-12-06T02:00:00Z",
      "email": "",
      "nome_funcao": "000112 - AUX DE PRODUCAO"
    },
    {
      "id_api": "1037",
      "codigo": "000329",
      "matricula": "000329",
      "nome": "DAVID SILVA DOS SANTOS",
      "cpf": "81088051200",
      "status": "Demitido",
      "data_admissao": "10/03/2017",
      "data_admissao_iso": "2017-03-10T03:00:00Z",
      "data_demissao": "30/07/2017",
      "data_demissao_iso": "2017-07-30T03:00:00Z",
      "email": "",
      "nome_funcao": "000090 - ARTÍFICE"
    },
    {
      "id_api": "541",
      "codigo": "000331",
      "matricula": "000331",
      "nome": "JOSE CLAUDIO SOUSA BRANDAO",
      "cpf": "47633514353",
      "status": "Demitido",
      "data_admissao": "27/03/2017",
      "data_admissao_iso": "2017-03-27T03:00:00Z",
      "data_demissao": "13/03/2017",
      "data_demissao_iso": "2017-03-13T03:00:00Z",
      "email": "",
      "nome_funcao": "000112 - AUX DE PRODUCAO"
    },
    {
      "id_api": "457",
      "codigo": "000332",
      "matricula": "000332",
      "nome": "DAIANA TIBURCIO DE BRITO",
      "cpf": "86287907215",
      "status": "Demitido",
      "data_admissao": "27/03/2017",
      "data_admissao_iso": "2017-03-27T03:00:00Z",
      "data_demissao": "21/07/2024",
      "data_demissao_iso": "2024-07-21T03:00:00Z",
      "email": "",
      "nome_funcao": "000117 - ANALISTA FINANCEIRO"
    },
    {
      "id_api": "1056",
      "codigo": "000333",
      "matricula": "000333",
      "nome": "JEAN CARLOS MIRANDA PEDROSA",
      "cpf": "89691776200",
      "status": "Demitido",
      "data_admissao": "04/04/2017",
      "data_admissao_iso": "2017-04-04T03:00:00Z",
      "data_demissao": "23/10/2018",
      "data_demissao_iso": "2018-10-23T03:00:00Z",
      "email": "",
      "nome_funcao": "000105 - AUX. DE SERVICOS GERAIS"
    },
    {
      "id_api": "769",
      "codigo": "000334",
      "matricula": "000334",
      "nome": "MANOEL CRISTIANO MESQUITA DA SILVA",
      "cpf": "80218814291",
      "status": "Demitido",
      "data_admissao": "03/04/2017",
      "data_admissao_iso": "2017-04-03T03:00:00Z",
      "data_demissao": "14/07/2017",
      "data_demissao_iso": "2017-07-14T03:00:00Z",
      "email": "",
      "nome_funcao": "000038 - COORDENADOR DE PCP"
    },
    {
      "id_api": "967",
      "codigo": "000335",
      "matricula": "000335",
      "nome": "JOSE MARIA DA SILVA RIOTINTO",
      "cpf": "93400594253",
      "status": "Demitido",
      "data_admissao": "08/05/2017",
      "data_admissao_iso": "2017-05-08T03:00:00Z",
      "data_demissao": "12/04/2018",
      "data_demissao_iso": "2018-04-12T03:00:00Z",
      "email": "",
      "nome_funcao": "000124 - ASSISTENTE CONTABIL"
    },
    {
      "id_api": "1018",
      "codigo": "000338",
      "matricula": "000338",
      "nome": "RAIMUNDO LUIZ FERREIRA ALVES",
      "cpf": "33518890204",
      "status": "Demitido",
      "data_admissao": "01/06/2017",
      "data_admissao_iso": "2017-06-01T03:00:00Z",
      "data_demissao": "04/09/2017",
      "data_demissao_iso": "2017-09-04T03:00:00Z",
      "email": "",
      "nome_funcao": "000090 - ARTÍFICE"
    },
    {
      "id_api": "1054",
      "codigo": "000339",
      "matricula": "000339",
      "nome": "FRANCISCO EVANDRO VIANA BARROSO",
      "cpf": "40503330230",
      "status": "Demitido",
      "data_admissao": "01/06/2017",
      "data_admissao_iso": "2017-06-01T03:00:00Z",
      "data_demissao": "03/07/2018",
      "data_demissao_iso": "2018-07-03T03:00:00Z",
      "email": "",
      "nome_funcao": "000103 - VIGIA"
    },
    {
      "id_api": "777",
      "codigo": "000342",
      "matricula": "000342",
      "nome": "DENILSON OLIVEIRA DE SOUZA",
      "cpf": "1439157200",
      "status": "Demitido",
      "data_admissao": "10/07/2017",
      "data_admissao_iso": "2017-07-10T03:00:00Z",
      "data_demissao": "26/01/2018",
      "data_demissao_iso": "2018-01-26T02:00:00Z",
      "email": "",
      "nome_funcao": "000072 - OPERADOR DE ETE"
    },
    {
      "id_api": "721",
      "codigo": "000343",
      "matricula": "000343",
      "nome": "NILTON BERNARDINO DA SILVA FILHO",
      "cpf": "51897180268",
      "status": "Demitido",
      "data_admissao": "10/07/2017",
      "data_admissao_iso": "2017-07-10T03:00:00Z",
      "data_demissao": "08/08/2017",
      "data_demissao_iso": "2017-08-08T03:00:00Z",
      "email": "",
      "nome_funcao": "000048 - AUXILIAR DE PRODUCAO"
    },
    {
      "id_api": "948",
      "codigo": "000344",
      "matricula": "000344",
      "nome": "ALDEMBERG MOREIRA CAVALCANTE",
      "cpf": "551506245",
      "status": "Demitido",
      "data_admissao": "17/07/2017",
      "data_admissao_iso": "2017-07-17T03:00:00Z",
      "data_demissao": "14/09/2017",
      "data_demissao_iso": "2017-09-14T03:00:00Z",
      "email": "",
      "nome_funcao": "000142 - ASSISTENTE DA QUALIDADE"
    },
    {
      "id_api": "940",
      "codigo": "000345",
      "matricula": "000345",
      "nome": "RAIMUNDO NONATO OLIVEIRA DE SOUZA",
      "cpf": "72827157268",
      "status": "Demitido",
      "data_admissao": "17/07/2017",
      "data_admissao_iso": "2017-07-17T03:00:00Z",
      "data_demissao": "15/08/2017",
      "data_demissao_iso": "2017-08-15T03:00:00Z",
      "email": "",
      "nome_funcao": "000048 - AUXILIAR DE PRODUCAO"
    },
    {
      "id_api": "582",
      "codigo": "000346",
      "matricula": "000346",
      "nome": "MAURILA CYNTHIA GAMA FEIJAO",
      "cpf": "47419172234",
      "status": "Demitido",
      "data_admissao": "19/07/2017",
      "data_admissao_iso": "2017-07-19T03:00:00Z",
      "data_demissao": "17/04/2024",
      "data_demissao_iso": "2024-04-17T03:00:00Z",
      "email": "",
      "nome_funcao": "000108 - VENDEDOR"
    },
    {
      "id_api": "22",
      "codigo": "000348",
      "matricula": "000348",
      "nome": "CRISTIANO GABRIELL PORTO CRUZ",
      "cpf": "2267169290",
      "status": "Demitido",
      "data_admissao": "11/09/2017",
      "data_admissao_iso": "2017-09-11T03:00:00Z",
      "data_demissao": "26/03/2023",
      "data_demissao_iso": "2023-03-26T03:00:00Z",
      "email": "",
      "nome_funcao": "000134 - COORDENADOR DE TI"
    },
    {
      "id_api": "760",
      "codigo": "000351",
      "matricula": "000351",
      "nome": "NERON DA FONSECA PINHEIRO",
      "cpf": "81898053200",
      "status": "Demitido",
      "data_admissao": "01/11/2017",
      "data_admissao_iso": "2017-11-01T02:00:00Z",
      "data_demissao": "21/01/2019",
      "data_demissao_iso": "2019-01-21T02:00:00Z",
      "email": "",
      "nome_funcao": "000025 - AJUSTADOR/ALIMENTADOR DE MAQ CARTONAGEM"
    },
    {
      "id_api": "1011",
      "codigo": "000352",
      "matricula": "000352",
      "nome": "FABIO FEITOSA DOS SANTOS",
      "cpf": "51058391291",
      "status": "Demitido",
      "data_admissao": "01/11/2017",
      "data_admissao_iso": "2017-11-01T02:00:00Z",
      "data_demissao": "25/07/2019",
      "data_demissao_iso": "2019-07-25T03:00:00Z",
      "email": "",
      "nome_funcao": "000131 - ANALISTA DE DESENVOLVIMENTO"
    },
    {
      "id_api": "133",
      "codigo": "000353",
      "matricula": "000353",
      "nome": "EUQUIAS GONÇALVES FERNANDES",
      "cpf": "73024546200",
      "status": "Demitido",
      "data_admissao": "16/11/2017",
      "data_admissao_iso": "2017-11-16T02:00:00Z",
      "data_demissao": "08/12/2020",
      "data_demissao_iso": "2020-12-08T03:00:00Z",
      "email": "",
      "nome_funcao": "000126 - GERENTE DE PRODUÇAO"
    },
    {
      "id_api": "1019",
      "codigo": "000354",
      "matricula": "000354",
      "nome": "HENRIQUE CARLOS GAMA SOUZA",
      "cpf": "76361446204",
      "status": "Demitido",
      "data_admissao": "05/02/2018",
      "data_admissao_iso": "2018-02-05T02:00:00Z",
      "data_demissao": "15/02/2018",
      "data_demissao_iso": "2018-02-15T02:00:00Z",
      "email": "",
      "nome_funcao": "000112 - AUX DE PRODUCAO"
    },
    {
      "id_api": "1046",
      "codigo": "000355",
      "matricula": "000355",
      "nome": "AROLDO VICTOR MAGLIONE GRATELI CRUZ",
      "cpf": "86355783253",
      "status": "Demitido",
      "data_admissao": "05/02/2018",
      "data_admissao_iso": "2018-02-05T02:00:00Z",
      "data_demissao": "21/05/2018",
      "data_demissao_iso": "2018-05-21T03:00:00Z",
      "email": "",
      "nome_funcao": "000112 - AUX DE PRODUCAO"
    },
    {
      "id_api": "949",
      "codigo": "000356",
      "matricula": "000356",
      "nome": "ROBERT RAFAELLE FERNANDES PINHEIRO",
      "cpf": "77985303200",
      "status": "Demitido",
      "data_admissao": "05/02/2018",
      "data_admissao_iso": "2018-02-05T02:00:00Z",
      "data_demissao": "08/10/2018",
      "data_demissao_iso": "2018-10-08T03:00:00Z",
      "email": "",
      "nome_funcao": "000112 - AUX DE PRODUCAO"
    },
    {
      "id_api": "464",
      "codigo": "000357",
      "matricula": "000357",
      "nome": "ALEX DOS SANTOS RIBEIRO",
      "cpf": "92905188200",
      "status": "Demitido",
      "data_admissao": "05/02/2018",
      "data_admissao_iso": "2018-02-05T02:00:00Z",
      "data_demissao": "13/04/2023",
      "data_demissao_iso": "2023-04-13T03:00:00Z",
      "email": "",
      "nome_funcao": "000272 - AUXILIAR DE LOGISTICA"
    },
    {
      "id_api": "626",
      "codigo": "000358",
      "matricula": "000358",
      "nome": "FABIANO TRINDADE DA SILVA",
      "cpf": "2122931256",
      "status": "Demitido",
      "data_admissao": "05/02/2018",
      "data_admissao_iso": "2018-02-05T02:00:00Z",
      "data_demissao": "02/02/2018",
      "data_demissao_iso": "2018-02-02T02:00:00Z",
      "email": "",
      "nome_funcao": "000112 - AUX DE PRODUCAO"
    },
    {
      "id_api": "845",
      "codigo": "000359",
      "matricula": "000359",
      "nome": "DANIEL RODRIGUES DA SILVA",
      "cpf": "99452219220",
      "status": "Demitido",
      "data_admissao": "05/02/2018",
      "data_admissao_iso": "2018-02-05T02:00:00Z",
      "data_demissao": "16/10/2019",
      "data_demissao_iso": "2019-10-16T03:00:00Z",
      "email": "",
      "nome_funcao": "000131 - ANALISTA DE DESENVOLVIMENTO"
    },
    {
      "id_api": "844",
      "codigo": "000360",
      "matricula": "000360",
      "nome": "ROBENILSON LOPES NOGUEIRA",
      "cpf": "54541646234",
      "status": "Demitido",
      "data_admissao": "05/02/2018",
      "data_admissao_iso": "2018-02-05T02:00:00Z",
      "data_demissao": "03/05/2021",
      "data_demissao_iso": "2021-05-03T03:00:00Z",
      "email": "",
      "nome_funcao": "000271 - AUXILIAR DE MANUTENÇÃO"
    },
    {
      "id_api": "131",
      "codigo": "000361",
      "matricula": "000361",
      "nome": "HERLAN MOTTA DE SOUZA",
      "cpf": "89756274204",
      "status": "Demitido",
      "data_admissao": "05/02/2018",
      "data_admissao_iso": "2018-02-05T02:00:00Z",
      "data_demissao": "13/06/2019",
      "data_demissao_iso": "2019-06-13T03:00:00Z",
      "email": "",
      "nome_funcao": "000112 - AUX DE PRODUCAO"
    },
    {
      "id_api": "1055",
      "codigo": "000362",
      "matricula": "000362",
      "nome": "NATANAEL GLORIA DE FREITAS",
      "cpf": "358605296",
      "status": "Demitido",
      "data_admissao": "09/02/2018",
      "data_admissao_iso": "2018-02-09T02:00:00Z",
      "data_demissao": "02/07/2018",
      "data_demissao_iso": "2018-07-02T03:00:00Z",
      "email": "",
      "nome_funcao": "000271 - AUXILIAR DE MANUTENÇÃO"
    },
    {
      "id_api": "1075",
      "codigo": "000363",
      "matricula": "000363",
      "nome": "CHRYSLLER KESS DA ROCHA VILA NOVA",
      "cpf": "4177003263",
      "status": "Demitido",
      "data_admissao": "05/03/2018",
      "data_admissao_iso": "2018-03-05T03:00:00Z",
      "data_demissao": "04/03/2020",
      "data_demissao_iso": "2020-03-04T03:00:00Z",
      "email": "",
      "nome_funcao": "000004 - APRENDIZ ASSIST ADM IND"
    },
    {
      "id_api": "1064",
      "codigo": "000364",
      "matricula": "000364",
      "nome": "LUCAS RODRIGUES VITOR PRINTES",
      "cpf": "70429705271",
      "status": "Demitido",
      "data_admissao": "05/03/2018",
      "data_admissao_iso": "2018-03-05T03:00:00Z",
      "data_demissao": "04/03/2020",
      "data_demissao_iso": "2020-03-04T03:00:00Z",
      "email": "",
      "nome_funcao": "000004 - APRENDIZ ASSIST ADM IND"
    },
    {
      "id_api": "1028",
      "codigo": "000365",
      "matricula": "000365",
      "nome": "CESAR AUGUSTO FARIAS SILVA",
      "cpf": "84872179234",
      "status": "Demitido",
      "data_admissao": "02/04/2018",
      "data_admissao_iso": "2018-04-02T03:00:00Z",
      "data_demissao": "25/09/2018",
      "data_demissao_iso": "2018-09-25T03:00:00Z",
      "email": "",
      "nome_funcao": "000041 - TECNICO AMBIENTAL"
    },
    {
      "id_api": "917",
      "codigo": "000367",
      "matricula": "000367",
      "nome": "RAIMUNDO NONATO DA SILVA XAVIER",
      "cpf": "58879803204",
      "status": "Demitido",
      "data_admissao": "02/04/2018",
      "data_admissao_iso": "2018-04-02T03:00:00Z",
      "data_demissao": "25/04/2020",
      "data_demissao_iso": "2020-04-25T03:00:00Z",
      "email": "",
      "nome_funcao": "000144 - TECNICO EM RECEBIMENTO"
    },
    {
      "id_api": "125",
      "codigo": "000369",
      "matricula": "000369",
      "nome": "CARLOS AUGUSTO DO NASCIMENTO MARTINS",
      "cpf": "3212789255",
      "status": "Demitido",
      "data_admissao": "02/04/2018",
      "data_admissao_iso": "2018-04-02T03:00:00Z",
      "data_demissao": "10/12/2019",
      "data_demissao_iso": "2019-12-10T03:00:00Z",
      "email": "",
      "nome_funcao": "000112 - AUX DE PRODUCAO"
    },
    {
      "id_api": "1065",
      "codigo": "000371",
      "matricula": "000371",
      "nome": "LEONARDO SANTOS DE OLIVEIRA",
      "cpf": "2507182270",
      "status": "Demitido",
      "data_admissao": "23/04/2018",
      "data_admissao_iso": "2018-04-23T03:00:00Z",
      "data_demissao": "26/07/2021",
      "data_demissao_iso": "2021-07-26T03:00:00Z",
      "email": "",
      "nome_funcao": "000251 - ANALISTA DE QUALIDADE"
    },
    {
      "id_api": "722",
      "codigo": "000373",
      "matricula": "000373",
      "nome": "JOSIVAN DE FREITAS PESSOA",
      "cpf": "81412185220",
      "status": "Demitido",
      "data_admissao": "02/05/2018",
      "data_admissao_iso": "2018-05-02T03:00:00Z",
      "data_demissao": "06/07/2018",
      "data_demissao_iso": "2018-07-06T03:00:00Z",
      "email": "",
      "nome_funcao": "000112 - AUX DE PRODUCAO"
    },
    {
      "id_api": "581",
      "codigo": "000374",
      "matricula": "000374",
      "nome": "ZICO CRUZ LIBORIO",
      "cpf": "73779024268",
      "status": "Demitido",
      "data_admissao": "14/05/2018",
      "data_admissao_iso": "2018-05-14T03:00:00Z",
      "data_demissao": "30/05/2024",
      "data_demissao_iso": "2024-05-30T03:00:00Z",
      "email": "",
      "nome_funcao": "000131 - ANALISTA DE DESENVOLVIMENTO"
    },
    {
      "id_api": "989",
      "codigo": "000375",
      "matricula": "000375",
      "nome": "FRANCISCO MENEZES AMANCIO",
      "cpf": "67966845249",
      "status": "Demitido",
      "data_admissao": "01/06/2018",
      "data_admissao_iso": "2018-06-01T03:00:00Z",
      "data_demissao": "06/04/2024",
      "data_demissao_iso": "2024-04-06T03:00:00Z",
      "email": "",
      "nome_funcao": "000322 - OPERADOR DE MAQUINA DE CARTONAGEM"
    },
    {
      "id_api": "7",
      "codigo": "000376",
      "matricula": "000376",
      "nome": "MARCOS RODRIGO RODRIGUES DOS SANTOS",
      "cpf": "4590245310",
      "status": "Demitido",
      "data_admissao": "01/06/2018",
      "data_admissao_iso": "2018-06-01T03:00:00Z",
      "data_demissao": "23/07/2019",
      "data_demissao_iso": "2019-07-23T03:00:00Z",
      "email": "",
      "nome_funcao": "000112 - AUX DE PRODUCAO"
    },
    {
      "id_api": "926",
      "codigo": "000377",
      "matricula": "000377",
      "nome": "JONE MIRANDA BRANDAO",
      "cpf": "54604672253",
      "status": "Demitido",
      "data_admissao": "12/06/2018",
      "data_admissao_iso": "2018-06-12T03:00:00Z",
      "data_demissao": "11/02/2019",
      "data_demissao_iso": "2019-02-11T02:00:00Z",
      "email": "",
      "nome_funcao": "000112 - AUX DE PRODUCAO"
    },
    {
      "id_api": "1004",
      "codigo": "000378",
      "matricula": "000378",
      "nome": "JANDER BRASIL FERNANDES",
      "cpf": "722591241",
      "status": "Demitido",
      "data_admissao": "18/06/2018",
      "data_admissao_iso": "2018-06-18T03:00:00Z",
      "data_demissao": "26/03/2019",
      "data_demissao_iso": "2019-03-26T03:00:00Z",
      "email": "",
      "nome_funcao": "000272 - AUXILIAR DE LOGISTICA"
    },
    {
      "id_api": "736",
      "codigo": "000379",
      "matricula": "000379",
      "nome": "HILARIO BATISTA DA SILVA JUNIOR",
      "cpf": "75753472249",
      "status": "Demitido",
      "data_admissao": "02/07/2018",
      "data_admissao_iso": "2018-07-02T03:00:00Z",
      "data_demissao": "31/07/2018",
      "data_demissao_iso": "2018-07-31T03:00:00Z",
      "email": "",
      "nome_funcao": "000112 - AUX DE PRODUCAO"
    },
    {
      "id_api": "896",
      "codigo": "000380",
      "matricula": "000380",
      "nome": "GENILSON MACIEL DOS SANTOS",
      "cpf": "69342636268",
      "status": "Demitido",
      "data_admissao": "02/07/2018",
      "data_admissao_iso": "2018-07-02T03:00:00Z",
      "data_demissao": "03/09/2019",
      "data_demissao_iso": "2019-09-03T03:00:00Z",
      "email": "",
      "nome_funcao": "000019 - INSPETOR DE QUALIDADE"
    },
    {
      "id_api": "1085",
      "codigo": "000381",
      "matricula": "000381",
      "nome": "CIDARTA REGIS DE SOUZA",
      "cpf": "97209546200",
      "status": "Demitido",
      "data_admissao": "02/07/2018",
      "data_admissao_iso": "2018-07-02T03:00:00Z",
      "data_demissao": "31/01/2019",
      "data_demissao_iso": "2019-01-31T02:00:00Z",
      "email": "",
      "nome_funcao": "000112 - AUX DE PRODUCAO"
    },
    {
      "id_api": "1082",
      "codigo": "000384",
      "matricula": "000384",
      "nome": "IGOMARA CARITA ARAUJO MENDES",
      "cpf": "96588063253",
      "status": "Demitido",
      "data_admissao": "27/08/2018",
      "data_admissao_iso": "2018-08-27T03:00:00Z",
      "data_demissao": "17/12/2018",
      "data_demissao_iso": "2018-12-17T02:00:00Z",
      "email": "",
      "nome_funcao": "000275 - Chefe de cozinha"
    },
    {
      "id_api": "135",
      "codigo": "000385",
      "matricula": "000385",
      "nome": "SONIA MARIA RIBEIRO MOURA",
      "cpf": "45667306204",
      "status": "Demitido",
      "data_admissao": "03/09/2018",
      "data_admissao_iso": "2018-09-03T03:00:00Z",
      "data_demissao": "29/03/2021",
      "data_demissao_iso": "2021-03-29T03:00:00Z",
      "email": "",
      "nome_funcao": "000264 - COZINHEIRA"
    },
    {
      "id_api": "1074",
      "codigo": "000386",
      "matricula": "000386",
      "nome": "MARCILEIA REGINA DOS SANTOS BARBOSA",
      "cpf": "44188498234",
      "status": "Demitido",
      "data_admissao": "17/09/2018",
      "data_admissao_iso": "2018-09-17T03:00:00Z",
      "data_demissao": "03/12/2019",
      "data_demissao_iso": "2019-12-03T03:00:00Z",
      "email": "",
      "nome_funcao": "000105 - AUX. DE SERVICOS GERAIS"
    },
    {
      "id_api": "908",
      "codigo": "000387",
      "matricula": "000387",
      "nome": "DIEGO DE SOUZA BRAGA",
      "cpf": "91832098249",
      "status": "Demitido",
      "data_admissao": "17/09/2018",
      "data_admissao_iso": "2018-09-17T03:00:00Z",
      "data_demissao": "28/01/2021",
      "data_demissao_iso": "2021-01-28T03:00:00Z",
      "email": "",
      "nome_funcao": "000235 - ANALISTA DE SGI"
    },
    {
      "id_api": "950",
      "codigo": "000388",
      "matricula": "000388",
      "nome": "PAULO ROBERTO DA SILVA NASCIMENTO",
      "cpf": "77392108204",
      "status": "Demitido",
      "data_admissao": "17/09/2018",
      "data_admissao_iso": "2018-09-17T03:00:00Z",
      "data_demissao": "03/10/2018",
      "data_demissao_iso": "2018-10-03T03:00:00Z",
      "email": "",
      "nome_funcao": "000272 - AUXILIAR DE LOGISTICA"
    },
    {
      "id_api": "1094",
      "codigo": "000389",
      "matricula": "000389",
      "nome": "FABIO MOREIRA BATISTA",
      "cpf": "79671870244",
      "status": "Demitido",
      "data_admissao": "17/09/2018",
      "data_admissao_iso": "2018-09-17T03:00:00Z",
      "data_demissao": "08/02/2020",
      "data_demissao_iso": "2020-02-08T03:00:00Z",
      "email": "",
      "nome_funcao": "000112 - AUX DE PRODUCAO"
    },
    {
      "id_api": "1078",
      "codigo": "000391",
      "matricula": "000391",
      "nome": "FRANCISCO MICHARLES SOUZA SENA",
      "cpf": "61340243253",
      "status": "Demitido",
      "data_admissao": "17/09/2018",
      "data_admissao_iso": "2018-09-17T03:00:00Z",
      "data_demissao": "14/09/2020",
      "data_demissao_iso": "2020-09-14T03:00:00Z",
      "email": "",
      "nome_funcao": "000105 - AUX. DE SERVICOS GERAIS"
    },
    {
      "id_api": "1102",
      "codigo": "000392",
      "matricula": "000392",
      "nome": "ORLEILSON SOUZA DO NASCIMENTO",
      "cpf": "70195910273",
      "status": "Demitido",
      "data_admissao": "17/09/2018",
      "data_admissao_iso": "2018-09-17T03:00:00Z",
      "data_demissao": "18/02/2020",
      "data_demissao_iso": "2020-02-18T03:00:00Z",
      "email": "",
      "nome_funcao": "000112 - AUX DE PRODUCAO"
    },
    {
      "id_api": "1010",
      "codigo": "000393",
      "matricula": "000393",
      "nome": "AILTON AZEDO PESSOA",
      "cpf": "1359105280",
      "status": "Demitido",
      "data_admissao": "17/09/2018",
      "data_admissao_iso": "2018-09-17T03:00:00Z",
      "data_demissao": "14/11/2018",
      "data_demissao_iso": "2018-11-14T02:00:00Z",
      "email": "",
      "nome_funcao": "000112 - AUX DE PRODUCAO"
    },
    {
      "id_api": "64",
      "codigo": "000394",
      "matricula": "000394",
      "nome": "ANTONIO CARLOS SOUZA DO NASCIMENTO",
      "cpf": "409409260",
      "status": "Demitido",
      "data_admissao": "01/10/2018",
      "data_admissao_iso": "2018-10-01T03:00:00Z",
      "data_demissao": "03/03/2022",
      "data_demissao_iso": "2022-03-03T03:00:00Z",
      "email": "",
      "nome_funcao": "000104 - FATURISTA"
    },
    {
      "id_api": "1089",
      "codigo": "000398",
      "matricula": "000398",
      "nome": "ADRIANO MELO GOMES",
      "cpf": "78977592291",
      "status": "Demitido",
      "data_admissao": "03/12/2018",
      "data_admissao_iso": "2018-12-03T02:00:00Z",
      "data_demissao": "25/05/2021",
      "data_demissao_iso": "2021-05-25T03:00:00Z",
      "email": "",
      "nome_funcao": "000064 - OPERADOR DE MAQUINA DE CARTONAGEM"
    },
    {
      "id_api": "982",
      "codigo": "000401",
      "matricula": "000401",
      "nome": "JANDERSON CARDOSO VIEIRA",
      "cpf": "85462209215",
      "status": "Demitido",
      "data_admissao": "15/02/2019",
      "data_admissao_iso": "2019-02-15T02:00:00Z",
      "data_demissao": "09/05/2022",
      "data_demissao_iso": "2022-05-09T03:00:00Z",
      "email": "",
      "nome_funcao": "000153 - AJUSTADOR/ALIMENTADOR DE MAQ CARTONAGEM"
    },
    {
      "id_api": "986",
      "codigo": "000402",
      "matricula": "000402",
      "nome": "JADSON ANDRADE PEREIRA",
      "cpf": "84529644200",
      "status": "Demitido",
      "data_admissao": "15/02/2019",
      "data_admissao_iso": "2019-02-15T02:00:00Z",
      "data_demissao": "09/01/2023",
      "data_demissao_iso": "2023-01-09T03:00:00Z",
      "email": "",
      "nome_funcao": "000064 - OPERADOR DE MAQUINA DE CARTONAGEM"
    },
    {
      "id_api": "445",
      "codigo": "000403",
      "matricula": "000403",
      "nome": "ADRIAN BARBOSA DA SILVA",
      "cpf": "4950507257",
      "status": "Demitido",
      "data_admissao": "15/02/2019",
      "data_admissao_iso": "2019-02-15T02:00:00Z",
      "data_demissao": "23/07/2021",
      "data_demissao_iso": "2021-07-23T03:00:00Z",
      "email": "",
      "nome_funcao": "000023 - AUXILIAR DE PRODUÇAO"
    },
    {
      "id_api": "984",
      "codigo": "000404",
      "matricula": "000404",
      "nome": "HUDSON DA CONCEICAO DO NASCIMENTO",
      "cpf": "68380674200",
      "status": "Demitido",
      "data_admissao": "15/02/2019",
      "data_admissao_iso": "2019-02-15T02:00:00Z",
      "data_demissao": "18/11/2021",
      "data_demissao_iso": "2021-11-18T03:00:00Z",
      "email": "",
      "nome_funcao": "000023 - AUXILIAR DE PRODUÇAO"
    },
    {
      "id_api": "137",
      "codigo": "000405",
      "matricula": "000405",
      "nome": "RODRIGO ARAUJO ROSAS",
      "cpf": "74326937220",
      "status": "Demitido",
      "data_admissao": "15/02/2019",
      "data_admissao_iso": "2019-02-15T02:00:00Z",
      "data_demissao": "05/02/2020",
      "data_demissao_iso": "2020-02-05T03:00:00Z",
      "email": "",
      "nome_funcao": "000112 - AUX DE PRODUCAO"
    },
    {
      "id_api": "1093",
      "codigo": "000406",
      "matricula": "000406",
      "nome": "GABRIEL DA SILVA COELHO",
      "cpf": "2609202237",
      "status": "Demitido",
      "data_admissao": "15/02/2019",
      "data_admissao_iso": "2019-02-15T02:00:00Z",
      "data_demissao": "26/07/2020",
      "data_demissao_iso": "2020-07-26T03:00:00Z",
      "email": "",
      "nome_funcao": "000112 - AUX DE PRODUCAO"
    },
    {
      "id_api": "933",
      "codigo": "000408",
      "matricula": "000408",
      "nome": "FRANCISCO LEITE DA COSTA",
      "cpf": "72783230291",
      "status": "Demitido",
      "data_admissao": "15/02/2019",
      "data_admissao_iso": "2019-02-15T02:00:00Z",
      "data_demissao": "26/12/2019",
      "data_demissao_iso": "2019-12-26T03:00:00Z",
      "email": "",
      "nome_funcao": "000112 - AUX DE PRODUCAO"
    },
    {
      "id_api": "944",
      "codigo": "000409",
      "matricula": "000409",
      "nome": "WILLIAN DEAN DE LIMA CORREIA",
      "cpf": "2332435263",
      "status": "Demitido",
      "data_admissao": "15/02/2019",
      "data_admissao_iso": "2019-02-15T02:00:00Z",
      "data_demissao": "14/07/2021",
      "data_demissao_iso": "2021-07-14T03:00:00Z",
      "email": "",
      "nome_funcao": "000153 - AJUSTADOR/ALIMENTADOR DE MAQ CARTONAGEM"
    },
    {
      "id_api": "952",
      "codigo": "000410",
      "matricula": "000410",
      "nome": "FABIANO DA FONSECA",
      "cpf": "60022125310",
      "status": "Demitido",
      "data_admissao": "18/02/2019",
      "data_admissao_iso": "2019-02-18T03:00:00Z",
      "data_demissao": "06/06/2024",
      "data_demissao_iso": "2024-06-06T03:00:00Z",
      "email": "",
      "nome_funcao": "000154 - SOLDADOR"
    },
    {
      "id_api": "1003",
      "codigo": "000411",
      "matricula": "000411",
      "nome": "ROCINE ARAGAO DE SOUZA",
      "cpf": "31736939220",
      "status": "Demitido",
      "data_admissao": "21/02/2019",
      "data_admissao_iso": "2019-02-21T03:00:00Z",
      "data_demissao": "23/09/2020",
      "data_demissao_iso": "2020-09-23T03:00:00Z",
      "email": "",
      "nome_funcao": "000272 - AUXILIAR DE LOGISTICA"
    },
    {
      "id_api": "729",
      "codigo": "000412",
      "matricula": "000412",
      "nome": "BRUNO PASSITO QUEIROZ",
      "cpf": "1462010270",
      "status": "Demitido",
      "data_admissao": "02/03/2019",
      "data_admissao_iso": "2019-03-02T03:00:00Z",
      "data_demissao": "09/04/2019",
      "data_demissao_iso": "2019-04-09T03:00:00Z",
      "email": "",
      "nome_funcao": "000272 - AUXILIAR DE LOGISTICA"
    },
    {
      "id_api": "26",
      "codigo": "000413",
      "matricula": "000413",
      "nome": "JULIO BULHOES GUIMARAES",
      "cpf": "76694666268",
      "status": "Demitido",
      "data_admissao": "02/03/2019",
      "data_admissao_iso": "2019-03-02T03:00:00Z",
      "data_demissao": "06/11/2021",
      "data_demissao_iso": "2021-11-06T03:00:00Z",
      "email": "",
      "nome_funcao": "000047 - LIDER DE COLAGEM"
    },
    {
      "id_api": "1101",
      "codigo": "000416",
      "matricula": "000416",
      "nome": "DEIVED VIEIRA ARAUJO",
      "cpf": "98539108291",
      "status": "Demitido",
      "data_admissao": "10/05/2019",
      "data_admissao_iso": "2019-05-10T03:00:00Z",
      "data_demissao": "26/07/2020",
      "data_demissao_iso": "2020-07-26T03:00:00Z",
      "email": "",
      "nome_funcao": "000048 - AUXILIAR DE PRODUCAO"
    },
    {
      "id_api": "899",
      "codigo": "000417",
      "matricula": "000417",
      "nome": "WESLEY CUNHA DO NASCIMENTO",
      "cpf": "70431516278",
      "status": "Demitido",
      "data_admissao": "10/06/2019",
      "data_admissao_iso": "2019-06-10T03:00:00Z",
      "data_demissao": "07/05/2021",
      "data_demissao_iso": "2021-05-07T03:00:00Z",
      "email": "",
      "nome_funcao": "000006 - APRENDIZ ASSIST ADM IND"
    },
    {
      "id_api": "25",
      "codigo": "000418",
      "matricula": "000418",
      "nome": "DERIK FERREIRA COSTA",
      "cpf": "16068047822",
      "status": "Demitido",
      "data_admissao": "11/06/2019",
      "data_admissao_iso": "2019-06-11T03:00:00Z",
      "data_demissao": "06/11/2021",
      "data_demissao_iso": "2021-11-06T03:00:00Z",
      "email": "",
      "nome_funcao": "000106 - GERENTE DE LOGISTICA"
    },
    {
      "id_api": "514",
      "codigo": "000419",
      "matricula": "000419",
      "nome": "MILENE RIBEIRO DE FREITAS",
      "cpf": "76674983268",
      "status": "Demitido",
      "data_admissao": "05/07/2019",
      "data_admissao_iso": "2019-07-05T03:00:00Z",
      "data_demissao": "22/03/2020",
      "data_demissao_iso": "2020-03-22T03:00:00Z",
      "email": "",
      "nome_funcao": "000264 - COZINHEIRA"
    },
    {
      "id_api": "29",
      "codigo": "000420",
      "matricula": "000420",
      "nome": "WILLIAMS ALENCAR DOS SANTOS",
      "cpf": "91347637249",
      "status": "Demitido",
      "data_admissao": "01/10/2019",
      "data_admissao_iso": "2019-10-01T03:00:00Z",
      "data_demissao": "29/10/2021",
      "data_demissao_iso": "2021-10-29T03:00:00Z",
      "email": "",
      "nome_funcao": "000049 - LIDER OPERADOR DE MAQ CARTONAGEM"
    },
    {
      "id_api": "9",
      "codigo": "000421",
      "matricula": "000421",
      "nome": "DARLISON FERREIRA DE SOUSA",
      "cpf": "99341093287",
      "status": "Demitido",
      "data_admissao": "01/10/2019",
      "data_admissao_iso": "2019-10-01T03:00:00Z",
      "data_demissao": "23/04/2020",
      "data_demissao_iso": "2020-04-23T03:00:00Z",
      "email": "",
      "nome_funcao": "000131 - ANALISTA DE DESENVOLVIMENTO"
    },
    {
      "id_api": "13",
      "codigo": "000422",
      "matricula": "000422",
      "nome": "CARLEANDRO DOS REIS SENA",
      "cpf": "72291397249",
      "status": "Demitido",
      "data_admissao": "01/10/2019",
      "data_admissao_iso": "2019-10-01T03:00:00Z",
      "data_demissao": "27/03/2021",
      "data_demissao_iso": "2021-03-27T03:00:00Z",
      "email": "",
      "nome_funcao": "000037 - ENCARREGADO DE PRODUÇAO"
    },
    {
      "id_api": "17",
      "codigo": "000423",
      "matricula": "000423",
      "nome": "CLEOTON JOSE COSTA DUTRA",
      "cpf": "55935923220",
      "status": "Demitido",
      "data_admissao": "17/10/2019",
      "data_admissao_iso": "2019-10-17T03:00:00Z",
      "data_demissao": "03/08/2022",
      "data_demissao_iso": "2022-08-03T03:00:00Z",
      "email": "",
      "nome_funcao": "000023 - AUXILIAR DE PRODUÇAO"
    },
    {
      "id_api": "85",
      "codigo": "000424",
      "matricula": "000424",
      "nome": "ANDRIO FEITOSA QUEIROZ",
      "cpf": "2926068263",
      "status": "Demitido",
      "data_admissao": "17/10/2019",
      "data_admissao_iso": "2019-10-17T03:00:00Z",
      "data_demissao": "04/05/2021",
      "data_demissao_iso": "2021-05-04T03:00:00Z",
      "email": "",
      "nome_funcao": "000153 - AJUSTADOR/ALIMENTADOR DE MAQ CARTONAGEM"
    },
    {
      "id_api": "44",
      "codigo": "000425",
      "matricula": "000425",
      "nome": "EVERTON GOMES DA SILVA",
      "cpf": "75498774249",
      "status": "Demitido",
      "data_admissao": "17/10/2019",
      "data_admissao_iso": "2019-10-17T03:00:00Z",
      "data_demissao": "10/01/2022",
      "data_demissao_iso": "2022-01-10T03:00:00Z",
      "email": "",
      "nome_funcao": "000023 - AUXILIAR DE PRODUÇAO"
    },
    {
      "id_api": "846",
      "codigo": "000426",
      "matricula": "000426",
      "nome": "MICHAEL FERNANDES DA SILVA",
      "cpf": "44505663272",
      "status": "Demitido",
      "data_admissao": "03/02/2020",
      "data_admissao_iso": "2020-02-03T03:00:00Z",
      "data_demissao": "06/08/2021",
      "data_demissao_iso": "2021-08-06T03:00:00Z",
      "email": "",
      "nome_funcao": "000098 - INSPETOR DE QUALIDADE"
    },
    {
      "id_api": "6",
      "codigo": "000429",
      "matricula": "000429",
      "nome": "ADINELSON BEZERRA VIANA",
      "cpf": "15266214287",
      "status": "Demitido",
      "data_admissao": "05/03/2020",
      "data_admissao_iso": "2020-03-05T03:00:00Z",
      "data_demissao": "28/10/2024",
      "data_demissao_iso": "2024-10-28T03:00:00Z",
      "email": "",
      "nome_funcao": "000321 - AUXILIAR DE PRODUÇÃO"
    },
    {
      "id_api": "963",
      "codigo": "000430",
      "matricula": "000430",
      "nome": "MOZEVALDO SIMOES PEREIRA",
      "cpf": "38413639204",
      "status": "Demitido",
      "data_admissao": "05/03/2020",
      "data_admissao_iso": "2020-03-05T03:00:00Z",
      "data_demissao": "18/10/2022",
      "data_demissao_iso": "2022-10-18T03:00:00Z",
      "email": "",
      "nome_funcao": "000023 - AUXILIAR DE PRODUÇAO"
    },
    {
      "id_api": "138",
      "codigo": "000431",
      "matricula": "000431",
      "nome": "HELTON JUSTINIANO CAVALCANTE",
      "cpf": "71025090225",
      "status": "Demitido",
      "data_admissao": "06/03/2020",
      "data_admissao_iso": "2020-03-06T03:00:00Z",
      "data_demissao": "22/05/2021",
      "data_demissao_iso": "2021-05-22T03:00:00Z",
      "email": "",
      "nome_funcao": "000153 - AJUSTADOR/ALIMENTADOR DE MAQ CARTONAGEM"
    },
    {
      "id_api": "941",
      "codigo": "000432",
      "matricula": "000432",
      "nome": "LUIZ LUCIVALDO SILVA NOGUEIRA",
      "cpf": "23236701234",
      "status": "Demitido",
      "data_admissao": "13/03/2020",
      "data_admissao_iso": "2020-03-13T03:00:00Z",
      "data_demissao": "01/03/2021",
      "data_demissao_iso": "2021-03-01T03:00:00Z",
      "email": "",
      "nome_funcao": "000023 - AUXILIAR DE PRODUÇAO"
    },
    {
      "id_api": "134",
      "codigo": "000433",
      "matricula": "000433",
      "nome": "JOSENIAS FERREIRA DE SOUZA",
      "cpf": "62107186200",
      "status": "Demitido",
      "data_admissao": "13/03/2020",
      "data_admissao_iso": "2020-03-13T03:00:00Z",
      "data_demissao": "04/05/2020",
      "data_demissao_iso": "2020-05-04T03:00:00Z",
      "email": "",
      "nome_funcao": "000081 - LIDER SOLDADOR"
    },
    {
      "id_api": "959",
      "codigo": "000434",
      "matricula": "000434",
      "nome": "LUCAS RODRIGUES VITOR PRINTES",
      "cpf": "70429705271",
      "status": "Demitido",
      "data_admissao": "14/07/2020",
      "data_admissao_iso": "2020-07-14T03:00:00Z",
      "data_demissao": "29/05/2023",
      "data_demissao_iso": "2023-05-29T03:00:00Z",
      "email": "",
      "nome_funcao": "000002 - Almoxarife"
    },
    {
      "id_api": "956",
      "codigo": "000435",
      "matricula": "000435",
      "nome": "CHRYSLLER KESS DA ROCHA VILA NOVA",
      "cpf": "4177003263",
      "status": "Demitido",
      "data_admissao": "14/07/2020",
      "data_admissao_iso": "2020-07-14T03:00:00Z",
      "data_demissao": "03/11/2020",
      "data_demissao_iso": "2020-11-03T03:00:00Z",
      "email": "",
      "nome_funcao": "000030 - ASSISTENTE ADMINISTRATIVO"
    },
    {
      "id_api": "954",
      "codigo": "000436",
      "matricula": "000436",
      "nome": "DINAR PINHEIRO DA SILVA",
      "cpf": "66340810268",
      "status": "Demitido",
      "data_admissao": "07/08/2020",
      "data_admissao_iso": "2020-08-07T03:00:00Z",
      "data_demissao": "05/12/2020",
      "data_demissao_iso": "2020-12-05T03:00:00Z",
      "email": "",
      "nome_funcao": "000267 - CHEFE DE COZINHA"
    },
    {
      "id_api": "965",
      "codigo": "000437",
      "matricula": "000437",
      "nome": "MIGUEL BEZERRA SILVA",
      "cpf": "70259200298",
      "status": "Demitido",
      "data_admissao": "17/08/2020",
      "data_admissao_iso": "2020-08-17T03:00:00Z",
      "data_demissao": "02/12/2021",
      "data_demissao_iso": "2021-12-02T03:00:00Z",
      "email": "",
      "nome_funcao": "000293 - Aprendiz Auxiliar de logistica"
    },
    {
      "id_api": "136",
      "codigo": "000438",
      "matricula": "000438",
      "nome": "IGOR DE OLIVEIRA DAMASCENO",
      "cpf": "70360410219",
      "status": "Demitido",
      "data_admissao": "10/09/2020",
      "data_admissao_iso": "2020-09-10T03:00:00Z",
      "data_demissao": "22/10/2020",
      "data_demissao_iso": "2020-10-22T03:00:00Z",
      "email": "",
      "nome_funcao": "000272 - AUXILIAR DE LOGISTICA"
    },
    {
      "id_api": "58",
      "codigo": "000439",
      "matricula": "000439",
      "nome": "LUCIAN DE ANDRADES MATOS",
      "cpf": "428636276",
      "status": "Demitido",
      "data_admissao": "10/09/2020",
      "data_admissao_iso": "2020-09-10T03:00:00Z",
      "data_demissao": "10/01/2022",
      "data_demissao_iso": "2022-01-10T03:00:00Z",
      "email": "",
      "nome_funcao": "000064 - OPERADOR DE MAQUINA DE CARTONAGEM"
    },
    {
      "id_api": "63",
      "codigo": "000440",
      "matricula": "000440",
      "nome": "MARCILAZIO RODRIGUES CARDOSO",
      "cpf": "2686685239",
      "status": "Demitido",
      "data_admissao": "10/09/2020",
      "data_admissao_iso": "2020-09-10T03:00:00Z",
      "data_demissao": "23/09/2021",
      "data_demissao_iso": "2021-09-23T03:00:00Z",
      "email": "",
      "nome_funcao": "000023 - AUXILIAR DE PRODUÇAO"
    },
    {
      "id_api": "935",
      "codigo": "000442",
      "matricula": "000442",
      "nome": "PAULO JUNIOR FRANCO RODRIGUES",
      "cpf": "51459647220",
      "status": "Demitido",
      "data_admissao": "09/12/2020",
      "data_admissao_iso": "2020-12-09T03:00:00Z",
      "data_demissao": "15/10/2022",
      "data_demissao_iso": "2022-10-15T03:00:00Z",
      "email": "",
      "nome_funcao": "000064 - OPERADOR DE MAQUINA DE CARTONAGEM"
    },
    {
      "id_api": "5",
      "codigo": "000444",
      "matricula": "000444",
      "nome": "ADRIANO DA SILVA E SILVA",
      "cpf": "3746199212",
      "status": "Demitido",
      "data_admissao": "09/12/2020",
      "data_admissao_iso": "2020-12-09T03:00:00Z",
      "data_demissao": "15/10/2022",
      "data_demissao_iso": "2022-10-15T03:00:00Z",
      "email": "",
      "nome_funcao": "000049 - LIDER OPERADOR DE MAQ CARTONAGEM"
    },
    {
      "id_api": "969",
      "codigo": "000445",
      "matricula": "000445",
      "nome": "FABIO ALEXANDRE NASCIMENTO MORAES",
      "cpf": "73393622234",
      "status": "Demitido",
      "data_admissao": "18/12/2020",
      "data_admissao_iso": "2020-12-18T03:00:00Z",
      "data_demissao": "18/10/2024",
      "data_demissao_iso": "2024-10-18T03:00:00Z",
      "email": "",
      "nome_funcao": "000316 - ANALISTA DE PCP PLENO"
    },
    {
      "id_api": "117",
      "codigo": "000447",
      "matricula": "000447",
      "nome": "TRINDADE RODRIGUES DE OLIVEIRA",
      "cpf": "34726950215",
      "status": "Demitido",
      "data_admissao": "08/01/2021",
      "data_admissao_iso": "2021-01-08T03:00:00Z",
      "data_demissao": "12/08/2021",
      "data_demissao_iso": "2021-08-12T03:00:00Z",
      "email": "",
      "nome_funcao": "000032 - COZINHEIRA"
    },
    {
      "id_api": "62",
      "codigo": "000449",
      "matricula": "000449",
      "nome": "YURI MELO ALVES",
      "cpf": "162775202",
      "status": "Demitido",
      "data_admissao": "16/02/2021",
      "data_admissao_iso": "2021-02-16T03:00:00Z",
      "data_demissao": "08/03/2022",
      "data_demissao_iso": "2022-03-08T03:00:00Z",
      "email": "",
      "nome_funcao": "000023 - AUXILIAR DE PRODUÇAO"
    },
    {
      "id_api": "962",
      "codigo": "000450",
      "matricula": "000450",
      "nome": "WILLIAN MARTINS BRAGA",
      "cpf": "3023623201",
      "status": "Demitido",
      "data_admissao": "16/02/2021",
      "data_admissao_iso": "2021-02-16T03:00:00Z",
      "data_demissao": "06/04/2023",
      "data_demissao_iso": "2023-04-06T03:00:00Z",
      "email": "",
      "nome_funcao": "000153 - AJUSTADOR/ALIMENTADOR DE MAQ CARTONAGEM"
    },
    {
      "id_api": "57",
      "codigo": "000451",
      "matricula": "000451",
      "nome": "CAROLINE NIJENHUIS DE SANTIS",
      "cpf": "76120473220",
      "status": "Demitido",
      "data_admissao": "24/02/2021",
      "data_admissao_iso": "2021-02-24T03:00:00Z",
      "data_demissao": "24/04/2021",
      "data_demissao_iso": "2021-04-24T03:00:00Z",
      "email": "",
      "nome_funcao": "000012 - ASSISTENTE ADMINISTRATIVO"
    },
    {
      "id_api": "86",
      "codigo": "000452",
      "matricula": "000452",
      "nome": "HERBERT NYENHUIS",
      "cpf": "34499920230",
      "status": "Demitido",
      "data_admissao": "24/02/2021",
      "data_admissao_iso": "2021-02-24T03:00:00Z",
      "data_demissao": "24/04/2021",
      "data_demissao_iso": "2021-04-24T03:00:00Z",
      "email": "",
      "nome_funcao": "000012 - ASSISTENTE ADMINISTRATIVO"
    },
    {
      "id_api": "60",
      "codigo": "000453",
      "matricula": "000453",
      "nome": "ITHALO CESAR PEREIRA LOPES",
      "cpf": "2664624300",
      "status": "Demitido",
      "data_admissao": "01/03/2021",
      "data_admissao_iso": "2021-03-01T03:00:00Z",
      "data_demissao": "03/02/2022",
      "data_demissao_iso": "2022-02-03T03:00:00Z",
      "email": "",
      "nome_funcao": "000006 - APRENDIZ ASSIST ADM IND"
    },
    {
      "id_api": "41",
      "codigo": "000455",
      "matricula": "000455",
      "nome": "PAULO ROBERTO TRINDADE DOS SANTOS",
      "cpf": "969485239",
      "status": "Demitido",
      "data_admissao": "10/03/2021",
      "data_admissao_iso": "2021-03-10T03:00:00Z",
      "data_demissao": "20/12/2021",
      "data_demissao_iso": "2021-12-20T03:00:00Z",
      "email": "",
      "nome_funcao": "000064 - OPERADOR DE MAQUINA DE CARTONAGEM"
    },
    {
      "id_api": "901",
      "codigo": "000456",
      "matricula": "000456",
      "nome": "IVAN RESK MORAES",
      "cpf": "626730252",
      "status": "Demitido",
      "data_admissao": "10/03/2021",
      "data_admissao_iso": "2021-03-10T03:00:00Z",
      "data_demissao": "17/05/2021",
      "data_demissao_iso": "2021-05-17T03:00:00Z",
      "email": "",
      "nome_funcao": "000298 - AUXILIAR DE SERVIÇOS GERAIS"
    },
    {
      "id_api": "907",
      "codigo": "000457",
      "matricula": "000457",
      "nome": "DANIEL RODRIGUES DA SILVA",
      "cpf": "99452219220",
      "status": "Demitido",
      "data_admissao": "10/03/2021",
      "data_admissao_iso": "2021-03-10T03:00:00Z",
      "data_demissao": "05/11/2022",
      "data_demissao_iso": "2022-11-05T03:00:00Z",
      "email": "",
      "nome_funcao": "000049 - LIDER OPERADOR DE MAQ CARTONAGEM"
    },
    {
      "id_api": "698",
      "codigo": "000458",
      "matricula": "000458",
      "nome": "SARAH MARIE IZEL DA SILVA GUEDES",
      "cpf": "286604205",
      "status": "Demitido",
      "data_admissao": "10/03/2021",
      "data_admissao_iso": "2021-03-10T03:00:00Z",
      "data_demissao": "16/07/2024",
      "data_demissao_iso": "2024-07-16T03:00:00Z",
      "email": "",
      "nome_funcao": "000235 - ANALISTA DE SGI"
    },
    {
      "id_api": "972",
      "codigo": "000459",
      "matricula": "000459",
      "nome": "WALTENCY DE MAGALHAES OSORIO",
      "cpf": "59948647220",
      "status": "Demitido",
      "data_admissao": "11/03/2021",
      "data_admissao_iso": "2021-03-11T03:00:00Z",
      "data_demissao": "16/08/2022",
      "data_demissao_iso": "2022-08-16T03:00:00Z",
      "email": "",
      "nome_funcao": "000049 - LIDER OPERADOR DE MAQ CARTONAGEM"
    },
    {
      "id_api": "971",
      "codigo": "000461",
      "matricula": "000461",
      "nome": "LUCAS MEDEIROS LOBATO",
      "cpf": "70505246201",
      "status": "Demitido",
      "data_admissao": "11/03/2021",
      "data_admissao_iso": "2021-03-11T03:00:00Z",
      "data_demissao": "13/05/2024",
      "data_demissao_iso": "2024-05-13T03:00:00Z",
      "email": "",
      "nome_funcao": "000104 - FATURISTA"
    },
    {
      "id_api": "420",
      "codigo": "000462",
      "matricula": "000462",
      "nome": "ELIZIO SANTOS DA SILVA",
      "cpf": "52505731268",
      "status": "Demitido",
      "data_admissao": "12/03/2021",
      "data_admissao_iso": "2021-03-12T03:00:00Z",
      "data_demissao": "28/09/2022",
      "data_demissao_iso": "2022-09-28T03:00:00Z",
      "email": "",
      "nome_funcao": "000299 - SUPERVISOR DE ALMOXARIFADO"
    },
    {
      "id_api": "968",
      "codigo": "000464",
      "matricula": "000464",
      "nome": "LUCINEIA DA SILVA RODRIGUES",
      "cpf": "14906147291",
      "status": "Demitido",
      "data_admissao": "18/03/2021",
      "data_admissao_iso": "2021-03-18T03:00:00Z",
      "data_demissao": "10/10/2022",
      "data_demissao_iso": "2022-10-10T03:00:00Z",
      "email": "",
      "nome_funcao": "000264 - COZINHEIRA"
    },
    {
      "id_api": "970",
      "codigo": "000465",
      "matricula": "000465",
      "nome": "JOÃO PAULO SOUZA ALVES",
      "cpf": "3324384222",
      "status": "Demitido",
      "data_admissao": "10/05/2021",
      "data_admissao_iso": "2021-05-10T03:00:00Z",
      "data_demissao": "13/07/2022",
      "data_demissao_iso": "2022-07-13T03:00:00Z",
      "email": "",
      "nome_funcao": "000298 - AUXILIAR DE SERVIÇOS GERAIS"
    },
    {
      "id_api": "834",
      "codigo": "000466",
      "matricula": "000466",
      "nome": "GENIVALDO DO NASCIMENTO PEREIRA JUNIOR",
      "cpf": "77868722215",
      "status": "Demitido",
      "data_admissao": "01/06/2021",
      "data_admissao_iso": "2021-06-01T03:00:00Z",
      "data_demissao": "04/12/2025",
      "data_demissao_iso": "2025-12-04T03:00:00Z",
      "email": "genivaldo.nasc@gmail.com ",
      "nome_funcao": "000131 - ANALISTA DE DESENVOLVIMENTO"
    },
    {
      "id_api": "101",
      "codigo": "000467",
      "matricula": "000467",
      "nome": "JANETE MONTEIRO MARQUES",
      "cpf": "59972629287",
      "status": "Demitido",
      "data_admissao": "10/06/2021",
      "data_admissao_iso": "2021-06-10T03:00:00Z",
      "data_demissao": "10/05/2022",
      "data_demissao_iso": "2022-05-10T03:00:00Z",
      "email": "",
      "nome_funcao": "000267 - CHEFE DE COZINHA"
    },
    {
      "id_api": "966",
      "codigo": "000468",
      "matricula": "000468",
      "nome": "JOAO GABRIEL SANTOS CAMPOS",
      "cpf": "70515377252",
      "status": "Demitido",
      "data_admissao": "14/06/2021",
      "data_admissao_iso": "2021-06-14T03:00:00Z",
      "data_demissao": "03/07/2023",
      "data_demissao_iso": "2023-07-03T03:00:00Z",
      "email": "",
      "nome_funcao": "000321 - AUXILIAR DE PRODUÇÃO"
    },
    {
      "id_api": "863",
      "codigo": "000470",
      "matricula": "000470",
      "nome": "ROMENGO PABLO PEREIRA GUIMARAES",
      "cpf": "3945460247",
      "status": "Demitido",
      "data_admissao": "05/07/2021",
      "data_admissao_iso": "2021-07-05T03:00:00Z",
      "data_demissao": "05/05/2025",
      "data_demissao_iso": "2025-05-05T03:00:00Z",
      "email": "",
      "nome_funcao": "000322 - OPERADOR DE MAQUINA DE CARTONAGEM"
    },
    {
      "id_api": "472",
      "codigo": "000472",
      "matricula": "000472",
      "nome": "MARIA DO CARMO VERCOSA DE SOUZA",
      "cpf": "20093730225",
      "status": "Demitido",
      "data_admissao": "06/07/2021",
      "data_admissao_iso": "2021-07-06T03:00:00Z",
      "data_demissao": "03/07/2024",
      "data_demissao_iso": "2024-07-03T03:00:00Z",
      "email": "",
      "nome_funcao": "000188 - COORDENADORA DE VENDAS"
    },
    {
      "id_api": "979",
      "codigo": "000474",
      "matricula": "000474",
      "nome": "MARIA DO CARMO DE SOUZA MACIEL MARTINS",
      "cpf": "79691404249",
      "status": "Demitido",
      "data_admissao": "09/07/2021",
      "data_admissao_iso": "2021-07-09T03:00:00Z",
      "data_demissao": "07/11/2025",
      "data_demissao_iso": "2025-11-07T03:00:00Z",
      "email": "",
      "nome_funcao": "000196 - AUX. DE COZINHA"
    },
    {
      "id_api": "973",
      "codigo": "000476",
      "matricula": "000476",
      "nome": "WALDENEY DA SILVA BRITO",
      "cpf": "149478208",
      "status": "Demitido",
      "data_admissao": "15/07/2021",
      "data_admissao_iso": "2021-07-15T03:00:00Z",
      "data_demissao": "30/10/2023",
      "data_demissao_iso": "2023-10-30T03:00:00Z",
      "email": "",
      "nome_funcao": "000104 - FATURISTA"
    },
    {
      "id_api": "114",
      "codigo": "000478",
      "matricula": "000478",
      "nome": "RAIMUNDO NONATO BARBOSA PAZ",
      "cpf": "600001202",
      "status": "Demitido",
      "data_admissao": "06/08/2021",
      "data_admissao_iso": "2021-08-06T03:00:00Z",
      "data_demissao": "09/05/2022",
      "data_demissao_iso": "2022-05-09T03:00:00Z",
      "email": "",
      "nome_funcao": "000023 - AUXILIAR DE PRODUÇAO"
    },
    {
      "id_api": "12",
      "codigo": "000479",
      "matricula": "000479",
      "nome": "ANTONIO ALVES DOS SANTOS FILHO",
      "cpf": "1830288210",
      "status": "Demitido",
      "data_admissao": "12/08/2021",
      "data_admissao_iso": "2021-08-12T03:00:00Z",
      "data_demissao": "28/09/2022",
      "data_demissao_iso": "2022-09-28T03:00:00Z",
      "email": "",
      "nome_funcao": "000303 - OPERADOR DE ETE"
    },
    {
      "id_api": "985",
      "codigo": "000482",
      "matricula": "000482",
      "nome": "NILTON BERNARDINO DA SILVA FILHO",
      "cpf": "51897180268",
      "status": "Demitido",
      "data_admissao": "22/09/2021",
      "data_admissao_iso": "2021-09-22T03:00:00Z",
      "data_demissao": "16/05/2022",
      "data_demissao_iso": "2022-05-16T03:00:00Z",
      "email": "",
      "nome_funcao": "000271 - AUXILIAR DE MANUTENÇÃO"
    },
    {
      "id_api": "987",
      "codigo": "000483",
      "matricula": "000483",
      "nome": "SIDOMAR CARDOSO DA SILVA",
      "cpf": "79579370206",
      "status": "Demitido",
      "data_admissao": "23/09/2021",
      "data_admissao_iso": "2021-09-23T03:00:00Z",
      "data_demissao": "04/09/2023",
      "data_demissao_iso": "2023-09-04T03:00:00Z",
      "email": "",
      "nome_funcao": "000307 - OPERADOR DE EMPILHADEIRA"
    },
    {
      "id_api": "124",
      "codigo": "000485",
      "matricula": "000485",
      "nome": "ANDREIA MODESTO CORDOVIL",
      "cpf": "96492953215",
      "status": "Demitido",
      "data_admissao": "06/10/2021",
      "data_admissao_iso": "2021-10-06T03:00:00Z",
      "data_demissao": "10/05/2022",
      "data_demissao_iso": "2022-05-10T03:00:00Z",
      "email": "",
      "nome_funcao": "000196 - AUX. DE COZINHA"
    },
    {
      "id_api": "477",
      "codigo": "000487",
      "matricula": "000487",
      "nome": "SAMUEL BATISTA DOS SANTOS",
      "cpf": "70230704271",
      "status": "Demitido",
      "data_admissao": "07/10/2021",
      "data_admissao_iso": "2021-10-07T03:00:00Z",
      "data_demissao": "01/06/2023",
      "data_demissao_iso": "2023-06-01T03:00:00Z",
      "email": "",
      "nome_funcao": "000320 - AJUSTADOR/ALIMENTADOR DE MAQ DE CARTONAGEM"
    },
    {
      "id_api": "957",
      "codigo": "000488",
      "matricula": "000488",
      "nome": "ERIVAN SALES DE OLIVEIRA",
      "cpf": "87213486268",
      "status": "Demitido",
      "data_admissao": "07/10/2021",
      "data_admissao_iso": "2021-10-07T03:00:00Z",
      "data_demissao": "18/10/2022",
      "data_demissao_iso": "2022-10-18T03:00:00Z",
      "email": "",
      "nome_funcao": "000023 - AUXILIAR DE PRODUÇAO"
    },
    {
      "id_api": "510",
      "codigo": "000490",
      "matricula": "000490",
      "nome": "VICTOR FERREIRA LIMA",
      "cpf": "70450764281",
      "status": "Demitido",
      "data_admissao": "11/10/2021",
      "data_admissao_iso": "2021-10-11T03:00:00Z",
      "data_demissao": "14/08/2023",
      "data_demissao_iso": "2023-08-14T03:00:00Z",
      "email": "",
      "nome_funcao": "000006 - APRENDIZ ASSIST ADM IND"
    },
    {
      "id_api": "478",
      "codigo": "000492",
      "matricula": "000492",
      "nome": "NERON DA FONSECA PINHEIRO",
      "cpf": "81898053200",
      "status": "Demitido",
      "data_admissao": "11/10/2021",
      "data_admissao_iso": "2021-10-11T03:00:00Z",
      "data_demissao": "13/06/2023",
      "data_demissao_iso": "2023-06-13T03:00:00Z",
      "email": "",
      "nome_funcao": "000272 - AUXILIAR DE LOGISTICA"
    },
    {
      "id_api": "30",
      "codigo": "000493",
      "matricula": "000493",
      "nome": "JESIMO DE SOUZA CASTRO E CASTRO",
      "cpf": "84497467287",
      "status": "Demitido",
      "data_admissao": "12/11/2021",
      "data_admissao_iso": "2021-11-12T03:00:00Z",
      "data_demissao": "23/03/2023",
      "data_demissao_iso": "2023-03-23T03:00:00Z",
      "email": "",
      "nome_funcao": "000064 - OPERADOR DE MAQUINA DE CARTONAGEM"
    },
    {
      "id_api": "27",
      "codigo": "000494",
      "matricula": "000494",
      "nome": "LAERCIO DA SILVA LIGATA",
      "cpf": "98912402234",
      "status": "Demitido",
      "data_admissao": "12/11/2021",
      "data_admissao_iso": "2021-11-12T03:00:00Z",
      "data_demissao": "10/01/2022",
      "data_demissao_iso": "2022-01-10T03:00:00Z",
      "email": "",
      "nome_funcao": "000298 - AUXILIAR DE SERVIÇOS GERAIS"
    },
    {
      "id_api": "49",
      "codigo": "000495",
      "matricula": "000495",
      "nome": "RODRIGO DE SOUZA ALENCAR",
      "cpf": "3117273280",
      "status": "Demitido",
      "data_admissao": "23/12/2021",
      "data_admissao_iso": "2021-12-23T03:00:00Z",
      "data_demissao": "24/04/2024",
      "data_demissao_iso": "2024-04-24T03:00:00Z",
      "email": "",
      "nome_funcao": "000013 - ASSISTENTE DE PCP"
    },
    {
      "id_api": "707",
      "codigo": "000496",
      "matricula": "000496",
      "nome": "NAIANE CRISTINA GONÇALVES COLARES",
      "cpf": "90425278204",
      "status": "Demitido",
      "data_admissao": "13/01/2022",
      "data_admissao_iso": "2022-01-13T03:00:00Z",
      "data_demissao": "30/10/2024",
      "data_demissao_iso": "2024-10-30T03:00:00Z",
      "email": "",
      "nome_funcao": "000324 - ANALISTA FISCAL PLENO"
    },
    {
      "id_api": "71",
      "codigo": "000499",
      "matricula": "000499",
      "nome": "FELIPE DA SILVA MANITO",
      "cpf": "3754551248",
      "status": "Demitido",
      "data_admissao": "25/03/2022",
      "data_admissao_iso": "2022-03-25T03:00:00Z",
      "data_demissao": "05/02/2024",
      "data_demissao_iso": "2024-02-05T03:00:00Z",
      "email": "",
      "nome_funcao": "000006 - APRENDIZ ASSIST ADM IND"
    },
    {
      "id_api": "70",
      "codigo": "000501",
      "matricula": "000501",
      "nome": "NORA NUNES GARCES",
      "cpf": "94001901234",
      "status": "Demitido",
      "data_admissao": "01/04/2022",
      "data_admissao_iso": "2022-04-01T03:00:00Z",
      "data_demissao": "30/06/2022",
      "data_demissao_iso": "2022-06-30T03:00:00Z",
      "email": "",
      "nome_funcao": "000032 - COZINHEIRA"
    },
    {
      "id_api": "68",
      "codigo": "000503",
      "matricula": "000503",
      "nome": "JOAO CARLOS SANTOS DA SILVA",
      "cpf": "88742350204",
      "status": "Demitido",
      "data_admissao": "04/04/2022",
      "data_admissao_iso": "2022-04-04T03:00:00Z",
      "data_demissao": "06/02/2023",
      "data_demissao_iso": "2023-02-06T03:00:00Z",
      "email": "",
      "nome_funcao": "000307 - OPERADOR DE EMPILHADEIRA"
    },
    {
      "id_api": "69",
      "codigo": "000504",
      "matricula": "000504",
      "nome": "ASSIS GOMES DA SILVA",
      "cpf": "70717427234",
      "status": "Demitido",
      "data_admissao": "04/04/2022",
      "data_admissao_iso": "2022-04-04T03:00:00Z",
      "data_demissao": "18/06/2025",
      "data_demissao_iso": "2025-06-18T03:00:00Z",
      "email": "Assis4555@gmail.com",
      "nome_funcao": "000307 - OPERADOR DE EMPILHADEIRA"
    },
    {
      "id_api": "493",
      "codigo": "000505",
      "matricula": "000505",
      "nome": "ANTONIO CARLOS OLIVEIRA VASCONCELOS",
      "cpf": "56471718268",
      "status": "Demitido",
      "data_admissao": "04/04/2022",
      "data_admissao_iso": "2022-04-04T03:00:00Z",
      "data_demissao": "25/03/2024",
      "data_demissao_iso": "2024-03-25T03:00:00Z",
      "email": "",
      "nome_funcao": "000049 - LIDER OPERADOR DE MAQ CARTONAGEM"
    },
    {
      "id_api": "66",
      "codigo": "000506",
      "matricula": "000506",
      "nome": "BENEDITO NEVES DOS SANTOS",
      "cpf": "6400765646",
      "status": "Demitido",
      "data_admissao": "22/04/2022",
      "data_admissao_iso": "2022-04-22T03:00:00Z",
      "data_demissao": "22/10/2024",
      "data_demissao_iso": "2024-10-22T03:00:00Z",
      "email": "",
      "nome_funcao": "000321 - AUXILIAR DE PRODUÇÃO"
    },
    {
      "id_api": "471",
      "codigo": "000508",
      "matricula": "000508",
      "nome": "PEDRO HENRIQUE MAQUINE",
      "cpf": "34744134220",
      "status": "Demitido",
      "data_admissao": "02/05/2022",
      "data_admissao_iso": "2022-05-02T03:00:00Z",
      "data_demissao": "14/03/2024",
      "data_demissao_iso": "2024-03-14T03:00:00Z",
      "email": "",
      "nome_funcao": "000321 - AUXILIAR DE PRODUÇÃO"
    },
    {
      "id_api": "1",
      "codigo": "000509",
      "matricula": "000509",
      "nome": "DANIEL DE OLIVEIRA",
      "cpf": "77879317287",
      "status": "Demitido",
      "data_admissao": "02/05/2022",
      "data_admissao_iso": "2022-05-02T03:00:00Z",
      "data_demissao": "23/09/2024",
      "data_demissao_iso": "2024-09-23T03:00:00Z",
      "email": "",
      "nome_funcao": "000322 - OPERADOR DE MAQUINA DE CARTONAGEM"
    },
    {
      "id_api": "96",
      "codigo": "000510",
      "matricula": "000510",
      "nome": "VICTOR HUGO RETROZ DO NASCIMENTO",
      "cpf": "88518574234",
      "status": "Demitido",
      "data_admissao": "02/05/2022",
      "data_admissao_iso": "2022-05-02T03:00:00Z",
      "data_demissao": "12/06/2023",
      "data_demissao_iso": "2023-06-12T03:00:00Z",
      "email": "",
      "nome_funcao": "000321 - AUXILIAR DE PRODUÇÃO"
    },
    {
      "id_api": "89",
      "codigo": "000511",
      "matricula": "000511",
      "nome": "ICARO LIMA RODRIGUES",
      "cpf": "2883499209",
      "status": "Demitido",
      "data_admissao": "10/05/2022",
      "data_admissao_iso": "2022-05-10T03:00:00Z",
      "data_demissao": "15/03/2023",
      "data_demissao_iso": "2023-03-15T03:00:00Z",
      "email": "",
      "nome_funcao": "000023 - AUXILIAR DE PRODUÇAO"
    },
    {
      "id_api": "82",
      "codigo": "000512",
      "matricula": "000512",
      "nome": "RODRIGO DA SILVA COSTA",
      "cpf": "1362067270",
      "status": "Demitido",
      "data_admissao": "09/05/2022",
      "data_admissao_iso": "2022-05-09T03:00:00Z",
      "data_demissao": "07/07/2022",
      "data_demissao_iso": "2022-07-07T03:00:00Z",
      "email": "",
      "nome_funcao": "000307 - OPERADOR DE EMPILHADEIRA"
    },
    {
      "id_api": "88",
      "codigo": "000513",
      "matricula": "000513",
      "nome": "RAYRINGO ROCHA LIMA",
      "cpf": "45638705287",
      "status": "Demitido",
      "data_admissao": "09/05/2022",
      "data_admissao_iso": "2022-05-09T03:00:00Z",
      "data_demissao": "24/02/2023",
      "data_demissao_iso": "2023-02-24T03:00:00Z",
      "email": "",
      "nome_funcao": "000023 - AUXILIAR DE PRODUÇAO"
    },
    {
      "id_api": "80",
      "codigo": "000515",
      "matricula": "000515",
      "nome": "ELIONEY BELEM RAMOS",
      "cpf": "2696872201",
      "status": "Demitido",
      "data_admissao": "09/05/2022",
      "data_admissao_iso": "2022-05-09T03:00:00Z",
      "data_demissao": "16/04/2025",
      "data_demissao_iso": "2025-04-16T03:00:00Z",
      "email": "",
      "nome_funcao": "000322 - OPERADOR DE MAQUINA DE CARTONAGEM"
    },
    {
      "id_api": "78",
      "codigo": "000516",
      "matricula": "000516",
      "nome": "CARLOS BRENO SERRAO CAMPOS",
      "cpf": "70605401217",
      "status": "Demitido",
      "data_admissao": "09/05/2022",
      "data_admissao_iso": "2022-05-09T03:00:00Z",
      "data_demissao": "07/06/2022",
      "data_demissao_iso": "2022-06-07T03:00:00Z",
      "email": "",
      "nome_funcao": "000023 - AUXILIAR DE PRODUÇAO"
    },
    {
      "id_api": "512",
      "codigo": "000520",
      "matricula": "000520",
      "nome": "ALESSANDRO DE BRITO MARQUES",
      "cpf": "76781330225",
      "status": "Demitido",
      "data_admissao": "16/05/2022",
      "data_admissao_iso": "2022-05-16T03:00:00Z",
      "data_demissao": "30/08/2023",
      "data_demissao_iso": "2023-08-30T03:00:00Z",
      "email": "",
      "nome_funcao": "000320 - AJUSTADOR/ALIMENTADOR DE MAQ DE CARTONAGEM"
    },
    {
      "id_api": "97",
      "codigo": "000522",
      "matricula": "000522",
      "nome": "LEANDRO JUNIO MENDES DOS SANTOS",
      "cpf": "887319289",
      "status": "Demitido",
      "data_admissao": "16/05/2022",
      "data_admissao_iso": "2022-05-16T03:00:00Z",
      "data_demissao": "16/08/2022",
      "data_demissao_iso": "2022-08-16T03:00:00Z",
      "email": "",
      "nome_funcao": "000023 - AUXILIAR DE PRODUÇAO"
    },
    {
      "id_api": "436",
      "codigo": "000523",
      "matricula": "000523",
      "nome": "MARIO BRUCE COELHO",
      "cpf": "44523149291",
      "status": "Demitido",
      "data_admissao": "16/05/2022",
      "data_admissao_iso": "2022-05-16T03:00:00Z",
      "data_demissao": "26/12/2022",
      "data_demissao_iso": "2022-12-26T03:00:00Z",
      "email": "",
      "nome_funcao": "000271 - AUXILIAR DE MANUTENÇÃO"
    },
    {
      "id_api": "891",
      "codigo": "000524",
      "matricula": "000524",
      "nome": "NILTON BERNARDINO DA SILVA NETO",
      "cpf": "3986231200",
      "status": "Demitido",
      "data_admissao": "23/05/2022",
      "data_admissao_iso": "2022-05-23T03:00:00Z",
      "data_demissao": "11/06/2025",
      "data_demissao_iso": "2025-06-11T03:00:00Z",
      "email": "niltonbernardino99@gmail.com",
      "nome_funcao": "000320 - AJUSTADOR/ALIMENTADOR DE MAQ DE CARTONAGEM"
    },
    {
      "id_api": "112",
      "codigo": "000525",
      "matricula": "000525",
      "nome": "MARIO JORGE COELHO DE SOUZA JUNIOR",
      "cpf": "77846338234",
      "status": "Demitido",
      "data_admissao": "23/05/2022",
      "data_admissao_iso": "2022-05-23T03:00:00Z",
      "data_demissao": "07/03/2023",
      "data_demissao_iso": "2023-03-07T03:00:00Z",
      "email": "",
      "nome_funcao": "000023 - AUXILIAR DE PRODUÇAO"
    },
    {
      "id_api": "118",
      "codigo": "000530",
      "matricula": "000530",
      "nome": "THAMIRES ANGELES DE SOUZA MIGUEL",
      "cpf": "4256737235",
      "status": "Demitido",
      "data_admissao": "06/06/2022",
      "data_admissao_iso": "2022-06-06T03:00:00Z",
      "data_demissao": "05/03/2024",
      "data_demissao_iso": "2024-03-05T03:00:00Z",
      "email": "",
      "nome_funcao": "000006 - APRENDIZ ASSIST ADM IND"
    },
    {
      "id_api": "686",
      "codigo": "000534",
      "matricula": "000534",
      "nome": "CARLEANDRO DOS REIS SENA",
      "cpf": "72291397249",
      "status": "Demitido",
      "data_admissao": "11/07/2022",
      "data_admissao_iso": "2022-07-11T03:00:00Z",
      "data_demissao": "06/07/2024",
      "data_demissao_iso": "2024-07-06T03:00:00Z",
      "email": "",
      "nome_funcao": "000037 - ENCARREGADO DE PRODUÇAO"
    },
    {
      "id_api": "87",
      "codigo": "000536",
      "matricula": "000536",
      "nome": "ROSE MARY NAZARE BRANDAO",
      "cpf": "40655733272",
      "status": "Demitido",
      "data_admissao": "20/07/2022",
      "data_admissao_iso": "2022-07-20T03:00:00Z",
      "data_demissao": "09/02/2023",
      "data_demissao_iso": "2023-02-09T03:00:00Z",
      "email": "",
      "nome_funcao": "000032 - COZINHEIRA"
    },
    {
      "id_api": "155",
      "codigo": "000537",
      "matricula": "000537",
      "nome": "DENIS FABIO MENDES EUFRAZIO",
      "cpf": "71753788234",
      "status": "Demitido",
      "data_admissao": "16/08/2022",
      "data_admissao_iso": "2022-08-16T03:00:00Z",
      "data_demissao": "13/01/2023",
      "data_demissao_iso": "2023-01-13T03:00:00Z",
      "email": "",
      "nome_funcao": "000023 - AUXILIAR DE PRODUÇAO"
    },
    {
      "id_api": "153",
      "codigo": "000538",
      "matricula": "000538",
      "nome": "RICARDO ANDERSON DA SILVA RODRIGUES",
      "cpf": "2633535240",
      "status": "Demitido",
      "data_admissao": "16/08/2022",
      "data_admissao_iso": "2022-08-16T03:00:00Z",
      "data_demissao": "14/10/2022",
      "data_demissao_iso": "2022-10-14T03:00:00Z",
      "email": "",
      "nome_funcao": "000023 - AUXILIAR DE PRODUÇAO"
    },
    {
      "id_api": "480",
      "codigo": "000539",
      "matricula": "000539",
      "nome": "DIEGO DE OLIVEIRA LOPES",
      "cpf": "70389172260",
      "status": "Demitido",
      "data_admissao": "16/08/2022",
      "data_admissao_iso": "2022-08-16T03:00:00Z",
      "data_demissao": "20/07/2023",
      "data_demissao_iso": "2023-07-20T03:00:00Z",
      "email": "",
      "nome_funcao": "000272 - AUXILIAR DE LOGISTICA"
    },
    {
      "id_api": "157",
      "codigo": "000540",
      "matricula": "000540",
      "nome": "JOSE FLAVIO SOUSA",
      "cpf": "2778000216",
      "status": "Demitido",
      "data_admissao": "16/08/2022",
      "data_admissao_iso": "2022-08-16T03:00:00Z",
      "data_demissao": "17/04/2023",
      "data_demissao_iso": "2023-04-17T03:00:00Z",
      "email": "",
      "nome_funcao": "000318 - SUPERVISOR DE LOGISTICA"
    },
    {
      "id_api": "156",
      "codigo": "000541",
      "matricula": "000541",
      "nome": "ELANE CRISTINA DA SILVA",
      "cpf": "51356341268",
      "status": "Demitido",
      "data_admissao": "16/08/2022",
      "data_admissao_iso": "2022-08-16T03:00:00Z",
      "data_demissao": "08/11/2022",
      "data_demissao_iso": "2022-11-08T03:00:00Z",
      "email": "",
      "nome_funcao": "000032 - COZINHEIRA"
    },
    {
      "id_api": "102",
      "codigo": "000542",
      "matricula": "000542",
      "nome": "JUCIMARA FERNANDES RICARDO",
      "cpf": "91375827200",
      "status": "Demitido",
      "data_admissao": "22/08/2022",
      "data_admissao_iso": "2022-08-22T03:00:00Z",
      "data_demissao": "29/03/2023",
      "data_demissao_iso": "2023-03-29T03:00:00Z",
      "email": "",
      "nome_funcao": "000196 - AUX. DE COZINHA"
    },
    {
      "id_api": "465",
      "codigo": "000543",
      "matricula": "000543",
      "nome": "ARI DA SILVA CORREA",
      "cpf": "23928034200",
      "status": "Demitido",
      "data_admissao": "24/08/2022",
      "data_admissao_iso": "2022-08-24T03:00:00Z",
      "data_demissao": "12/03/2025",
      "data_demissao_iso": "2025-03-12T03:00:00Z",
      "email": "",
      "nome_funcao": "000321 - AUXILIAR DE PRODUÇÃO"
    },
    {
      "id_api": "403",
      "codigo": "000544",
      "matricula": "000544",
      "nome": "ANDRIO FEITOSA QUEIROZ",
      "cpf": "2926068263",
      "status": "Demitido",
      "data_admissao": "24/08/2022",
      "data_admissao_iso": "2022-08-24T03:00:00Z",
      "data_demissao": "07/04/2023",
      "data_demissao_iso": "2023-04-07T03:00:00Z",
      "email": "",
      "nome_funcao": "000153 - AJUSTADOR/ALIMENTADOR DE MAQ CARTONAGEM"
    },
    {
      "id_api": "859",
      "codigo": "000545",
      "matricula": "000545",
      "nome": "GILSON DO CARMO SILVA SIQUEIRA",
      "cpf": "89086996272",
      "status": "Demitido",
      "data_admissao": "24/08/2022",
      "data_admissao_iso": "2022-08-24T03:00:00Z",
      "data_demissao": "29/04/2025",
      "data_demissao_iso": "2025-04-29T03:00:00Z",
      "email": "",
      "nome_funcao": "000078 - VIGIA"
    },
    {
      "id_api": "404",
      "codigo": "000546",
      "matricula": "000546",
      "nome": "BRAIAN PEREIRA LIMA",
      "cpf": "3557288269",
      "status": "Demitido",
      "data_admissao": "24/08/2022",
      "data_admissao_iso": "2022-08-24T03:00:00Z",
      "data_demissao": "22/10/2022",
      "data_demissao_iso": "2022-10-22T03:00:00Z",
      "email": "",
      "nome_funcao": "000023 - AUXILIAR DE PRODUÇAO"
    },
    {
      "id_api": "401",
      "codigo": "000547",
      "matricula": "000547",
      "nome": "JANDERSON MENEZES BATALHA",
      "cpf": "1534941231",
      "status": "Demitido",
      "data_admissao": "24/08/2022",
      "data_admissao_iso": "2022-08-24T03:00:00Z",
      "data_demissao": "08/08/2023",
      "data_demissao_iso": "2023-08-08T03:00:00Z",
      "email": "",
      "nome_funcao": "000321 - AUXILIAR DE PRODUÇÃO"
    },
    {
      "id_api": "406",
      "codigo": "000549",
      "matricula": "000549",
      "nome": "LEANDRO WILDSON LESKO TAVARES",
      "cpf": "88766691249",
      "status": "Demitido",
      "data_admissao": "25/08/2022",
      "data_admissao_iso": "2022-08-25T03:00:00Z",
      "data_demissao": "23/10/2022",
      "data_demissao_iso": "2022-10-23T03:00:00Z",
      "email": "",
      "nome_funcao": "000064 - OPERADOR DE MAQUINA DE CARTONAGEM"
    },
    {
      "id_api": "418",
      "codigo": "000550",
      "matricula": "000550",
      "nome": "GABRIEL DOS SANTOS REIS",
      "cpf": "4181681211",
      "status": "Demitido",
      "data_admissao": "26/08/2022",
      "data_admissao_iso": "2022-08-26T03:00:00Z",
      "data_demissao": "13/03/2023",
      "data_demissao_iso": "2023-03-13T03:00:00Z",
      "email": "",
      "nome_funcao": "000023 - AUXILIAR DE PRODUÇAO"
    },
    {
      "id_api": "622",
      "codigo": "000551",
      "matricula": "000551",
      "nome": "EDNEI PEREIRA MEDEIROS",
      "cpf": "1134282273",
      "status": "Demitido",
      "data_admissao": "26/08/2022",
      "data_admissao_iso": "2022-08-26T03:00:00Z",
      "data_demissao": "17/03/2025",
      "data_demissao_iso": "2025-03-17T03:00:00Z",
      "email": "",
      "nome_funcao": "000321 - AUXILIAR DE PRODUÇÃO"
    },
    {
      "id_api": "417",
      "codigo": "000552",
      "matricula": "000552",
      "nome": "JOAO FELIPE FURTADO NOROES",
      "cpf": "3682527281",
      "status": "Demitido",
      "data_admissao": "01/09/2022",
      "data_admissao_iso": "2022-09-01T03:00:00Z",
      "data_demissao": "25/10/2023",
      "data_demissao_iso": "2023-10-25T03:00:00Z",
      "email": "",
      "nome_funcao": "000315 - AUXILIAR DE ELETRICISTA"
    },
    {
      "id_api": "492",
      "codigo": "000554",
      "matricula": "000554",
      "nome": "JOSE RAUDNEY DE OLIVEIRA SOUZA",
      "cpf": "865809224",
      "status": "Demitido",
      "data_admissao": "09/09/2022",
      "data_admissao_iso": "2022-09-09T03:00:00Z",
      "data_demissao": "03/07/2023",
      "data_demissao_iso": "2023-07-03T03:00:00Z",
      "email": "",
      "nome_funcao": "000321 - AUXILIAR DE PRODUÇÃO"
    },
    {
      "id_api": "685",
      "codigo": "000555",
      "matricula": "000555",
      "nome": "LEONARDO SANTOS DE OLIVEIRA",
      "cpf": "2507182270",
      "status": "Demitido",
      "data_admissao": "09/09/2022",
      "data_admissao_iso": "2022-09-09T03:00:00Z",
      "data_demissao": "10/08/2024",
      "data_demissao_iso": "2024-08-10T03:00:00Z",
      "email": "",
      "nome_funcao": "000251 - ANALISTA DE QUALIDADE"
    },
    {
      "id_api": "423",
      "codigo": "000559",
      "matricula": "000559",
      "nome": "EIMAR MARTINS FONTES",
      "cpf": "81611510244",
      "status": "Demitido",
      "data_admissao": "25/10/2022",
      "data_admissao_iso": "2022-10-25T03:00:00Z",
      "data_demissao": "18/08/2025",
      "data_demissao_iso": "2025-08-18T03:00:00Z",
      "email": "eimarr9@gmail.com ",
      "nome_funcao": "000317 - SERRALHEIRO"
    },
    {
      "id_api": "871",
      "codigo": "000561",
      "matricula": "000561",
      "nome": "THIAGO DE AMARAL PAIVA",
      "cpf": "70478117299",
      "status": "Demitido",
      "data_admissao": "25/10/2022",
      "data_admissao_iso": "2022-10-25T03:00:00Z",
      "data_demissao": "04/12/2025",
      "data_demissao_iso": "2025-12-04T03:00:00Z",
      "email": "paivathiago792@gmail.com",
      "nome_funcao": "000104 - FATURISTA"
    },
    {
      "id_api": "429",
      "codigo": "000562",
      "matricula": "000562",
      "nome": "CHRYSTIAN WILLIAM DA SILVA MATOS",
      "cpf": "8089535240",
      "status": "Demitido",
      "data_admissao": "09/11/2022",
      "data_admissao_iso": "2022-11-09T03:00:00Z",
      "data_demissao": "01/02/2024",
      "data_demissao_iso": "2024-02-01T03:00:00Z",
      "email": "",
      "nome_funcao": "000272 - AUXILIAR DE LOGISTICA"
    },
    {
      "id_api": "446",
      "codigo": "000565",
      "matricula": "000565",
      "nome": "MARIA VIVIANE DE SOUZA MONTEIRO",
      "cpf": "81464428204",
      "status": "Demitido",
      "data_admissao": "13/01/2023",
      "data_admissao_iso": "2023-01-13T03:00:00Z",
      "data_demissao": "24/03/2025",
      "data_demissao_iso": "2025-03-24T03:00:00Z",
      "email": "",
      "nome_funcao": "000032 - COZINHEIRA"
    },
    {
      "id_api": "450",
      "codigo": "000569",
      "matricula": "000569",
      "nome": "MANOEL VIEIRA FARIAS MELLO",
      "cpf": "702531294",
      "status": "Demitido",
      "data_admissao": "19/01/2023",
      "data_admissao_iso": "2023-01-19T03:00:00Z",
      "data_demissao": "08/05/2023",
      "data_demissao_iso": "2023-05-08T03:00:00Z",
      "email": "",
      "nome_funcao": "000321 - AUXILIAR DE PRODUÇÃO"
    },
    {
      "id_api": "451",
      "codigo": "000570",
      "matricula": "000570",
      "nome": "JULIO BULHOES GUIMARAES",
      "cpf": "76694666268",
      "status": "Demitido",
      "data_admissao": "19/01/2023",
      "data_admissao_iso": "2023-01-19T03:00:00Z",
      "data_demissao": "29/07/2024",
      "data_demissao_iso": "2024-07-29T03:00:00Z",
      "email": "",
      "nome_funcao": "000047 - LIDER DE COLAGEM"
    },
    {
      "id_api": "523",
      "codigo": "000572",
      "matricula": "000572",
      "nome": "CLADEMIR DA SILVA VIDAL",
      "cpf": "74972871253",
      "status": "Demitido",
      "data_admissao": "20/01/2023",
      "data_admissao_iso": "2023-01-20T03:00:00Z",
      "data_demissao": "04/09/2023",
      "data_demissao_iso": "2023-09-04T03:00:00Z",
      "email": "",
      "nome_funcao": "000320 - AJUSTADOR/ALIMENTADOR DE MAQ DE CARTONAGEM"
    },
    {
      "id_api": "452",
      "codigo": "000573",
      "matricula": "000573",
      "nome": "ROGERIO FARIAS DUARTE",
      "cpf": "610095200",
      "status": "Demitido",
      "data_admissao": "20/01/2023",
      "data_admissao_iso": "2023-01-20T03:00:00Z",
      "data_demissao": "25/10/2023",
      "data_demissao_iso": "2023-10-25T03:00:00Z",
      "email": "",
      "nome_funcao": "000272 - AUXILIAR DE LOGISTICA"
    },
    {
      "id_api": "455",
      "codigo": "000574",
      "matricula": "000574",
      "nome": "ARLEY DOS SANTOS BAIMA",
      "cpf": "1029785228",
      "status": "Demitido",
      "data_admissao": "20/01/2023",
      "data_admissao_iso": "2023-01-20T03:00:00Z",
      "data_demissao": "19/09/2023",
      "data_demissao_iso": "2023-09-19T03:00:00Z",
      "email": "",
      "nome_funcao": "000321 - AUXILIAR DE PRODUÇÃO"
    },
    {
      "id_api": "474",
      "codigo": "000575",
      "matricula": "000575",
      "nome": "FRANCIELIO BARBOSA MOMOS",
      "cpf": "75361132268",
      "status": "Demitido",
      "data_admissao": "23/01/2023",
      "data_admissao_iso": "2023-01-23T03:00:00Z",
      "data_demissao": "04/09/2023",
      "data_demissao_iso": "2023-09-04T03:00:00Z",
      "email": "",
      "nome_funcao": "000321 - AUXILIAR DE PRODUÇÃO"
    },
    {
      "id_api": "467",
      "codigo": "000576",
      "matricula": "000576",
      "nome": "ANTONIO ALANILSON MENDES DA SILVA",
      "cpf": "1875931244",
      "status": "Demitido",
      "data_admissao": "23/01/2023",
      "data_admissao_iso": "2023-01-23T03:00:00Z",
      "data_demissao": "26/10/2023",
      "data_demissao_iso": "2023-10-26T03:00:00Z",
      "email": "",
      "nome_funcao": "000321 - AUXILIAR DE PRODUÇÃO"
    },
    {
      "id_api": "462",
      "codigo": "000577",
      "matricula": "000577",
      "nome": "FABRICIO FEITOZA DE SOUZA",
      "cpf": "926816209",
      "status": "Demitido",
      "data_admissao": "23/01/2023",
      "data_admissao_iso": "2023-01-23T03:00:00Z",
      "data_demissao": "08/05/2023",
      "data_demissao_iso": "2023-05-08T03:00:00Z",
      "email": "",
      "nome_funcao": "000321 - AUXILIAR DE PRODUÇÃO"
    },
    {
      "id_api": "32",
      "codigo": "000578",
      "matricula": "000578",
      "nome": "RUDI DA SILVA FARIAS",
      "cpf": "93593325268",
      "status": "Demitido",
      "data_admissao": "01/02/2023",
      "data_admissao_iso": "2023-02-01T03:00:00Z",
      "data_demissao": "30/10/2023",
      "data_demissao_iso": "2023-10-30T03:00:00Z",
      "email": "",
      "nome_funcao": "000321 - AUXILIAR DE PRODUÇÃO"
    },
    {
      "id_api": "99",
      "codigo": "000579",
      "matricula": "000579",
      "nome": "ROMULO SOUZA DE FARIA",
      "cpf": "2807919251",
      "status": "Demitido",
      "data_admissao": "01/02/2023",
      "data_admissao_iso": "2023-02-01T03:00:00Z",
      "data_demissao": "25/09/2024",
      "data_demissao_iso": "2024-09-25T03:00:00Z",
      "email": "",
      "nome_funcao": "000321 - AUXILIAR DE PRODUÇÃO"
    },
    {
      "id_api": "31",
      "codigo": "000580",
      "matricula": "000580",
      "nome": "ODAIR JOSE BATISTA DOS SANTOS",
      "cpf": "60104180200",
      "status": "Demitido",
      "data_admissao": "01/02/2023",
      "data_admissao_iso": "2023-02-01T03:00:00Z",
      "data_demissao": "06/02/2024",
      "data_demissao_iso": "2024-02-06T03:00:00Z",
      "email": "",
      "nome_funcao": "000321 - AUXILIAR DE PRODUÇÃO"
    },
    {
      "id_api": "81",
      "codigo": "000582",
      "matricula": "000582",
      "nome": "JONAS ROCHA DA SILVA",
      "cpf": "1192995260",
      "status": "Demitido",
      "data_admissao": "07/02/2023",
      "data_admissao_iso": "2023-02-07T03:00:00Z",
      "data_demissao": "06/09/2023",
      "data_demissao_iso": "2023-09-06T03:00:00Z",
      "email": "",
      "nome_funcao": "000321 - AUXILIAR DE PRODUÇÃO"
    },
    {
      "id_api": "77",
      "codigo": "000583",
      "matricula": "000583",
      "nome": "JOSE ORICELI DIAS DA SILVA",
      "cpf": "96041005215",
      "status": "Demitido",
      "data_admissao": "07/02/2023",
      "data_admissao_iso": "2023-02-07T03:00:00Z",
      "data_demissao": "07/04/2023",
      "data_demissao_iso": "2023-04-07T03:00:00Z",
      "email": "",
      "nome_funcao": "000298 - AUXILIAR DE SERVIÇOS GERAIS"
    },
    {
      "id_api": "61",
      "codigo": "000585",
      "matricula": "000585",
      "nome": "JHONATAS ALENCAR DE SOUZA",
      "cpf": "2096259290",
      "status": "Demitido",
      "data_admissao": "08/02/2023",
      "data_admissao_iso": "2023-02-08T03:00:00Z",
      "data_demissao": "26/11/2025",
      "data_demissao_iso": "2025-11-26T03:00:00Z",
      "email": "",
      "nome_funcao": "000320 - AJUSTADOR/ALIMENTADOR DE MAQ DE CARTONAGEM"
    },
    {
      "id_api": "98",
      "codigo": "000586",
      "matricula": "000586",
      "nome": "FABRICIO TAVERNARD DOS SANTOS",
      "cpf": "52607879272",
      "status": "Demitido",
      "data_admissao": "13/02/2023",
      "data_admissao_iso": "2023-02-13T03:00:00Z",
      "data_demissao": "14/02/2023",
      "data_demissao_iso": "2023-02-14T03:00:00Z",
      "email": "",
      "nome_funcao": "000023 - AUXILIAR DE PRODUÇAO"
    },
    {
      "id_api": "122",
      "codigo": "000588",
      "matricula": "000588",
      "nome": "LEANDRO CAFE LIMA",
      "cpf": "70456697209",
      "status": "Demitido",
      "data_admissao": "06/03/2023",
      "data_admissao_iso": "2023-03-06T03:00:00Z",
      "data_demissao": "30/09/2024",
      "data_demissao_iso": "2024-09-30T03:00:00Z",
      "email": "",
      "nome_funcao": "000319 - Aprendiz Assistente Adm em Vendas"
    },
    {
      "id_api": "431",
      "codigo": "000589",
      "matricula": "000589",
      "nome": "EDIMILSON AMARO FIGUEIREDO",
      "cpf": "5134764239",
      "status": "Demitido",
      "data_admissao": "06/03/2023",
      "data_admissao_iso": "2023-03-06T03:00:00Z",
      "data_demissao": "10/01/2025",
      "data_demissao_iso": "2025-01-10T03:00:00Z",
      "email": "",
      "nome_funcao": "000006 - APRENDIZ ASSIST ADM IND"
    },
    {
      "id_api": "428",
      "codigo": "000590",
      "matricula": "000590",
      "nome": "HANRY DE AMORIM REIS",
      "cpf": "7129438207",
      "status": "Demitido",
      "data_admissao": "06/03/2023",
      "data_admissao_iso": "2023-03-06T03:00:00Z",
      "data_demissao": "13/01/2025",
      "data_demissao_iso": "2025-01-13T03:00:00Z",
      "email": "",
      "nome_funcao": "000006 - APRENDIZ ASSIST ADM IND"
    },
    {
      "id_api": "105",
      "codigo": "000591",
      "matricula": "000591",
      "nome": "GLADIA CARDENES BARGUES",
      "cpf": "56603665204",
      "status": "Demitido",
      "data_admissao": "15/03/2023",
      "data_admissao_iso": "2023-03-15T03:00:00Z",
      "data_demissao": "23/10/2024",
      "data_demissao_iso": "2024-10-23T03:00:00Z",
      "email": "",
      "nome_funcao": "000196 - AUX. DE COZINHA"
    },
    {
      "id_api": "121",
      "codigo": "000593",
      "matricula": "000593",
      "nome": "JEAN SIQUEIRA DOS SANTOS",
      "cpf": "3338887230",
      "status": "Demitido",
      "data_admissao": "12/04/2023",
      "data_admissao_iso": "2023-04-12T03:00:00Z",
      "data_demissao": "09/09/2024",
      "data_demissao_iso": "2024-09-09T03:00:00Z",
      "email": "",
      "nome_funcao": "000321 - AUXILIAR DE PRODUÇÃO"
    },
    {
      "id_api": "143",
      "codigo": "000596",
      "matricula": "000596",
      "nome": "DARLISON DOS SANTOS AZEVEDO",
      "cpf": "88707741200",
      "status": "Demitido",
      "data_admissao": "12/04/2023",
      "data_admissao_iso": "2023-04-12T03:00:00Z",
      "data_demissao": "03/01/2024",
      "data_demissao_iso": "2024-01-03T03:00:00Z",
      "email": "",
      "nome_funcao": "000321 - AUXILIAR DE PRODUÇÃO"
    },
    {
      "id_api": "127",
      "codigo": "000597",
      "matricula": "000597",
      "nome": "MATEUS DOS SANTOS FALCAO",
      "cpf": "3713941203",
      "status": "Demitido",
      "data_admissao": "12/04/2023",
      "data_admissao_iso": "2023-04-12T03:00:00Z",
      "data_demissao": "13/05/2024",
      "data_demissao_iso": "2024-05-13T03:00:00Z",
      "email": "",
      "nome_funcao": "000272 - AUXILIAR DE LOGISTICA"
    },
    {
      "id_api": "128",
      "codigo": "000598",
      "matricula": "000598",
      "nome": "ESTENIO SOARES SAMPAIO",
      "cpf": "2808253230",
      "status": "Demitido",
      "data_admissao": "12/04/2023",
      "data_admissao_iso": "2023-04-12T03:00:00Z",
      "data_demissao": "26/10/2023",
      "data_demissao_iso": "2023-10-26T03:00:00Z",
      "email": "",
      "nome_funcao": "000321 - AUXILIAR DE PRODUÇÃO"
    },
    {
      "id_api": "129",
      "codigo": "000599",
      "matricula": "000599",
      "nome": "JAIRO CELESTINO MAQUINE",
      "cpf": "85419729253",
      "status": "Demitido",
      "data_admissao": "13/04/2023",
      "data_admissao_iso": "2023-04-13T03:00:00Z",
      "data_demissao": "08/05/2023",
      "data_demissao_iso": "2023-05-08T03:00:00Z",
      "email": "",
      "nome_funcao": "000321 - AUXILIAR DE PRODUÇÃO"
    },
    {
      "id_api": "43",
      "codigo": "000600",
      "matricula": "000600",
      "nome": "LUIS FERNANDO MOREIRA DO NASCIMENTO",
      "cpf": "89954130268",
      "status": "Demitido",
      "data_admissao": "13/04/2023",
      "data_admissao_iso": "2023-04-13T03:00:00Z",
      "data_demissao": "12/05/2023",
      "data_demissao_iso": "2023-05-12T03:00:00Z",
      "email": "",
      "nome_funcao": "000321 - AUXILIAR DE PRODUÇÃO"
    },
    {
      "id_api": "144",
      "codigo": "000601",
      "matricula": "000601",
      "nome": "RAIMUNDO NONATO BRITO CORDEIRO",
      "cpf": "59851660230",
      "status": "Demitido",
      "data_admissao": "25/04/2023",
      "data_admissao_iso": "2023-04-25T03:00:00Z",
      "data_demissao": "16/01/2026",
      "data_demissao_iso": "2026-01-16T03:00:00Z",
      "email": "",
      "nome_funcao": "000299 - SUPERVISOR DE ALMOXARIFADO"
    },
    {
      "id_api": "525",
      "codigo": "000602",
      "matricula": "000602",
      "nome": "RODRIGO MONTEIRO DA CRUZ",
      "cpf": "47343273",
      "status": "Demitido",
      "data_admissao": "25/04/2023",
      "data_admissao_iso": "2023-04-25T03:00:00Z",
      "data_demissao": "05/04/2024",
      "data_demissao_iso": "2024-04-05T03:00:00Z",
      "email": "",
      "nome_funcao": "000272 - AUXILIAR DE LOGISTICA"
    },
    {
      "id_api": "159",
      "codigo": "000603",
      "matricula": "000603",
      "nome": "MARIA KELLY RAMOS DE ALMEIDA",
      "cpf": "3264175240",
      "status": "Demitido",
      "data_admissao": "26/04/2023",
      "data_admissao_iso": "2023-04-26T03:00:00Z",
      "data_demissao": "01/02/2024",
      "data_demissao_iso": "2024-02-01T03:00:00Z",
      "email": "",
      "nome_funcao": "000318 - SUPERVISOR DE LOGISTICA"
    },
    {
      "id_api": "427",
      "codigo": "000605",
      "matricula": "000605",
      "nome": "GUSTAVO BRITO BARBOSA",
      "cpf": "2752136250",
      "status": "Demitido",
      "data_admissao": "03/05/2023",
      "data_admissao_iso": "2023-05-03T03:00:00Z",
      "data_demissao": "30/10/2023",
      "data_demissao_iso": "2023-10-30T03:00:00Z",
      "email": "",
      "nome_funcao": "000321 - AUXILIAR DE PRODUÇÃO"
    },
    {
      "id_api": "408",
      "codigo": "000606",
      "matricula": "000606",
      "nome": "CESAR AUGUSTO PAES FERREIRA",
      "cpf": "2890804283",
      "status": "Demitido",
      "data_admissao": "03/05/2023",
      "data_admissao_iso": "2023-05-03T03:00:00Z",
      "data_demissao": "13/06/2023",
      "data_demissao_iso": "2023-06-13T03:00:00Z",
      "email": "",
      "nome_funcao": "000321 - AUXILIAR DE PRODUÇÃO"
    },
    {
      "id_api": "412",
      "codigo": "000607",
      "matricula": "000607",
      "nome": "VICTOR FELIPE  DIAS BARRETO",
      "cpf": "70536438242",
      "status": "Demitido",
      "data_admissao": "03/05/2023",
      "data_admissao_iso": "2023-05-03T03:00:00Z",
      "data_demissao": "11/09/2024",
      "data_demissao_iso": "2024-09-11T03:00:00Z",
      "email": "",
      "nome_funcao": "000321 - AUXILIAR DE PRODUÇÃO"
    },
    {
      "id_api": "432",
      "codigo": "000609",
      "matricula": "000609",
      "nome": "CINTYA MARIA ROCHA COSTA",
      "cpf": "98303422200",
      "status": "Demitido",
      "data_admissao": "09/05/2023",
      "data_admissao_iso": "2023-05-09T03:00:00Z",
      "data_demissao": "25/09/2023",
      "data_demissao_iso": "2023-09-25T03:00:00Z",
      "email": "",
      "nome_funcao": "000032 - COZINHEIRA"
    },
    {
      "id_api": "470",
      "codigo": "000610",
      "matricula": "000610",
      "nome": "EWERTON GABRIEL DA SILVA BITENCOURT",
      "cpf": "3212226285",
      "status": "Demitido",
      "data_admissao": "10/05/2023",
      "data_admissao_iso": "2023-05-10T03:00:00Z",
      "data_demissao": "26/09/2024",
      "data_demissao_iso": "2024-09-26T03:00:00Z",
      "email": "",
      "nome_funcao": "000321 - AUXILIAR DE PRODUÇÃO"
    },
    {
      "id_api": "544",
      "codigo": "000611",
      "matricula": "000611",
      "nome": "FRANCISCA JOSE PINHEIRO DOS SANTOS",
      "cpf": "41714482200",
      "status": "Demitido",
      "data_admissao": "12/05/2023",
      "data_admissao_iso": "2023-05-12T03:00:00Z",
      "data_demissao": "09/10/2023",
      "data_demissao_iso": "2023-10-09T03:00:00Z",
      "email": "",
      "nome_funcao": "000032 - COZINHEIRA"
    },
    {
      "id_api": "65",
      "codigo": "000612",
      "matricula": "000612",
      "nome": "ANTONIO VICTOR LIMA DE ABREU",
      "cpf": "8501996203",
      "status": "Demitido",
      "data_admissao": "12/05/2023",
      "data_admissao_iso": "2023-05-12T03:00:00Z",
      "data_demissao": "10/06/2023",
      "data_demissao_iso": "2023-06-10T03:00:00Z",
      "email": "",
      "nome_funcao": "000321 - AUXILIAR DE PRODUÇÃO"
    },
    {
      "id_api": "411",
      "codigo": "000615",
      "matricula": "000615",
      "nome": "BRUNO CARDOSO COUTINHO",
      "cpf": "94311323204",
      "status": "Demitido",
      "data_admissao": "16/05/2023",
      "data_admissao_iso": "2023-05-16T03:00:00Z",
      "data_demissao": "05/01/2026",
      "data_demissao_iso": "2026-01-05T03:00:00Z",
      "email": "",
      "nome_funcao": "000321 - AUXILIAR DE PRODUÇÃO"
    },
    {
      "id_api": "145",
      "codigo": "000616",
      "matricula": "000616",
      "nome": "HELBERTH DOS SANTOS BARBOSA",
      "cpf": "2725818281",
      "status": "Demitido",
      "data_admissao": "17/05/2023",
      "data_admissao_iso": "2023-05-17T03:00:00Z",
      "data_demissao": "22/06/2023",
      "data_demissao_iso": "2023-06-22T03:00:00Z",
      "email": "",
      "nome_funcao": "000272 - AUXILIAR DE LOGISTICA"
    },
    {
      "id_api": "150",
      "codigo": "000617",
      "matricula": "000617",
      "nome": "RAFAEL MOREIRA MORAES",
      "cpf": "8308830293",
      "status": "Demitido",
      "data_admissao": "17/05/2023",
      "data_admissao_iso": "2023-05-17T03:00:00Z",
      "data_demissao": "24/01/2024",
      "data_demissao_iso": "2024-01-24T03:00:00Z",
      "email": "",
      "nome_funcao": "000321 - AUXILIAR DE PRODUÇÃO"
    },
    {
      "id_api": "397",
      "codigo": "000619",
      "matricula": "000619",
      "nome": "ALEXSANDRO MONTEIRO DE QUEIROZ",
      "cpf": "50968670210",
      "status": "Demitido",
      "data_admissao": "17/05/2023",
      "data_admissao_iso": "2023-05-17T03:00:00Z",
      "data_demissao": "15/06/2023",
      "data_demissao_iso": "2023-06-15T03:00:00Z",
      "email": "",
      "nome_funcao": "000321 - AUXILIAR DE PRODUÇÃO"
    },
    {
      "id_api": "115",
      "codigo": "000620",
      "matricula": "000620",
      "nome": "GIOVANE DA SILVA SANTOS",
      "cpf": "89222261291",
      "status": "Demitido",
      "data_admissao": "17/05/2023",
      "data_admissao_iso": "2023-05-17T03:00:00Z",
      "data_demissao": "22/05/2023",
      "data_demissao_iso": "2023-05-22T03:00:00Z",
      "email": "",
      "nome_funcao": "000321 - AUXILIAR DE PRODUÇÃO"
    },
    {
      "id_api": "526",
      "codigo": "000623",
      "matricula": "000623",
      "nome": "FRANCISCO ILDERLAN CORREA BATISTA",
      "cpf": "64914810263",
      "status": "Demitido",
      "data_admissao": "17/05/2023",
      "data_admissao_iso": "2023-05-17T03:00:00Z",
      "data_demissao": "10/04/2024",
      "data_demissao_iso": "2024-04-10T03:00:00Z",
      "email": "",
      "nome_funcao": "000321 - AUXILIAR DE PRODUÇÃO"
    },
    {
      "id_api": "443",
      "codigo": "000624",
      "matricula": "000624",
      "nome": "DAVID VICTOR RODRIGUES ALMEIDA",
      "cpf": "6153436277",
      "status": "Demitido",
      "data_admissao": "18/05/2023",
      "data_admissao_iso": "2023-05-18T03:00:00Z",
      "data_demissao": "03/05/2024",
      "data_demissao_iso": "2024-05-03T03:00:00Z",
      "email": "",
      "nome_funcao": "000321 - AUXILIAR DE PRODUÇÃO"
    },
    {
      "id_api": "439",
      "codigo": "000626",
      "matricula": "000626",
      "nome": "JACO FIRMINO VASQUES",
      "cpf": "98523015272",
      "status": "Demitido",
      "data_admissao": "19/05/2023",
      "data_admissao_iso": "2023-05-19T03:00:00Z",
      "data_demissao": "18/09/2025",
      "data_demissao_iso": "2025-09-18T03:00:00Z",
      "email": "jacofirmino44@gmail.com",
      "nome_funcao": "000321 - AUXILIAR DE PRODUÇÃO"
    },
    {
      "id_api": "441",
      "codigo": "000627",
      "matricula": "000627",
      "nome": "EMERSON BARBOSA RODRIGUES",
      "cpf": "320208214",
      "status": "Demitido",
      "data_admissao": "19/05/2023",
      "data_admissao_iso": "2023-05-19T03:00:00Z",
      "data_demissao": "08/08/2024",
      "data_demissao_iso": "2024-08-08T03:00:00Z",
      "email": "",
      "nome_funcao": "000330 - ENCARREGADO DE LOGISTICA"
    },
    {
      "id_api": "453",
      "codigo": "000629",
      "matricula": "000629",
      "nome": "JEVERSON FARIAS FERREIRA",
      "cpf": "70142143227",
      "status": "Demitido",
      "data_admissao": "19/05/2023",
      "data_admissao_iso": "2023-05-19T03:00:00Z",
      "data_demissao": "26/10/2023",
      "data_demissao_iso": "2023-10-26T03:00:00Z",
      "email": "",
      "nome_funcao": "000321 - AUXILIAR DE PRODUÇÃO"
    },
    {
      "id_api": "747",
      "codigo": "000630",
      "matricula": "000630",
      "nome": "LUIZ PHELIPE MARAJO DA SILVA",
      "cpf": "3500163211",
      "status": "Demitido",
      "data_admissao": "23/05/2023",
      "data_admissao_iso": "2023-05-23T03:00:00Z",
      "data_demissao": "22/07/2025",
      "data_demissao_iso": "2025-07-22T03:00:00Z",
      "email": "phelipe123luiz@gmail.com",
      "nome_funcao": "000320 - AJUSTADOR/ALIMENTADOR DE MAQ DE CARTONAGEM"
    },
    {
      "id_api": "466",
      "codigo": "000631",
      "matricula": "000631",
      "nome": "MICAEL NASCIMENTO ROCHA",
      "cpf": "6235939205",
      "status": "Demitido",
      "data_admissao": "24/05/2023",
      "data_admissao_iso": "2023-05-24T03:00:00Z",
      "data_demissao": "28/05/2024",
      "data_demissao_iso": "2024-05-28T03:00:00Z",
      "email": "",
      "nome_funcao": "000321 - AUXILIAR DE PRODUÇÃO"
    },
    {
      "id_api": "469",
      "codigo": "000632",
      "matricula": "000632",
      "nome": "SAULO DO NASCIMENTO REGO",
      "cpf": "770490204",
      "status": "Demitido",
      "data_admissao": "24/05/2023",
      "data_admissao_iso": "2023-05-24T03:00:00Z",
      "data_demissao": "09/10/2023",
      "data_demissao_iso": "2023-10-09T03:00:00Z",
      "email": "",
      "nome_funcao": "000321 - AUXILIAR DE PRODUÇÃO"
    },
    {
      "id_api": "483",
      "codigo": "000633",
      "matricula": "000633",
      "nome": "MANOEL COSMO SANTOS FERREIRA",
      "cpf": "53418603220",
      "status": "Demitido",
      "data_admissao": "01/06/2023",
      "data_admissao_iso": "2023-06-01T03:00:00Z",
      "data_demissao": "03/01/2024",
      "data_demissao_iso": "2024-01-03T03:00:00Z",
      "email": "",
      "nome_funcao": "000272 - AUXILIAR DE LOGISTICA"
    },
    {
      "id_api": "496",
      "codigo": "000635",
      "matricula": "000635",
      "nome": "CARLOS ALBERTO CAMPOS DE BRITO JUNIOR",
      "cpf": "3068866260",
      "status": "Demitido",
      "data_admissao": "03/07/2023",
      "data_admissao_iso": "2023-07-03T03:00:00Z",
      "data_demissao": "07/08/2023",
      "data_demissao_iso": "2023-08-07T03:00:00Z",
      "email": "",
      "nome_funcao": "000321 - AUXILIAR DE PRODUÇÃO"
    },
    {
      "id_api": "482",
      "codigo": "000636",
      "matricula": "000636",
      "nome": "ADRIANO MARQUES DA SILVA",
      "cpf": "4174018251",
      "status": "Demitido",
      "data_admissao": "03/07/2023",
      "data_admissao_iso": "2023-07-03T03:00:00Z",
      "data_demissao": "14/09/2023",
      "data_demissao_iso": "2023-09-14T03:00:00Z",
      "email": "",
      "nome_funcao": "000321 - AUXILIAR DE PRODUÇÃO"
    },
    {
      "id_api": "479",
      "codigo": "000637",
      "matricula": "000637",
      "nome": "GENIVALDO DOS SANTOS MATOS",
      "cpf": "61808431200",
      "status": "Demitido",
      "data_admissao": "03/07/2023",
      "data_admissao_iso": "2023-07-03T03:00:00Z",
      "data_demissao": "08/08/2024",
      "data_demissao_iso": "2024-08-08T03:00:00Z",
      "email": "",
      "nome_funcao": "000321 - AUXILIAR DE PRODUÇÃO"
    },
    {
      "id_api": "487",
      "codigo": "000639",
      "matricula": "000639",
      "nome": "JOSIEL DE OLIVEIRA CARVALHO",
      "cpf": "70233288236",
      "status": "Demitido",
      "data_admissao": "03/07/2023",
      "data_admissao_iso": "2023-07-03T03:00:00Z",
      "data_demissao": "09/05/2024",
      "data_demissao_iso": "2024-05-09T03:00:00Z",
      "email": "",
      "nome_funcao": "000321 - AUXILIAR DE PRODUÇÃO"
    },
    {
      "id_api": "890",
      "codigo": "000641",
      "matricula": "000641",
      "nome": "LUCAS GUIMARAES PIRES",
      "cpf": "5159061231",
      "status": "Demitido",
      "data_admissao": "18/07/2023",
      "data_admissao_iso": "2023-07-18T03:00:00Z",
      "data_demissao": "04/06/2025",
      "data_demissao_iso": "2025-06-04T03:00:00Z",
      "email": "",
      "nome_funcao": "000307 - OPERADOR DE EMPILHADEIRA"
    },
    {
      "id_api": "497",
      "codigo": "000643",
      "matricula": "000643",
      "nome": "ANDERSON RICARDO CAMPOS DE CARVALHO",
      "cpf": "60620110287",
      "status": "Demitido",
      "data_admissao": "18/07/2023",
      "data_admissao_iso": "2023-07-18T03:00:00Z",
      "data_demissao": "13/11/2023",
      "data_demissao_iso": "2023-11-13T03:00:00Z",
      "email": "",
      "nome_funcao": "000321 - AUXILIAR DE PRODUÇÃO"
    },
    {
      "id_api": "495",
      "codigo": "000644",
      "matricula": "000644",
      "nome": "MARIO AUGUSTO DO NASCIMENTO NETO",
      "cpf": "2590320264",
      "status": "Demitido",
      "data_admissao": "02/08/2023",
      "data_admissao_iso": "2023-08-02T03:00:00Z",
      "data_demissao": "21/12/2023",
      "data_demissao_iso": "2023-12-21T03:00:00Z",
      "email": "",
      "nome_funcao": "000272 - AUXILIAR DE LOGISTICA"
    },
    {
      "id_api": "509",
      "codigo": "000645",
      "matricula": "000645",
      "nome": "JOAO DA SILVA ARAUJO",
      "cpf": "60012021253",
      "status": "Demitido",
      "data_admissao": "15/08/2023",
      "data_admissao_iso": "2023-08-15T03:00:00Z",
      "data_demissao": "01/09/2023",
      "data_demissao_iso": "2023-09-01T03:00:00Z",
      "email": "",
      "nome_funcao": "000321 - AUXILIAR DE PRODUÇÃO"
    },
    {
      "id_api": "513",
      "codigo": "000646",
      "matricula": "000646",
      "nome": "ROBERVAL DA SILVA SOUSA",
      "cpf": "68444095320",
      "status": "Demitido",
      "data_admissao": "15/08/2023",
      "data_admissao_iso": "2023-08-15T03:00:00Z",
      "data_demissao": "17/07/2024",
      "data_demissao_iso": "2024-07-17T03:00:00Z",
      "email": "",
      "nome_funcao": "000322 - OPERADOR DE MAQUINA DE CARTONAGEM"
    },
    {
      "id_api": "726",
      "codigo": "000648",
      "matricula": "000648",
      "nome": "VICTOR FERREIRA LIMA",
      "cpf": "70450764281",
      "status": "Demitido",
      "data_admissao": "17/08/2023",
      "data_admissao_iso": "2023-08-17T03:00:00Z",
      "data_demissao": "19/03/2025",
      "data_demissao_iso": "2025-03-19T03:00:00Z",
      "email": "",
      "nome_funcao": "000344 - ASSISTENTE FINANCEIRO"
    },
    {
      "id_api": "511",
      "codigo": "000649",
      "matricula": "000649",
      "nome": "IVANILDO DE SOUZA DOS SANTOS",
      "cpf": "62999290225",
      "status": "Demitido",
      "data_admissao": "23/08/2023",
      "data_admissao_iso": "2023-08-23T03:00:00Z",
      "data_demissao": "21/10/2023",
      "data_demissao_iso": "2023-10-21T03:00:00Z",
      "email": "",
      "nome_funcao": "000322 - OPERADOR DE MAQUINA DE CARTONAGEM"
    },
    {
      "id_api": "524",
      "codigo": "000650",
      "matricula": "000650",
      "nome": "EMERSON PEDROSA DA SILVA",
      "cpf": "72480130215",
      "status": "Demitido",
      "data_admissao": "23/08/2023",
      "data_admissao_iso": "2023-08-23T03:00:00Z",
      "data_demissao": "13/09/2023",
      "data_demissao_iso": "2023-09-13T03:00:00Z",
      "email": "",
      "nome_funcao": "000272 - AUXILIAR DE LOGISTICA"
    },
    {
      "id_api": "528",
      "codigo": "000652",
      "matricula": "000652",
      "nome": "FAUSTO DA SILVA GOMES",
      "cpf": "90819853291",
      "status": "Demitido",
      "data_admissao": "19/09/2023",
      "data_admissao_iso": "2023-09-19T03:00:00Z",
      "data_demissao": "17/11/2023",
      "data_demissao_iso": "2023-11-17T03:00:00Z",
      "email": "",
      "nome_funcao": "000272 - AUXILIAR DE LOGISTICA"
    },
    {
      "id_api": "542",
      "codigo": "000653",
      "matricula": "000653",
      "nome": "ALESSANDRO TAVARES LIMA",
      "cpf": "84415762204",
      "status": "Demitido",
      "data_admissao": "19/09/2023",
      "data_admissao_iso": "2023-09-19T03:00:00Z",
      "data_demissao": "29/09/2023",
      "data_demissao_iso": "2023-09-29T03:00:00Z",
      "email": "",
      "nome_funcao": "000321 - AUXILIAR DE PRODUÇÃO"
    },
    {
      "id_api": "527",
      "codigo": "000654",
      "matricula": "000654",
      "nome": "EDUARDO GOMES DE ALMEIDA",
      "cpf": "4692251220",
      "status": "Demitido",
      "data_admissao": "19/09/2023",
      "data_admissao_iso": "2023-09-19T03:00:00Z",
      "data_demissao": "10/09/2024",
      "data_demissao_iso": "2024-09-10T03:00:00Z",
      "email": "",
      "nome_funcao": "000321 - AUXILIAR DE PRODUÇÃO"
    },
    {
      "id_api": "575",
      "codigo": "000655",
      "matricula": "000655",
      "nome": "LUIZ CAIO MESQUITA DA SILVA",
      "cpf": "2704353280",
      "status": "Demitido",
      "data_admissao": "19/09/2023",
      "data_admissao_iso": "2023-09-19T03:00:00Z",
      "data_demissao": "13/11/2023",
      "data_demissao_iso": "2023-11-13T03:00:00Z",
      "email": "",
      "nome_funcao": "000272 - AUXILIAR DE LOGISTICA"
    },
    {
      "id_api": "543",
      "codigo": "000656",
      "matricula": "000656",
      "nome": "PAULO CESAR BARROSO DOS SANTOS",
      "cpf": "8077012205",
      "status": "Demitido",
      "data_admissao": "19/09/2023",
      "data_admissao_iso": "2023-09-19T03:00:00Z",
      "data_demissao": "02/10/2023",
      "data_demissao_iso": "2023-10-02T03:00:00Z",
      "email": "",
      "nome_funcao": "000321 - AUXILIAR DE PRODUÇÃO"
    },
    {
      "id_api": "595",
      "codigo": "000657",
      "matricula": "000657",
      "nome": "GUILHERME BATISTA DOS SANTOS",
      "cpf": "70521483239",
      "status": "Demitido",
      "data_admissao": "26/09/2023",
      "data_admissao_iso": "2023-09-26T03:00:00Z",
      "data_demissao": "14/10/2024",
      "data_demissao_iso": "2024-10-14T03:00:00Z",
      "email": "",
      "nome_funcao": "000321 - AUXILIAR DE PRODUÇÃO"
    },
    {
      "id_api": "534",
      "codigo": "000658",
      "matricula": "000658",
      "nome": "JORGE AFONSO MONTANA DE MACEDO VERAS",
      "cpf": "569236274",
      "status": "Demitido",
      "data_admissao": "26/09/2023",
      "data_admissao_iso": "2023-09-26T03:00:00Z",
      "data_demissao": "13/11/2023",
      "data_demissao_iso": "2023-11-13T03:00:00Z",
      "email": "",
      "nome_funcao": "000312 - ELETRICISTA JR."
    },
    {
      "id_api": "640",
      "codigo": "000659",
      "matricula": "000659",
      "nome": "JOAO PAULO NEVES DOS SANTOS",
      "cpf": "162223269",
      "status": "Demitido",
      "data_admissao": "02/10/2023",
      "data_admissao_iso": "2023-10-02T03:00:00Z",
      "data_demissao": "18/09/2024",
      "data_demissao_iso": "2024-09-18T03:00:00Z",
      "email": "",
      "nome_funcao": "000272 - AUXILIAR DE LOGISTICA"
    },
    {
      "id_api": "536",
      "codigo": "000660",
      "matricula": "000660",
      "nome": "GLEIDSON ALVES DA COSTA",
      "cpf": "147722217",
      "status": "Demitido",
      "data_admissao": "03/10/2023",
      "data_admissao_iso": "2023-10-03T03:00:00Z",
      "data_demissao": "11/12/2023",
      "data_demissao_iso": "2023-12-11T03:00:00Z",
      "email": "",
      "nome_funcao": "000322 - OPERADOR DE MAQUINA DE CARTONAGEM"
    },
    {
      "id_api": "533",
      "codigo": "000661",
      "matricula": "000661",
      "nome": "KADSON GARCIA FELICIO",
      "cpf": "74854658215",
      "status": "Demitido",
      "data_admissao": "03/10/2023",
      "data_admissao_iso": "2023-10-03T03:00:00Z",
      "data_demissao": "28/11/2023",
      "data_demissao_iso": "2023-11-28T03:00:00Z",
      "email": "",
      "nome_funcao": "000315 - AUXILIAR DE ELETRICISTA"
    },
    {
      "id_api": "498",
      "codigo": "000662",
      "matricula": "000662",
      "nome": "MARCELO FERNANDES SENA",
      "cpf": "57890595204",
      "status": "Demitido",
      "data_admissao": "03/10/2023",
      "data_admissao_iso": "2023-10-03T03:00:00Z",
      "data_demissao": "21/03/2024",
      "data_demissao_iso": "2024-03-21T03:00:00Z",
      "email": "",
      "nome_funcao": "000315 - AUXILIAR DE ELETRICISTA"
    },
    {
      "id_api": "560",
      "codigo": "000663",
      "matricula": "000663",
      "nome": "NATANAEL RICARDO DE SOUZA FILHO",
      "cpf": "9200926240",
      "status": "Demitido",
      "data_admissao": "11/10/2023",
      "data_admissao_iso": "2023-10-11T03:00:00Z",
      "data_demissao": "19/02/2024",
      "data_demissao_iso": "2024-02-19T03:00:00Z",
      "email": "",
      "nome_funcao": "000310 - ARTIFICE"
    },
    {
      "id_api": "620",
      "codigo": "000668",
      "matricula": "000668",
      "nome": "CRISTIANO FERNANDES DA SILVA",
      "cpf": "64200108291",
      "status": "Demitido",
      "data_admissao": "20/10/2023",
      "data_admissao_iso": "2023-10-20T03:00:00Z",
      "data_demissao": "22/01/2024",
      "data_demissao_iso": "2024-01-22T03:00:00Z",
      "email": "",
      "nome_funcao": "000251 - ANALISTA DE QUALIDADE"
    },
    {
      "id_api": "558",
      "codigo": "000670",
      "matricula": "000670",
      "nome": "ALDEMIR TIBURCIO DE BRITO JUNIOR",
      "cpf": "1893337235",
      "status": "Demitido",
      "data_admissao": "26/10/2023",
      "data_admissao_iso": "2023-10-26T03:00:00Z",
      "data_demissao": "09/05/2024",
      "data_demissao_iso": "2024-05-09T03:00:00Z",
      "email": "",
      "nome_funcao": "000321 - AUXILIAR DE PRODUÇÃO"
    },
    {
      "id_api": "576",
      "codigo": "000671",
      "matricula": "000671",
      "nome": "ANDRE HENRIQUE TRIGUEIRO DE OLIVEIRA",
      "cpf": "70161938299",
      "status": "Demitido",
      "data_admissao": "26/10/2023",
      "data_admissao_iso": "2023-10-26T03:00:00Z",
      "data_demissao": "02/01/2024",
      "data_demissao_iso": "2024-01-02T03:00:00Z",
      "email": "",
      "nome_funcao": "000321 - AUXILIAR DE PRODUÇÃO"
    },
    {
      "id_api": "732",
      "codigo": "000672",
      "matricula": "000672",
      "nome": "OSEIAS MONTEIRO ALVARENGA",
      "cpf": "6045352289",
      "status": "Demitido",
      "data_admissao": "26/10/2023",
      "data_admissao_iso": "2023-10-26T03:00:00Z",
      "data_demissao": "07/11/2024",
      "data_demissao_iso": "2024-11-07T03:00:00Z",
      "email": "",
      "nome_funcao": "000321 - AUXILIAR DE PRODUÇÃO"
    },
    {
      "id_api": "563",
      "codigo": "000673",
      "matricula": "000673",
      "nome": "GELSON MEDEIROS DA COSTA",
      "cpf": "95544976287",
      "status": "Demitido",
      "data_admissao": "26/10/2023",
      "data_admissao_iso": "2023-10-26T03:00:00Z",
      "data_demissao": "16/02/2024",
      "data_demissao_iso": "2024-02-16T03:00:00Z",
      "email": "",
      "nome_funcao": "000321 - AUXILIAR DE PRODUÇÃO"
    },
    {
      "id_api": "567",
      "codigo": "000676",
      "matricula": "000676",
      "nome": "RUAN VICTOR OLIVEIRA PEREIRA",
      "cpf": "70336550294",
      "status": "Demitido",
      "data_admissao": "26/10/2023",
      "data_admissao_iso": "2023-10-26T03:00:00Z",
      "data_demissao": "15/01/2024",
      "data_demissao_iso": "2024-01-15T03:00:00Z",
      "email": "",
      "nome_funcao": "000321 - AUXILIAR DE PRODUÇÃO"
    },
    {
      "id_api": "568",
      "codigo": "000678",
      "matricula": "000678",
      "nome": "GABRIEL DE SOUZA GALVAO",
      "cpf": "6967550250",
      "status": "Demitido",
      "data_admissao": "26/10/2023",
      "data_admissao_iso": "2023-10-26T03:00:00Z",
      "data_demissao": "21/11/2023",
      "data_demissao_iso": "2023-11-21T03:00:00Z",
      "email": "",
      "nome_funcao": "000321 - AUXILIAR DE PRODUÇÃO"
    },
    {
      "id_api": "580",
      "codigo": "000679",
      "matricula": "000679",
      "nome": "ERLEQUESSON NUNES RAMOS",
      "cpf": "2682910203",
      "status": "Demitido",
      "data_admissao": "27/10/2023",
      "data_admissao_iso": "2023-10-27T03:00:00Z",
      "data_demissao": "12/02/2024",
      "data_demissao_iso": "2024-02-12T03:00:00Z",
      "email": "",
      "nome_funcao": "000321 - AUXILIAR DE PRODUÇÃO"
    },
    {
      "id_api": "583",
      "codigo": "000680",
      "matricula": "000680",
      "nome": "JUAN VIANA SILVEIRA",
      "cpf": "7581480208",
      "status": "Demitido",
      "data_admissao": "06/11/2023",
      "data_admissao_iso": "2023-11-06T03:00:00Z",
      "data_demissao": "09/09/2025",
      "data_demissao_iso": "2025-09-09T03:00:00Z",
      "email": "juan.01meireles@gmail.com",
      "nome_funcao": "000331 - APRENDIZ ASSISTENTE DE LOGISTICA"
    },
    {
      "id_api": "572",
      "codigo": "000681",
      "matricula": "000681",
      "nome": "MOZEVALDO SIMOES PEREIRA",
      "cpf": "38413639204",
      "status": "Demitido",
      "data_admissao": "10/11/2023",
      "data_admissao_iso": "2023-11-10T03:00:00Z",
      "data_demissao": "13/08/2024",
      "data_demissao_iso": "2024-08-13T03:00:00Z",
      "email": "",
      "nome_funcao": "000321 - AUXILIAR DE PRODUÇÃO"
    },
    {
      "id_api": "571",
      "codigo": "000682",
      "matricula": "000682",
      "nome": "ADRIANO DA SILVA E SILVA",
      "cpf": "3746199212",
      "status": "Demitido",
      "data_admissao": "10/11/2023",
      "data_admissao_iso": "2023-11-10T03:00:00Z",
      "data_demissao": "22/07/2024",
      "data_demissao_iso": "2024-07-22T03:00:00Z",
      "email": "",
      "nome_funcao": "000049 - LIDER OPERADOR DE MAQ CARTONAGEM"
    },
    {
      "id_api": "587",
      "codigo": "000685",
      "matricula": "000685",
      "nome": "JEONE MARQUES JUTICA",
      "cpf": "86883038272",
      "status": "Demitido",
      "data_admissao": "17/11/2023",
      "data_admissao_iso": "2023-11-17T03:00:00Z",
      "data_demissao": "15/01/2024",
      "data_demissao_iso": "2024-01-15T03:00:00Z",
      "email": "",
      "nome_funcao": "000272 - AUXILIAR DE LOGISTICA"
    },
    {
      "id_api": "699",
      "codigo": "000687",
      "matricula": "000687",
      "nome": "KHRYSLLEY MARCIO FONSECA DE SOUSA",
      "cpf": "71791060200",
      "status": "Demitido",
      "data_admissao": "23/11/2023",
      "data_admissao_iso": "2023-11-23T03:00:00Z",
      "data_demissao": "17/07/2024",
      "data_demissao_iso": "2024-07-17T03:00:00Z",
      "email": "",
      "nome_funcao": "000312 - ELETRICISTA JR."
    },
    {
      "id_api": "590",
      "codigo": "000690",
      "matricula": "000690",
      "nome": "JOSE ERNANDES MACEDO DE OLIVEIRA JUNIOR",
      "cpf": "2925111246",
      "status": "Demitido",
      "data_admissao": "23/11/2023",
      "data_admissao_iso": "2023-11-23T03:00:00Z",
      "data_demissao": "21/01/2024",
      "data_demissao_iso": "2024-01-21T03:00:00Z",
      "email": "",
      "nome_funcao": "000272 - AUXILIAR DE LOGISTICA"
    },
    {
      "id_api": "606",
      "codigo": "000691",
      "matricula": "000691",
      "nome": "AGEU LOPES MORIZ",
      "cpf": "83742859234",
      "status": "Demitido",
      "data_admissao": "04/12/2023",
      "data_admissao_iso": "2023-12-04T03:00:00Z",
      "data_demissao": "03/09/2024",
      "data_demissao_iso": "2024-09-03T03:00:00Z",
      "email": "",
      "nome_funcao": "000271 - AUXILIAR DE MANUTENÇÃO"
    },
    {
      "id_api": "593",
      "codigo": "000692",
      "matricula": "000692",
      "nome": "LIDIANE DA COSTA TAVARES",
      "cpf": "51597691291",
      "status": "Demitido",
      "data_admissao": "04/12/2023",
      "data_admissao_iso": "2023-12-04T03:00:00Z",
      "data_demissao": "17/04/2024",
      "data_demissao_iso": "2024-04-17T03:00:00Z",
      "email": "",
      "nome_funcao": "000108 - VENDEDOR"
    },
    {
      "id_api": "596",
      "codigo": "000693",
      "matricula": "000693",
      "nome": "LIVANILDO PEREIRA DOS PASSOS",
      "cpf": "85580236204",
      "status": "Demitido",
      "data_admissao": "04/12/2023",
      "data_admissao_iso": "2023-12-04T03:00:00Z",
      "data_demissao": "02/01/2024",
      "data_demissao_iso": "2024-01-02T03:00:00Z",
      "email": "",
      "nome_funcao": "000321 - AUXILIAR DE PRODUÇÃO"
    },
    {
      "id_api": "597",
      "codigo": "000694",
      "matricula": "000694",
      "nome": "WISNEY THIAGO PAES COLARES",
      "cpf": "1689555203",
      "status": "Demitido",
      "data_admissao": "04/12/2023",
      "data_admissao_iso": "2023-12-04T03:00:00Z",
      "data_demissao": "30/01/2024",
      "data_demissao_iso": "2024-01-30T03:00:00Z",
      "email": "",
      "nome_funcao": "000312 - ELETRICISTA JR."
    },
    {
      "id_api": "594",
      "codigo": "000695",
      "matricula": "000695",
      "nome": "ARLISON GOMES DO CARMO",
      "cpf": "806905212",
      "status": "Demitido",
      "data_admissao": "04/12/2023",
      "data_admissao_iso": "2023-12-04T03:00:00Z",
      "data_demissao": "03/04/2024",
      "data_demissao_iso": "2024-04-03T03:00:00Z",
      "email": "",
      "nome_funcao": "000272 - AUXILIAR DE LOGISTICA"
    },
    {
      "id_api": "607",
      "codigo": "000697",
      "matricula": "000697",
      "nome": "LUCAS PAES DE SOUZA",
      "cpf": "70607847212",
      "status": "Demitido",
      "data_admissao": "19/12/2023",
      "data_admissao_iso": "2023-12-19T03:00:00Z",
      "data_demissao": "30/01/2024",
      "data_demissao_iso": "2024-01-30T03:00:00Z",
      "email": "",
      "nome_funcao": "000315 - AUXILIAR DE ELETRICISTA"
    },
    {
      "id_api": "604",
      "codigo": "000698",
      "matricula": "000698",
      "nome": "AROLDO FEITOSA REGIS",
      "cpf": "6485431292",
      "status": "Demitido",
      "data_admissao": "19/12/2023",
      "data_admissao_iso": "2023-12-19T03:00:00Z",
      "data_demissao": "24/06/2024",
      "data_demissao_iso": "2024-06-24T03:00:00Z",
      "email": "",
      "nome_funcao": "000310 - ARTIFICE"
    },
    {
      "id_api": "615",
      "codigo": "000699",
      "matricula": "000699",
      "nome": "DAVI SAULO PEREIRA BENTES",
      "cpf": "70138215278",
      "status": "Demitido",
      "data_admissao": "19/12/2023",
      "data_admissao_iso": "2023-12-19T03:00:00Z",
      "data_demissao": "13/05/2024",
      "data_demissao_iso": "2024-05-13T03:00:00Z",
      "email": "",
      "nome_funcao": "000310 - ARTIFICE"
    },
    {
      "id_api": "608",
      "codigo": "000700",
      "matricula": "000700",
      "nome": "LEONARDO GABRIEL DE PAIVA COELHO",
      "cpf": "70433162279",
      "status": "Demitido",
      "data_admissao": "19/12/2023",
      "data_admissao_iso": "2023-12-19T03:00:00Z",
      "data_demissao": "16/02/2024",
      "data_demissao_iso": "2024-02-16T03:00:00Z",
      "email": "",
      "nome_funcao": "000310 - ARTIFICE"
    },
    {
      "id_api": "627",
      "codigo": "000701",
      "matricula": "000701",
      "nome": "OYAMA MONTEIRO SOMOZA",
      "cpf": "9397471201",
      "status": "Demitido",
      "data_admissao": "19/12/2023",
      "data_admissao_iso": "2023-12-19T03:00:00Z",
      "data_demissao": "15/01/2024",
      "data_demissao_iso": "2024-01-15T03:00:00Z",
      "email": "",
      "nome_funcao": "000321 - AUXILIAR DE PRODUÇÃO"
    },
    {
      "id_api": "535",
      "codigo": "000703",
      "matricula": "000703",
      "nome": "EVITON FEITOSA MORAES",
      "cpf": "5601546231",
      "status": "Demitido",
      "data_admissao": "05/01/2024",
      "data_admissao_iso": "2024-01-05T03:00:00Z",
      "data_demissao": "15/04/2024",
      "data_demissao_iso": "2024-04-15T03:00:00Z",
      "email": "",
      "nome_funcao": "000310 - ARTIFICE"
    },
    {
      "id_api": "623",
      "codigo": "000705",
      "matricula": "000705",
      "nome": "MATHEUS BARBOSA DA COSTA",
      "cpf": "70580706281",
      "status": "Demitido",
      "data_admissao": "16/01/2024",
      "data_admissao_iso": "2024-01-16T03:00:00Z",
      "data_demissao": "16/01/2024",
      "data_demissao_iso": "2024-01-16T03:00:00Z",
      "email": "",
      "nome_funcao": "000321 - AUXILIAR DE PRODUÇÃO"
    },
    {
      "id_api": "398",
      "codigo": "000706",
      "matricula": "000706",
      "nome": "CIVAN JUNIO VIEIRA ALVES",
      "cpf": "88311015287",
      "status": "Demitido",
      "data_admissao": "16/01/2024",
      "data_admissao_iso": "2024-01-16T03:00:00Z",
      "data_demissao": "14/02/2024",
      "data_demissao_iso": "2024-02-14T03:00:00Z",
      "email": "",
      "nome_funcao": "000321 - AUXILIAR DE PRODUÇÃO"
    },
    {
      "id_api": "628",
      "codigo": "000707",
      "matricula": "000707",
      "nome": "LUCAS BEZERRA DO NASCIMENTO",
      "cpf": "5347087226",
      "status": "Demitido",
      "data_admissao": "24/01/2024",
      "data_admissao_iso": "2024-01-24T03:00:00Z",
      "data_demissao": "25/09/2024",
      "data_demissao_iso": "2024-09-25T03:00:00Z",
      "email": "",
      "nome_funcao": "000321 - AUXILIAR DE PRODUÇÃO"
    },
    {
      "id_api": "618",
      "codigo": "000708",
      "matricula": "000708",
      "nome": "REINALDO BARROSO DE CARVALHO",
      "cpf": "5457970205",
      "status": "Demitido",
      "data_admissao": "24/01/2024",
      "data_admissao_iso": "2024-01-24T03:00:00Z",
      "data_demissao": "03/03/2025",
      "data_demissao_iso": "2025-03-03T03:00:00Z",
      "email": "",
      "nome_funcao": "000272 - AUXILIAR DE LOGISTICA"
    },
    {
      "id_api": "630",
      "codigo": "000709",
      "matricula": "000709",
      "nome": "JOSE VEIMAR NUNES DA SILVA",
      "cpf": "33852650291",
      "status": "Demitido",
      "data_admissao": "24/01/2024",
      "data_admissao_iso": "2024-01-24T03:00:00Z",
      "data_demissao": "30/01/2024",
      "data_demissao_iso": "2024-01-30T03:00:00Z",
      "email": "",
      "nome_funcao": "000321 - AUXILIAR DE PRODUÇÃO"
    },
    {
      "id_api": "631",
      "codigo": "000710",
      "matricula": "000710",
      "nome": "JOSE MARIO DA SILVA E SILVA",
      "cpf": "47431946287",
      "status": "Demitido",
      "data_admissao": "24/01/2024",
      "data_admissao_iso": "2024-01-24T03:00:00Z",
      "data_demissao": "22/02/2024",
      "data_demissao_iso": "2024-02-22T03:00:00Z",
      "email": "",
      "nome_funcao": "000321 - AUXILIAR DE PRODUÇÃO"
    },
    {
      "id_api": "116",
      "codigo": "000711",
      "matricula": "000711",
      "nome": "JUNIOR TEIXEIRA DA SILVA",
      "cpf": "94319375220",
      "status": "Demitido",
      "data_admissao": "24/01/2024",
      "data_admissao_iso": "2024-01-24T03:00:00Z",
      "data_demissao": "07/02/2024",
      "data_demissao_iso": "2024-02-07T03:00:00Z",
      "email": "",
      "nome_funcao": "000321 - AUXILIAR DE PRODUÇÃO"
    },
    {
      "id_api": "106",
      "codigo": "000712",
      "matricula": "000712",
      "nome": "ROSENILSON MAMEDE FIGUEIRA",
      "cpf": "67786995234",
      "status": "Demitido",
      "data_admissao": "24/01/2024",
      "data_admissao_iso": "2024-01-24T03:00:00Z",
      "data_demissao": "05/02/2024",
      "data_demissao_iso": "2024-02-05T03:00:00Z",
      "email": "",
      "nome_funcao": "000321 - AUXILIAR DE PRODUÇÃO"
    },
    {
      "id_api": "16",
      "codigo": "000715",
      "matricula": "000715",
      "nome": "ROGERIO DIOGO DE BULHOES",
      "cpf": "572495200",
      "status": "Demitido",
      "data_admissao": "01/02/2024",
      "data_admissao_iso": "2024-02-01T03:00:00Z",
      "data_demissao": "25/08/2025",
      "data_demissao_iso": "2025-08-25T03:00:00Z",
      "email": " rogeriodiogo338@gmail.com",
      "nome_funcao": "000321 - AUXILIAR DE PRODUÇÃO"
    },
    {
      "id_api": "3",
      "codigo": "000716",
      "matricula": "000716",
      "nome": "ROMULO JONIO CASTRO DE OLIVEIRA",
      "cpf": "85381578253",
      "status": "Demitido",
      "data_admissao": "01/02/2024",
      "data_admissao_iso": "2024-02-01T03:00:00Z",
      "data_demissao": "09/10/2024",
      "data_demissao_iso": "2024-10-09T03:00:00Z",
      "email": "",
      "nome_funcao": "000321 - AUXILIAR DE PRODUÇÃO"
    },
    {
      "id_api": "550",
      "codigo": "000717",
      "matricula": "000717",
      "nome": "GLEIDSON ALVES DA COSTA",
      "cpf": "147722217",
      "status": "Demitido",
      "data_admissao": "06/02/2024",
      "data_admissao_iso": "2024-02-06T03:00:00Z",
      "data_demissao": "10/06/2024",
      "data_demissao_iso": "2024-06-10T03:00:00Z",
      "email": "",
      "nome_funcao": "000322 - OPERADOR DE MAQUINA DE CARTONAGEM"
    },
    {
      "id_api": "409",
      "codigo": "000718",
      "matricula": "000718",
      "nome": "MATEUS BEZERRA PINHEIRO",
      "cpf": "3441118227",
      "status": "Demitido",
      "data_admissao": "06/02/2024",
      "data_admissao_iso": "2024-02-06T03:00:00Z",
      "data_demissao": "22/02/2024",
      "data_demissao_iso": "2024-02-22T03:00:00Z",
      "email": "",
      "nome_funcao": "000321 - AUXILIAR DE PRODUÇÃO"
    },
    {
      "id_api": "843",
      "codigo": "000719",
      "matricula": "000719",
      "nome": "LUCIAN DE ANDRADE MATOS",
      "cpf": "428636276",
      "status": "Demitido",
      "data_admissao": "06/02/2024",
      "data_admissao_iso": "2024-02-06T03:00:00Z",
      "data_demissao": "27/09/2025",
      "data_demissao_iso": "2025-09-27T03:00:00Z",
      "email": "Lucian.92827262@gmail.com",
      "nome_funcao": "000322 - OPERADOR DE MAQUINA DE CARTONAGEM"
    },
    {
      "id_api": "704",
      "codigo": "000721",
      "matricula": "000721",
      "nome": "ANDERSON DA SILVA DIAS",
      "cpf": "1334110280",
      "status": "Demitido",
      "data_admissao": "06/02/2024",
      "data_admissao_iso": "2024-02-06T03:00:00Z",
      "data_demissao": "12/08/2024",
      "data_demissao_iso": "2024-08-12T03:00:00Z",
      "email": "",
      "nome_funcao": "000032 - COZINHEIRA"
    },
    {
      "id_api": "410",
      "codigo": "000724",
      "matricula": "000724",
      "nome": "SUSIANE DE OLIVEIRA GURGEL",
      "cpf": "61374946249",
      "status": "Demitido",
      "data_admissao": "27/02/2024",
      "data_admissao_iso": "2024-02-27T03:00:00Z",
      "data_demissao": "27/02/2024",
      "data_demissao_iso": "2024-02-27T03:00:00Z",
      "email": "",
      "nome_funcao": "000321 - AUXILIAR DE PRODUÇÃO"
    },
    {
      "id_api": "723",
      "codigo": "000725",
      "matricula": "000725",
      "nome": "ADRIA KELLY FERNANDES PEREIRA",
      "cpf": "2883348251",
      "status": "Demitido",
      "data_admissao": "27/02/2024",
      "data_admissao_iso": "2024-02-27T03:00:00Z",
      "data_demissao": "21/08/2024",
      "data_demissao_iso": "2024-08-21T03:00:00Z",
      "email": "",
      "nome_funcao": "000321 - AUXILIAR DE PRODUÇÃO"
    },
    {
      "id_api": "413",
      "codigo": "000726",
      "matricula": "000726",
      "nome": "ELZINA SOARES DOS SANTOS",
      "cpf": "76839451291",
      "status": "Demitido",
      "data_admissao": "27/02/2024",
      "data_admissao_iso": "2024-02-27T03:00:00Z",
      "data_demissao": "17/03/2025",
      "data_demissao_iso": "2025-03-17T03:00:00Z",
      "email": "",
      "nome_funcao": "000321 - AUXILIAR DE PRODUÇÃO"
    },
    {
      "id_api": "668",
      "codigo": "000727",
      "matricula": "000727",
      "nome": "PAULO HENRIQUE PEREIRA BENTES",
      "cpf": "3479508251",
      "status": "Demitido",
      "data_admissao": "27/02/2024",
      "data_admissao_iso": "2024-02-27T03:00:00Z",
      "data_demissao": "13/06/2024",
      "data_demissao_iso": "2024-06-13T03:00:00Z",
      "email": "",
      "nome_funcao": "000310 - ARTIFICE"
    },
    {
      "id_api": "93",
      "codigo": "000731",
      "matricula": "000731",
      "nome": "RONALDO CHAVES PESQUEIRA",
      "cpf": "47326468249",
      "status": "Demitido",
      "data_admissao": "05/03/2024",
      "data_admissao_iso": "2024-03-05T03:00:00Z",
      "data_demissao": "23/10/2024",
      "data_demissao_iso": "2024-10-23T03:00:00Z",
      "email": "",
      "nome_funcao": "000307 - OPERADOR DE EMPILHADEIRA"
    },
    {
      "id_api": "50",
      "codigo": "000733",
      "matricula": "000733",
      "nome": "MARCEL ATAIDE SABINO",
      "cpf": "2973092264",
      "status": "Demitido",
      "data_admissao": "12/03/2024",
      "data_admissao_iso": "2024-03-12T03:00:00Z",
      "data_demissao": "29/01/2025",
      "data_demissao_iso": "2025-01-29T03:00:00Z",
      "email": "",
      "nome_funcao": "000315 - AUXILIAR DE ELETRICISTA"
    },
    {
      "id_api": "148",
      "codigo": "000734",
      "matricula": "000734",
      "nome": "FRANK SANTOS DA SILVA",
      "cpf": "60431679215",
      "status": "Demitido",
      "data_admissao": "12/03/2024",
      "data_admissao_iso": "2024-03-12T03:00:00Z",
      "data_demissao": "18/06/2025",
      "data_demissao_iso": "2025-06-18T03:00:00Z",
      "email": "franksilvasantos006@gmail.com",
      "nome_funcao": "000272 - AUXILIAR DE LOGISTICA"
    },
    {
      "id_api": "549",
      "codigo": "000735",
      "matricula": "000735",
      "nome": "ELISON BARBOSA FERREIRA",
      "cpf": "3477459202",
      "status": "Demitido",
      "data_admissao": "12/03/2024",
      "data_admissao_iso": "2024-03-12T03:00:00Z",
      "data_demissao": "10/05/2024",
      "data_demissao_iso": "2024-05-10T03:00:00Z",
      "email": "",
      "nome_funcao": "000272 - AUXILIAR DE LOGISTICA"
    },
    {
      "id_api": "119",
      "codigo": "000737",
      "matricula": "000737",
      "nome": "RENER MACEDO ALMEIDA",
      "cpf": "3021875297",
      "status": "Demitido",
      "data_admissao": "12/03/2024",
      "data_admissao_iso": "2024-03-12T03:00:00Z",
      "data_demissao": "08/07/2024",
      "data_demissao_iso": "2024-07-08T03:00:00Z",
      "email": "",
      "nome_funcao": "000321 - AUXILIAR DE PRODUÇÃO"
    },
    {
      "id_api": "486",
      "codigo": "000740",
      "matricula": "000740",
      "nome": "CLEBSON BARAUNA SOBREIRA",
      "cpf": "70436193272",
      "status": "Demitido",
      "data_admissao": "20/03/2024",
      "data_admissao_iso": "2024-03-20T03:00:00Z",
      "data_demissao": "18/04/2024",
      "data_demissao_iso": "2024-04-18T03:00:00Z",
      "email": "",
      "nome_funcao": "000271 - AUXILIAR DE MANUTENÇÃO"
    },
    {
      "id_api": "519",
      "codigo": "000741",
      "matricula": "000741",
      "nome": "OYAMA MONTEIRO SOMOZA",
      "cpf": "9397471201",
      "status": "Demitido",
      "data_admissao": "02/04/2024",
      "data_admissao_iso": "2024-04-02T03:00:00Z",
      "data_demissao": "25/04/2024",
      "data_demissao_iso": "2024-04-25T03:00:00Z",
      "email": "",
      "nome_funcao": "000321 - AUXILIAR DE PRODUÇÃO"
    },
    {
      "id_api": "895",
      "codigo": "000742",
      "matricula": "000742",
      "nome": "GUSTAVO RAMON DA SILVA LINS",
      "cpf": "70538630264",
      "status": "Demitido",
      "data_admissao": "02/04/2024",
      "data_admissao_iso": "2024-04-02T03:00:00Z",
      "data_demissao": "02/07/2025",
      "data_demissao_iso": "2025-07-02T03:00:00Z",
      "email": "Selva395lins@gmail.com",
      "nome_funcao": "000315 - AUXILIAR DE ELETRICISTA"
    },
    {
      "id_api": "518",
      "codigo": "000743",
      "matricula": "000743",
      "nome": "WENDELL MEDEIROS ASSUNCAO",
      "cpf": "3139147295",
      "status": "Demitido",
      "data_admissao": "02/04/2024",
      "data_admissao_iso": "2024-04-02T03:00:00Z",
      "data_demissao": "01/05/2024",
      "data_demissao_iso": "2024-05-01T03:00:00Z",
      "email": "",
      "nome_funcao": "000272 - AUXILIAR DE LOGISTICA"
    },
    {
      "id_api": "520",
      "codigo": "000744",
      "matricula": "000744",
      "nome": "MANOEL LOPES MENDES",
      "cpf": "79861148272",
      "status": "Demitido",
      "data_admissao": "02/04/2024",
      "data_admissao_iso": "2024-04-02T03:00:00Z",
      "data_demissao": "29/10/2024",
      "data_demissao_iso": "2024-10-29T03:00:00Z",
      "email": "",
      "nome_funcao": "000298 - AUXILIAR DE SERVIÇOS GERAIS"
    },
    {
      "id_api": "619",
      "codigo": "000745",
      "matricula": "000745",
      "nome": "GETULIO TOMAS LIMA NETO",
      "cpf": "89791428204",
      "status": "Demitido",
      "data_admissao": "16/04/2024",
      "data_admissao_iso": "2024-04-16T03:00:00Z",
      "data_demissao": "10/05/2024",
      "data_demissao_iso": "2024-05-10T03:00:00Z",
      "email": "",
      "nome_funcao": "000328 - ANALISTA DE DESENVOLVIMENTO JR."
    },
    {
      "id_api": "701",
      "codigo": "000747",
      "matricula": "000747",
      "nome": "ANDREY GUILHERME VASCONCELOS DA ROCHA",
      "cpf": "2459986246",
      "status": "Demitido",
      "data_admissao": "06/05/2024",
      "data_admissao_iso": "2024-05-06T03:00:00Z",
      "data_demissao": "23/07/2024",
      "data_demissao_iso": "2024-07-23T03:00:00Z",
      "email": "",
      "nome_funcao": "000331 - APRENDIZ ASSISTENTE DE LOGISTICA"
    },
    {
      "id_api": "236",
      "codigo": "000748",
      "matricula": "000748",
      "nome": "ALINE VITORIA SILVA DOS SANTOS",
      "cpf": "2263252290",
      "status": "Demitido",
      "data_admissao": "06/05/2024",
      "data_admissao_iso": "2024-05-06T03:00:00Z",
      "data_demissao": "01/09/2025",
      "data_demissao_iso": "2025-09-01T03:00:00Z",
      "email": "alivitoria234@gmail.com",
      "nome_funcao": "000004 - APRENDIZ ASSIST ADM IND"
    },
    {
      "id_api": "837",
      "codigo": "000749",
      "matricula": "000749",
      "nome": "CRISTINA PINHEIRO DA SILVA",
      "cpf": "70160125227",
      "status": "Demitido",
      "data_admissao": "09/05/2024",
      "data_admissao_iso": "2024-05-09T03:00:00Z",
      "data_demissao": "01/04/2025",
      "data_demissao_iso": "2025-04-01T03:00:00Z",
      "email": "",
      "nome_funcao": "000298 - AUXILIAR DE SERVIÇOS GERAIS"
    },
    {
      "id_api": "598",
      "codigo": "000750",
      "matricula": "000750",
      "nome": "JARDEILSON LISBOA GONCALVES",
      "cpf": "4085052225",
      "status": "Demitido",
      "data_admissao": "13/05/2024",
      "data_admissao_iso": "2024-05-13T03:00:00Z",
      "data_demissao": "09/09/2024",
      "data_demissao_iso": "2024-09-09T03:00:00Z",
      "email": "",
      "nome_funcao": "000321 - AUXILIAR DE PRODUÇÃO"
    },
    {
      "id_api": "364",
      "codigo": "000751",
      "matricula": "000751",
      "nome": "FRANCILEIA LARANJEIRA AMAZONAS",
      "cpf": "51384361200",
      "status": "Demitido",
      "data_admissao": "13/05/2024",
      "data_admissao_iso": "2024-05-13T03:00:00Z",
      "data_demissao": "04/12/2025",
      "data_demissao_iso": "2025-12-04T03:00:00Z",
      "email": "francileia.amazonas@gmail.com",
      "nome_funcao": "000321 - AUXILIAR DE PRODUÇÃO"
    },
    {
      "id_api": "787",
      "codigo": "000752",
      "matricula": "000752",
      "nome": "ELIZEU FERREIRA GARCIA",
      "cpf": "4718957257",
      "status": "Demitido",
      "data_admissao": "13/05/2024",
      "data_admissao_iso": "2024-05-13T03:00:00Z",
      "data_demissao": "04/12/2025",
      "data_demissao_iso": "2025-12-04T03:00:00Z",
      "email": "elizeuferreira493@gmail.com",
      "nome_funcao": "000321 - AUXILIAR DE PRODUÇÃO"
    },
    {
      "id_api": "611",
      "codigo": "000754",
      "matricula": "000754",
      "nome": "LUIZ HENRIQUE NERI SA",
      "cpf": "2011495245",
      "status": "Demitido",
      "data_admissao": "13/05/2024",
      "data_admissao_iso": "2024-05-13T03:00:00Z",
      "data_demissao": "11/07/2024",
      "data_demissao_iso": "2024-07-11T03:00:00Z",
      "email": "",
      "nome_funcao": "000321 - AUXILIAR DE PRODUÇÃO"
    },
    {
      "id_api": "613",
      "codigo": "000755",
      "matricula": "000755",
      "nome": "LUIZ FELIPE DOS SANTOS ARAUJO",
      "cpf": "4882281236",
      "status": "Demitido",
      "data_admissao": "13/05/2024",
      "data_admissao_iso": "2024-05-13T03:00:00Z",
      "data_demissao": "26/08/2025",
      "data_demissao_iso": "2025-08-26T03:00:00Z",
      "email": "",
      "nome_funcao": "000272 - AUXILIAR DE LOGISTICA"
    },
    {
      "id_api": "700",
      "codigo": "000760",
      "matricula": "000760",
      "nome": "FABIO DA PAZ OLIVEIRA",
      "cpf": "88562905291",
      "status": "Demitido",
      "data_admissao": "23/05/2024",
      "data_admissao_iso": "2024-05-23T03:00:00Z",
      "data_demissao": "21/07/2024",
      "data_demissao_iso": "2024-07-21T03:00:00Z",
      "email": "",
      "nome_funcao": "000321 - AUXILIAR DE PRODUÇÃO"
    },
    {
      "id_api": "651",
      "codigo": "000761",
      "matricula": "000761",
      "nome": "NAILSON SOUSA SANTOS",
      "cpf": "64662578272",
      "status": "Demitido",
      "data_admissao": "04/06/2024",
      "data_admissao_iso": "2024-06-04T03:00:00Z",
      "data_demissao": "04/12/2025",
      "data_demissao_iso": "2025-12-04T03:00:00Z",
      "email": "",
      "nome_funcao": "000321 - AUXILIAR DE PRODUÇÃO"
    },
    {
      "id_api": "652",
      "codigo": "000762",
      "matricula": "000762",
      "nome": "MARLON SALVADOR DE SEIXAS",
      "cpf": "3939204293",
      "status": "Demitido",
      "data_admissao": "04/06/2024",
      "data_admissao_iso": "2024-06-04T03:00:00Z",
      "data_demissao": "02/08/2024",
      "data_demissao_iso": "2024-08-02T03:00:00Z",
      "email": "",
      "nome_funcao": "000321 - AUXILIAR DE PRODUÇÃO"
    },
    {
      "id_api": "650",
      "codigo": "000763",
      "matricula": "000763",
      "nome": "FRANKSON GOMES BRAGA",
      "cpf": "52209423287",
      "status": "Demitido",
      "data_admissao": "04/06/2024",
      "data_admissao_iso": "2024-06-04T03:00:00Z",
      "data_demissao": "25/09/2024",
      "data_demissao_iso": "2024-09-25T03:00:00Z",
      "email": "",
      "nome_funcao": "000321 - AUXILIAR DE PRODUÇÃO"
    },
    {
      "id_api": "654",
      "codigo": "000764",
      "matricula": "000764",
      "nome": "HUGO DELEON MACHADO DA SILVA",
      "cpf": "53548736220",
      "status": "Demitido",
      "data_admissao": "04/06/2024",
      "data_admissao_iso": "2024-06-04T03:00:00Z",
      "data_demissao": "02/08/2024",
      "data_demissao_iso": "2024-08-02T03:00:00Z",
      "email": "",
      "nome_funcao": "000321 - AUXILIAR DE PRODUÇÃO"
    },
    {
      "id_api": "664",
      "codigo": "000765",
      "matricula": "000765",
      "nome": "DARLLISON MARTINS",
      "cpf": "342695258",
      "status": "Demitido",
      "data_admissao": "11/06/2024",
      "data_admissao_iso": "2024-06-11T03:00:00Z",
      "data_demissao": "17/10/2024",
      "data_demissao_iso": "2024-10-17T03:00:00Z",
      "email": "",
      "nome_funcao": "000321 - AUXILIAR DE PRODUÇÃO"
    },
    {
      "id_api": "655",
      "codigo": "000766",
      "matricula": "000766",
      "nome": "LUCIANO GOMES HONORATO",
      "cpf": "2000162290",
      "status": "Demitido",
      "data_admissao": "11/06/2024",
      "data_admissao_iso": "2024-06-11T03:00:00Z",
      "data_demissao": "10/07/2024",
      "data_demissao_iso": "2024-07-10T03:00:00Z",
      "email": "",
      "nome_funcao": "000272 - AUXILIAR DE LOGISTICA"
    },
    {
      "id_api": "656",
      "codigo": "000767",
      "matricula": "000767",
      "nome": "ROBSON BARROS DA COSTA FEIO",
      "cpf": "88192750230",
      "status": "Demitido",
      "data_admissao": "11/06/2024",
      "data_admissao_iso": "2024-06-11T03:00:00Z",
      "data_demissao": "10/07/2024",
      "data_demissao_iso": "2024-07-10T03:00:00Z",
      "email": "",
      "nome_funcao": "000272 - AUXILIAR DE LOGISTICA"
    },
    {
      "id_api": "661",
      "codigo": "000768",
      "matricula": "000768",
      "nome": "MARCELO FERREIRA DE BRITO",
      "cpf": "2908401207",
      "status": "Demitido",
      "data_admissao": "11/06/2024",
      "data_admissao_iso": "2024-06-11T03:00:00Z",
      "data_demissao": "09/08/2024",
      "data_demissao_iso": "2024-08-09T03:00:00Z",
      "email": "",
      "nome_funcao": "000272 - AUXILIAR DE LOGISTICA"
    },
    {
      "id_api": "662",
      "codigo": "000769",
      "matricula": "000769",
      "nome": "JUCIE ROMAO VASQUES",
      "cpf": "4167801213",
      "status": "Demitido",
      "data_admissao": "11/06/2024",
      "data_admissao_iso": "2024-06-11T03:00:00Z",
      "data_demissao": "22/01/2025",
      "data_demissao_iso": "2025-01-22T03:00:00Z",
      "email": "",
      "nome_funcao": "000298 - AUXILIAR DE SERVIÇOS GERAIS"
    },
    {
      "id_api": "663",
      "codigo": "000770",
      "matricula": "000770",
      "nome": "WISNEY THIAGO PAES COLARES",
      "cpf": "1689555203",
      "status": "Demitido",
      "data_admissao": "11/06/2024",
      "data_admissao_iso": "2024-06-11T03:00:00Z",
      "data_demissao": "12/09/2024",
      "data_demissao_iso": "2024-09-12T03:00:00Z",
      "email": "",
      "nome_funcao": "000312 - ELETRICISTA JR."
    },
    {
      "id_api": "667",
      "codigo": "000773",
      "matricula": "000773",
      "nome": "GABRIEL CARVALHO BARBARAN",
      "cpf": "70085503240",
      "status": "Demitido",
      "data_admissao": "18/06/2024",
      "data_admissao_iso": "2024-06-18T03:00:00Z",
      "data_demissao": "10/03/2025",
      "data_demissao_iso": "2025-03-10T03:00:00Z",
      "email": "",
      "nome_funcao": "000321 - AUXILIAR DE PRODUÇÃO"
    },
    {
      "id_api": "770",
      "codigo": "000775",
      "matricula": "000775",
      "nome": "SEBASTIAO DANIEL SANTAREM DE CARVALHO",
      "cpf": "64680096268",
      "status": "Demitido",
      "data_admissao": "18/06/2024",
      "data_admissao_iso": "2024-06-18T03:00:00Z",
      "data_demissao": "30/09/2024",
      "data_demissao_iso": "2024-09-30T03:00:00Z",
      "email": "",
      "nome_funcao": "000322 - OPERADOR DE MAQUINA DE CARTONAGEM"
    },
    {
      "id_api": "672",
      "codigo": "000776",
      "matricula": "000776",
      "nome": "MATEUS DA CONCEICAO GONCALVES",
      "cpf": "2868780202",
      "status": "Demitido",
      "data_admissao": "18/06/2024",
      "data_admissao_iso": "2024-06-18T03:00:00Z",
      "data_demissao": "16/08/2024",
      "data_demissao_iso": "2024-08-16T03:00:00Z",
      "email": "",
      "nome_funcao": "000310 - ARTIFICE"
    },
    {
      "id_api": "678",
      "codigo": "000778",
      "matricula": "000778",
      "nome": "ICARO DOS SANTOS BARBOSA",
      "cpf": "2909001237",
      "status": "Demitido",
      "data_admissao": "25/06/2024",
      "data_admissao_iso": "2024-06-25T03:00:00Z",
      "data_demissao": "04/12/2025",
      "data_demissao_iso": "2025-12-04T03:00:00Z",
      "email": "barbosaicaro334@gmail.com",
      "nome_funcao": "000298 - AUXILIAR DE SERVIÇOS GERAIS"
    },
    {
      "id_api": "689",
      "codigo": "000780",
      "matricula": "000780",
      "nome": "BRUNO GOMES DE SOUZA",
      "cpf": "899934200",
      "status": "Demitido",
      "data_admissao": "05/07/2024",
      "data_admissao_iso": "2024-07-05T03:00:00Z",
      "data_demissao": "14/08/2024",
      "data_demissao_iso": "2024-08-14T03:00:00Z",
      "email": "",
      "nome_funcao": "000322 - OPERADOR DE MAQUINA DE CARTONAGEM"
    },
    {
      "id_api": "161",
      "codigo": "000781",
      "matricula": "000781",
      "nome": "MARCIVALDO PIMENTEL DE NAZARIO",
      "cpf": "61588946215",
      "status": "Demitido",
      "data_admissao": "17/07/2024",
      "data_admissao_iso": "2024-07-17T03:00:00Z",
      "data_demissao": "10/12/2025",
      "data_demissao_iso": "2025-12-10T03:00:00Z",
      "email": "marcivaldonazario52@gmail.com",
      "nome_funcao": "000320 - AJUSTADOR/ALIMENTADOR DE MAQ DE CARTONAGEM"
    },
    {
      "id_api": "824",
      "codigo": "000782",
      "matricula": "000782",
      "nome": "LINDOMAR ANDRADE ROCHA",
      "cpf": "70156515210",
      "status": "Demitido",
      "data_admissao": "17/07/2024",
      "data_admissao_iso": "2024-07-17T03:00:00Z",
      "data_demissao": "31/03/2025",
      "data_demissao_iso": "2025-03-31T03:00:00Z",
      "email": "",
      "nome_funcao": "000272 - AUXILIAR DE LOGISTICA"
    },
    {
      "id_api": "752",
      "codigo": "000783",
      "matricula": "000783",
      "nome": "DANRLEI BEZERRA DE OLIVEIRA",
      "cpf": "3190907285",
      "status": "Demitido",
      "data_admissao": "17/07/2024",
      "data_admissao_iso": "2024-07-17T03:00:00Z",
      "data_demissao": "14/09/2024",
      "data_demissao_iso": "2024-09-14T03:00:00Z",
      "email": "",
      "nome_funcao": "000321 - AUXILIAR DE PRODUÇÃO"
    },
    {
      "id_api": "703",
      "codigo": "000784",
      "matricula": "000784",
      "nome": "ANDREY GUILHERME VASCONCELOS DA ROCHA",
      "cpf": "2459986246",
      "status": "Demitido",
      "data_admissao": "01/08/2024",
      "data_admissao_iso": "2024-08-01T03:00:00Z",
      "data_demissao": "16/12/2024",
      "data_demissao_iso": "2024-12-16T03:00:00Z",
      "email": "",
      "nome_funcao": "000272 - AUXILIAR DE LOGISTICA"
    },
    {
      "id_api": "702",
      "codigo": "000786",
      "matricula": "000786",
      "nome": "LUIZ CARLOS GARCEZ",
      "cpf": "6087916288",
      "status": "Demitido",
      "data_admissao": "05/08/2024",
      "data_admissao_iso": "2024-08-05T03:00:00Z",
      "data_demissao": "06/02/2025",
      "data_demissao_iso": "2025-02-06T03:00:00Z",
      "email": "",
      "nome_funcao": "000322 - OPERADOR DE MAQUINA DE CARTONAGEM"
    },
    {
      "id_api": "714",
      "codigo": "000787",
      "matricula": "000787",
      "nome": "EDERSON BRAGA DA SILVA",
      "cpf": "73334065200",
      "status": "Demitido",
      "data_admissao": "05/08/2024",
      "data_admissao_iso": "2024-08-05T03:00:00Z",
      "data_demissao": "14/08/2024",
      "data_demissao_iso": "2024-08-14T03:00:00Z",
      "email": "",
      "nome_funcao": "000321 - AUXILIAR DE PRODUÇÃO"
    },
    {
      "id_api": "705",
      "codigo": "000788",
      "matricula": "000788",
      "nome": "BEKENBAUER MAURICIO RODRIGUES",
      "cpf": "60471387215",
      "status": "Demitido",
      "data_admissao": "06/08/2024",
      "data_admissao_iso": "2024-08-06T03:00:00Z",
      "data_demissao": "04/10/2024",
      "data_demissao_iso": "2024-10-04T03:00:00Z",
      "email": "",
      "nome_funcao": "000272 - AUXILIAR DE LOGISTICA"
    },
    {
      "id_api": "706",
      "codigo": "000789",
      "matricula": "000789",
      "nome": "MARCELO MAGALHAES ALVES",
      "cpf": "80313361215",
      "status": "Demitido",
      "data_admissao": "13/08/2024",
      "data_admissao_iso": "2024-08-13T03:00:00Z",
      "data_demissao": "04/02/2025",
      "data_demissao_iso": "2025-02-04T03:00:00Z",
      "email": "",
      "nome_funcao": "000321 - AUXILIAR DE PRODUÇÃO"
    },
    {
      "id_api": "708",
      "codigo": "000791",
      "matricula": "000791",
      "nome": "DANIEL ROCHA DE SOUZA",
      "cpf": "2357304243",
      "status": "Demitido",
      "data_admissao": "13/08/2024",
      "data_admissao_iso": "2024-08-13T03:00:00Z",
      "data_demissao": "25/11/2024",
      "data_demissao_iso": "2024-11-25T03:00:00Z",
      "email": "",
      "nome_funcao": "000321 - AUXILIAR DE PRODUÇÃO"
    },
    {
      "id_api": "858",
      "codigo": "000793",
      "matricula": "000793",
      "nome": "ITAIANNE SILVA DOS SANTOS",
      "cpf": "2275402209",
      "status": "Demitido",
      "data_admissao": "20/08/2024",
      "data_admissao_iso": "2024-08-20T03:00:00Z",
      "data_demissao": "22/04/2025",
      "data_demissao_iso": "2025-04-22T03:00:00Z",
      "email": "itaianne.santos02@gmail.com",
      "nome_funcao": "000321 - AUXILIAR DE PRODUÇÃO"
    },
    {
      "id_api": "629",
      "codigo": "000795",
      "matricula": "000795",
      "nome": "LEONARDO ROOSEVELTH SOUZA SILVA",
      "cpf": "3110456265",
      "status": "Demitido",
      "data_admissao": "20/08/2024",
      "data_admissao_iso": "2024-08-20T03:00:00Z",
      "data_demissao": "18/10/2024",
      "data_demissao_iso": "2024-10-18T03:00:00Z",
      "email": "",
      "nome_funcao": "000272 - AUXILIAR DE LOGISTICA"
    },
    {
      "id_api": "724",
      "codigo": "000797",
      "matricula": "000797",
      "nome": "GENIVAL BEZERRA DE SOUZA",
      "cpf": "49361767291",
      "status": "Demitido",
      "data_admissao": "03/09/2024",
      "data_admissao_iso": "2024-09-03T03:00:00Z",
      "data_demissao": "01/11/2024",
      "data_demissao_iso": "2024-11-01T03:00:00Z",
      "email": "",
      "nome_funcao": "000321 - AUXILIAR DE PRODUÇÃO"
    },
    {
      "id_api": "731",
      "codigo": "000798",
      "matricula": "000798",
      "nome": "MATHEUS VIEIRA DOS SANTOS",
      "cpf": "6137749223",
      "status": "Demitido",
      "data_admissao": "03/09/2024",
      "data_admissao_iso": "2024-09-03T03:00:00Z",
      "data_demissao": "06/01/2026",
      "data_demissao_iso": "2026-01-06T03:00:00Z",
      "email": "",
      "nome_funcao": "000321 - AUXILIAR DE PRODUÇÃO"
    },
    {
      "id_api": "730",
      "codigo": "000799",
      "matricula": "000799",
      "nome": "ELIZANGELA PEREIRA DOS SANTOS",
      "cpf": "65987179220",
      "status": "Demitido",
      "data_admissao": "03/09/2024",
      "data_admissao_iso": "2024-09-03T03:00:00Z",
      "data_demissao": "26/02/2025",
      "data_demissao_iso": "2025-02-26T03:00:00Z",
      "email": "",
      "nome_funcao": "000321 - AUXILIAR DE PRODUÇÃO"
    },
    {
      "id_api": "734",
      "codigo": "000801",
      "matricula": "000801",
      "nome": "SELTON BRANDAO GONZAGA",
      "cpf": "4679506288",
      "status": "Demitido",
      "data_admissao": "11/09/2024",
      "data_admissao_iso": "2024-09-11T03:00:00Z",
      "data_demissao": "25/09/2024",
      "data_demissao_iso": "2024-09-25T03:00:00Z",
      "email": "",
      "nome_funcao": "000321 - AUXILIAR DE PRODUÇÃO"
    },
    {
      "id_api": "733",
      "codigo": "000802",
      "matricula": "000802",
      "nome": "VICTOR MOISES BRITO SOARES",
      "cpf": "70477731260",
      "status": "Demitido",
      "data_admissao": "11/09/2024",
      "data_admissao_iso": "2024-09-11T03:00:00Z",
      "data_demissao": "26/07/2025",
      "data_demissao_iso": "2025-07-26T03:00:00Z",
      "email": "victormssoares@gmail.com",
      "nome_funcao": "000272 - AUXILIAR DE LOGISTICA"
    },
    {
      "id_api": "753",
      "codigo": "000803",
      "matricula": "000803",
      "nome": "BRUNO OLIVEIRA DE ARAUJO",
      "cpf": "76805514215",
      "status": "Demitido",
      "data_admissao": "11/09/2024",
      "data_admissao_iso": "2024-09-11T03:00:00Z",
      "data_demissao": "09/11/2024",
      "data_demissao_iso": "2024-11-09T03:00:00Z",
      "email": "",
      "nome_funcao": "000321 - AUXILIAR DE PRODUÇÃO"
    },
    {
      "id_api": "759",
      "codigo": "000804",
      "matricula": "000804",
      "nome": "JONATHAN CAVALCANTE DA ROCHA",
      "cpf": "2702268269",
      "status": "Demitido",
      "data_admissao": "11/09/2024",
      "data_admissao_iso": "2024-09-11T03:00:00Z",
      "data_demissao": "09/11/2024",
      "data_demissao_iso": "2024-11-09T03:00:00Z",
      "email": "",
      "nome_funcao": "000321 - AUXILIAR DE PRODUÇÃO"
    },
    {
      "id_api": "740",
      "codigo": "000805",
      "matricula": "000805",
      "nome": "LEANDRO ALMEIDA DE ANDRADE",
      "cpf": "82703566204",
      "status": "Demitido",
      "data_admissao": "11/09/2024",
      "data_admissao_iso": "2024-09-11T03:00:00Z",
      "data_demissao": "25/08/2025",
      "data_demissao_iso": "2025-08-25T03:00:00Z",
      "email": "leandroalmeidaandrade38@gmail.com",
      "nome_funcao": "000321 - AUXILIAR DE PRODUÇÃO"
    },
    {
      "id_api": "739",
      "codigo": "000807",
      "matricula": "000807",
      "nome": "ARMANDO ANDRES MARTINEZ",
      "cpf": "71259132293",
      "status": "Demitido",
      "data_admissao": "11/09/2024",
      "data_admissao_iso": "2024-09-11T03:00:00Z",
      "data_demissao": "14/10/2025",
      "data_demissao_iso": "2025-10-14T03:00:00Z",
      "email": "Andresarmando485@gmail.com ",
      "nome_funcao": "000315 - AUXILIAR DE ELETRICISTA"
    },
    {
      "id_api": "741",
      "codigo": "000808",
      "matricula": "000808",
      "nome": "PEDRO PAULO FERREIRA DA SILVA",
      "cpf": "235542237",
      "status": "Demitido",
      "data_admissao": "11/09/2024",
      "data_admissao_iso": "2024-09-11T03:00:00Z",
      "data_demissao": "10/10/2024",
      "data_demissao_iso": "2024-10-10T03:00:00Z",
      "email": "",
      "nome_funcao": "000321 - AUXILIAR DE PRODUÇÃO"
    },
    {
      "id_api": "83",
      "codigo": "000809",
      "matricula": "000809",
      "nome": "PATRICK MARQUES SOUZA",
      "cpf": "2458779247",
      "status": "Demitido",
      "data_admissao": "11/09/2024",
      "data_admissao_iso": "2024-09-11T03:00:00Z",
      "data_demissao": "26/02/2025",
      "data_demissao_iso": "2025-02-26T03:00:00Z",
      "email": "",
      "nome_funcao": "000321 - AUXILIAR DE PRODUÇÃO"
    },
    {
      "id_api": "761",
      "codigo": "000810",
      "matricula": "000810",
      "nome": "YGOR DE SOUZA MAGALHAES",
      "cpf": "2570622206",
      "status": "Demitido",
      "data_admissao": "11/09/2024",
      "data_admissao_iso": "2024-09-11T03:00:00Z",
      "data_demissao": "09/11/2024",
      "data_demissao_iso": "2024-11-09T03:00:00Z",
      "email": "",
      "nome_funcao": "000321 - AUXILIAR DE PRODUÇÃO"
    },
    {
      "id_api": "746",
      "codigo": "000812",
      "matricula": "000812",
      "nome": "WILLIAM SOUZA FREIRE",
      "cpf": "88330036200",
      "status": "Demitido",
      "data_admissao": "11/09/2024",
      "data_admissao_iso": "2024-09-11T03:00:00Z",
      "data_demissao": "04/11/2024",
      "data_demissao_iso": "2024-11-04T03:00:00Z",
      "email": "",
      "nome_funcao": "000012 - ASSISTENTE ADMINISTRATIVO"
    },
    {
      "id_api": "754",
      "codigo": "000814",
      "matricula": "000814",
      "nome": "WENDELL SERRAO DE OLIVEIRA",
      "cpf": "3792761270",
      "status": "Demitido",
      "data_admissao": "17/09/2024",
      "data_admissao_iso": "2024-09-17T03:00:00Z",
      "data_demissao": "16/10/2024",
      "data_demissao_iso": "2024-10-16T03:00:00Z",
      "email": "",
      "nome_funcao": "000321 - AUXILIAR DE PRODUÇÃO"
    },
    {
      "id_api": "579",
      "codigo": "000816",
      "matricula": "000816",
      "nome": "JOSUE PAULO AZEVEDO DOS SANTOS",
      "cpf": "337540209",
      "status": "Demitido",
      "data_admissao": "17/09/2024",
      "data_admissao_iso": "2024-09-17T03:00:00Z",
      "data_demissao": "14/10/2024",
      "data_demissao_iso": "2024-10-14T03:00:00Z",
      "email": "",
      "nome_funcao": "000321 - AUXILIAR DE PRODUÇÃO"
    },
    {
      "id_api": "771",
      "codigo": "000818",
      "matricula": "000818",
      "nome": "EDUARDO DA COSTA WANDERLEY",
      "cpf": "5922523295",
      "status": "Demitido",
      "data_admissao": "17/09/2024",
      "data_admissao_iso": "2024-09-17T03:00:00Z",
      "data_demissao": "19/09/2024",
      "data_demissao_iso": "2024-09-19T03:00:00Z",
      "email": "",
      "nome_funcao": "000272 - AUXILIAR DE LOGISTICA"
    },
    {
      "id_api": "853",
      "codigo": "000820",
      "matricula": "000820",
      "nome": "ORLEANE CUSTODIO DA SILVA",
      "cpf": "79857078249",
      "status": "Demitido",
      "data_admissao": "24/09/2024",
      "data_admissao_iso": "2024-09-24T03:00:00Z",
      "data_demissao": "29/07/2025",
      "data_demissao_iso": "2025-07-29T03:00:00Z",
      "email": "orleanecustodio221@gmail.com",
      "nome_funcao": "000321 - AUXILIAR DE PRODUÇÃO"
    },
    {
      "id_api": "804",
      "codigo": "000822",
      "matricula": "000822",
      "nome": "CLAUDEMAR LIMA DE OLIVEIRA",
      "cpf": "119160285",
      "status": "Demitido",
      "data_admissao": "24/09/2024",
      "data_admissao_iso": "2024-09-24T03:00:00Z",
      "data_demissao": "02/01/2025",
      "data_demissao_iso": "2025-01-02T03:00:00Z",
      "email": "",
      "nome_funcao": "000051 - PEDREIRO"
    },
    {
      "id_api": "407",
      "codigo": "000823",
      "matricula": "000823",
      "nome": "YURI SIMOES DE MOURA",
      "cpf": "99710153234",
      "status": "Demitido",
      "data_admissao": "24/09/2024",
      "data_admissao_iso": "2024-09-24T03:00:00Z",
      "data_demissao": "30/09/2024",
      "data_demissao_iso": "2024-09-30T03:00:00Z",
      "email": "",
      "nome_funcao": "000304 - APONTADOR DE PRODUÇÃO"
    },
    {
      "id_api": "430",
      "codigo": "000828",
      "matricula": "000828",
      "nome": "FELIPE FERREIRA MIRANDA",
      "cpf": "70291075274",
      "status": "Demitido",
      "data_admissao": "03/10/2024",
      "data_admissao_iso": "2024-10-03T03:00:00Z",
      "data_demissao": "01/11/2024",
      "data_demissao_iso": "2024-11-01T03:00:00Z",
      "email": "",
      "nome_funcao": "000321 - AUXILIAR DE PRODUÇÃO"
    },
    {
      "id_api": "463",
      "codigo": "000829",
      "matricula": "000829",
      "nome": "WILDEJARDE FERREIRA BRITO",
      "cpf": "76169200200",
      "status": "Demitido",
      "data_admissao": "03/10/2024",
      "data_admissao_iso": "2024-10-03T03:00:00Z",
      "data_demissao": "01/11/2024",
      "data_demissao_iso": "2024-11-01T03:00:00Z",
      "email": "",
      "nome_funcao": "000321 - AUXILIAR DE PRODUÇÃO"
    },
    {
      "id_api": "489",
      "codigo": "000831",
      "matricula": "000831",
      "nome": "IGOR DOS SANTOS MARQUES",
      "cpf": "3259569286",
      "status": "Demitido",
      "data_admissao": "08/10/2024",
      "data_admissao_iso": "2024-10-08T03:00:00Z",
      "data_demissao": "26/11/2024",
      "data_demissao_iso": "2024-11-26T03:00:00Z",
      "email": "",
      "nome_funcao": "000304 - APONTADOR DE PRODUÇÃO"
    },
    {
      "id_api": "490",
      "codigo": "000832",
      "matricula": "000832",
      "nome": "RODRIGO SAMPAIO BARROSO",
      "cpf": "883104261",
      "status": "Demitido",
      "data_admissao": "08/10/2024",
      "data_admissao_iso": "2024-10-08T03:00:00Z",
      "data_demissao": "20/01/2025",
      "data_demissao_iso": "2025-01-20T03:00:00Z",
      "email": "",
      "nome_funcao": "000321 - AUXILIAR DE PRODUÇÃO"
    },
    {
      "id_api": "725",
      "codigo": "000833",
      "matricula": "000833",
      "nome": "DIEGLYSON KEVIN CAVALCANTE BEZERRA",
      "cpf": "5047160262",
      "status": "Demitido",
      "data_admissao": "08/10/2024",
      "data_admissao_iso": "2024-10-08T03:00:00Z",
      "data_demissao": "06/11/2024",
      "data_demissao_iso": "2024-11-06T03:00:00Z",
      "email": "",
      "nome_funcao": "000321 - AUXILIAR DE PRODUÇÃO"
    },
    {
      "id_api": "835",
      "codigo": "000834",
      "matricula": "000834",
      "nome": "JOSIMAR DE JESUS SILVA",
      "cpf": "5699075518",
      "status": "Demitido",
      "data_admissao": "08/10/2024",
      "data_admissao_iso": "2024-10-08T03:00:00Z",
      "data_demissao": "15/09/2025",
      "data_demissao_iso": "2025-09-15T03:00:00Z",
      "email": "josimardejesussilvasilva114@gmail.com",
      "nome_funcao": "000272 - AUXILIAR DE LOGISTICA"
    },
    {
      "id_api": "499",
      "codigo": "000835",
      "matricula": "000835",
      "nome": "CESAR AUGUSTO MARQUES DA SILVA",
      "cpf": "3844724273",
      "status": "Demitido",
      "data_admissao": "08/10/2024",
      "data_admissao_iso": "2024-10-08T03:00:00Z",
      "data_demissao": "10/06/2025",
      "data_demissao_iso": "2025-06-10T03:00:00Z",
      "email": "",
      "nome_funcao": "000321 - AUXILIAR DE PRODUÇÃO"
    },
    {
      "id_api": "646",
      "codigo": "000837",
      "matricula": "000837",
      "nome": "NEUZIVAL FERREIRA NOGUEIRA",
      "cpf": "47577940291",
      "status": "Demitido",
      "data_admissao": "22/10/2024",
      "data_admissao_iso": "2024-10-22T03:00:00Z",
      "data_demissao": "01/11/2024",
      "data_demissao_iso": "2024-11-01T03:00:00Z",
      "email": "",
      "nome_funcao": "000272 - AUXILIAR DE LOGISTICA"
    },
    {
      "id_api": "645",
      "codigo": "000839",
      "matricula": "000839",
      "nome": "WILLIAM ALVES DOS SANTOS",
      "cpf": "8808016200",
      "status": "Demitido",
      "data_admissao": "22/10/2024",
      "data_admissao_iso": "2024-10-22T03:00:00Z",
      "data_demissao": "21/11/2024",
      "data_demissao_iso": "2024-11-21T03:00:00Z",
      "email": "",
      "nome_funcao": "000321 - AUXILIAR DE PRODUÇÃO"
    },
    {
      "id_api": "644",
      "codigo": "000840",
      "matricula": "000840",
      "nome": "JOSE RAMOS MAGALHAES",
      "cpf": "51538571234",
      "status": "Demitido",
      "data_admissao": "22/10/2024",
      "data_admissao_iso": "2024-10-22T03:00:00Z",
      "data_demissao": "07/02/2025",
      "data_demissao_iso": "2025-02-07T03:00:00Z",
      "email": "",
      "nome_funcao": "000321 - AUXILIAR DE PRODUÇÃO"
    },
    {
      "id_api": "695",
      "codigo": "000841",
      "matricula": "000841",
      "nome": "NEANDRO JOSE SILVA VASCONCELOS",
      "cpf": "83701826234",
      "status": "Demitido",
      "data_admissao": "01/11/2024",
      "data_admissao_iso": "2024-11-01T03:00:00Z",
      "data_demissao": "30/12/2024",
      "data_demissao_iso": "2024-12-30T03:00:00Z",
      "email": "",
      "nome_funcao": "000307 - OPERADOR DE EMPILHADEIRA"
    },
    {
      "id_api": "790",
      "codigo": "000842",
      "matricula": "000842",
      "nome": "ROSNI PEREIRA DE ANDRADE",
      "cpf": "82709866234",
      "status": "Demitido",
      "data_admissao": "01/11/2024",
      "data_admissao_iso": "2024-11-01T03:00:00Z",
      "data_demissao": "22/11/2024",
      "data_demissao_iso": "2024-11-22T03:00:00Z",
      "email": "",
      "nome_funcao": "000272 - AUXILIAR DE LOGISTICA"
    },
    {
      "id_api": "681",
      "codigo": "000844",
      "matricula": "000844",
      "nome": "RAIMUNDO DE SOUZA SALES",
      "cpf": "835001202",
      "status": "Demitido",
      "data_admissao": "01/11/2024",
      "data_admissao_iso": "2024-11-01T03:00:00Z",
      "data_demissao": "30/11/2024",
      "data_demissao_iso": "2024-11-30T03:00:00Z",
      "email": "",
      "nome_funcao": "000051 - PEDREIRO"
    },
    {
      "id_api": "696",
      "codigo": "000847",
      "matricula": "000847",
      "nome": "RYLLER GABRIEL COSTA DOS SANTOS",
      "cpf": "10292171307",
      "status": "Demitido",
      "data_admissao": "04/11/2024",
      "data_admissao_iso": "2024-11-04T03:00:00Z",
      "data_demissao": "23/07/2025",
      "data_demissao_iso": "2025-07-23T03:00:00Z",
      "email": "Ryllergabriel94@gmail.com",
      "nome_funcao": "000340 - APRENDIZ AUXILIAR DE PRODUÇAO"
    },
    {
      "id_api": "786",
      "codigo": "000849",
      "matricula": "000849",
      "nome": "SILAS DA SILVA SANTOS",
      "cpf": "6716244239",
      "status": "Demitido",
      "data_admissao": "11/11/2024",
      "data_admissao_iso": "2024-11-11T03:00:00Z",
      "data_demissao": "10/03/2025",
      "data_demissao_iso": "2025-03-10T03:00:00Z",
      "email": "",
      "nome_funcao": "000340 - APRENDIZ AUXILIAR DE PRODUÇAO"
    },
    {
      "id_api": "781",
      "codigo": "000851",
      "matricula": "000851",
      "nome": "RODNEY DE OLIVEIRA PEDROSO",
      "cpf": "92225950253",
      "status": "Demitido",
      "data_admissao": "12/11/2024",
      "data_admissao_iso": "2024-11-12T03:00:00Z",
      "data_demissao": "10/01/2025",
      "data_demissao_iso": "2025-01-10T03:00:00Z",
      "email": "",
      "nome_funcao": "000310 - ARTIFICE"
    },
    {
      "id_api": "780",
      "codigo": "000854",
      "matricula": "000854",
      "nome": "AFRAIM MARQUES SEIXAS",
      "cpf": "4483033298",
      "status": "Demitido",
      "data_admissao": "12/11/2024",
      "data_admissao_iso": "2024-11-12T03:00:00Z",
      "data_demissao": "06/01/2026",
      "data_demissao_iso": "2026-01-06T03:00:00Z",
      "email": "Marquesafraimseixas02@gmail.com",
      "nome_funcao": "000321 - AUXILIAR DE PRODUÇÃO"
    },
    {
      "id_api": "802",
      "codigo": "000855",
      "matricula": "000855",
      "nome": "NEY SOUZA DA SILVA",
      "cpf": "83927735272",
      "status": "Demitido",
      "data_admissao": "05/12/2024",
      "data_admissao_iso": "2024-12-05T03:00:00Z",
      "data_demissao": "23/12/2024",
      "data_demissao_iso": "2024-12-23T03:00:00Z",
      "email": "",
      "nome_funcao": "000321 - AUXILIAR DE PRODUÇÃO"
    },
    {
      "id_api": "801",
      "codigo": "000856",
      "matricula": "000856",
      "nome": "RILDO BERNARDO DO NASCIMENTO",
      "cpf": "90332857204",
      "status": "Demitido",
      "data_admissao": "05/12/2024",
      "data_admissao_iso": "2024-12-05T03:00:00Z",
      "data_demissao": "19/12/2024",
      "data_demissao_iso": "2024-12-19T03:00:00Z",
      "email": "",
      "nome_funcao": "000321 - AUXILIAR DE PRODUÇÃO"
    },
    {
      "id_api": "797",
      "codigo": "000858",
      "matricula": "000858",
      "nome": "DOUGLAS RODRIGO DE SOUZA PORTELA",
      "cpf": "7285993255",
      "status": "Demitido",
      "data_admissao": "18/12/2024",
      "data_admissao_iso": "2024-12-18T03:00:00Z",
      "data_demissao": "23/12/2024",
      "data_demissao_iso": "2024-12-23T03:00:00Z",
      "email": "",
      "nome_funcao": "000321 - AUXILIAR DE PRODUÇÃO"
    },
    {
      "id_api": "792",
      "codigo": "000859",
      "matricula": "000859",
      "nome": "JOAO DIVINO GARCEZ",
      "cpf": "70499210255",
      "status": "Demitido",
      "data_admissao": "18/12/2024",
      "data_admissao_iso": "2024-12-18T03:00:00Z",
      "data_demissao": "06/01/2025",
      "data_demissao_iso": "2025-01-06T03:00:00Z",
      "email": "",
      "nome_funcao": "000321 - AUXILIAR DE PRODUÇÃO"
    },
    {
      "id_api": "793",
      "codigo": "000861",
      "matricula": "000861",
      "nome": "HUGO STEFANINI FERNANDES DE AGUIAR MONTE",
      "cpf": "52729516204",
      "status": "Demitido",
      "data_admissao": "18/12/2024",
      "data_admissao_iso": "2024-12-18T03:00:00Z",
      "data_demissao": "15/02/2025",
      "data_demissao_iso": "2025-02-15T03:00:00Z",
      "email": "",
      "nome_funcao": "000114 - Mecânico de manutenção de máquinas, em geral \r\n"
    },
    {
      "id_api": "794",
      "codigo": "000862",
      "matricula": "000862",
      "nome": "MARIANNE DE FATIMA AGUIAR DA SILVA",
      "cpf": "77419324204",
      "status": "Demitido",
      "data_admissao": "18/12/2024",
      "data_admissao_iso": "2024-12-18T03:00:00Z",
      "data_demissao": "15/02/2025",
      "data_demissao_iso": "2025-02-15T03:00:00Z",
      "email": "",
      "nome_funcao": "000104 - FATURISTA"
    },
    {
      "id_api": "800",
      "codigo": "000864",
      "matricula": "000864",
      "nome": "VINICIUS EMANUEL DOS SANTOS FERREIRA",
      "cpf": "70271953217",
      "status": "Demitido",
      "data_admissao": "18/12/2024",
      "data_admissao_iso": "2024-12-18T03:00:00Z",
      "data_demissao": "08/04/2025",
      "data_demissao_iso": "2025-04-08T03:00:00Z",
      "email": "",
      "nome_funcao": "000321 - AUXILIAR DE PRODUÇÃO"
    },
    {
      "id_api": "810",
      "codigo": "000867",
      "matricula": "000867",
      "nome": "DANIEL DE OLIVEIRA BARBOSA",
      "cpf": "1502049228",
      "status": "Demitido",
      "data_admissao": "15/01/2025",
      "data_admissao_iso": "2025-01-15T03:00:00Z",
      "data_demissao": "13/02/2025",
      "data_demissao_iso": "2025-02-13T03:00:00Z",
      "email": "",
      "nome_funcao": "000321 - AUXILIAR DE PRODUÇÃO"
    },
    {
      "id_api": "803",
      "codigo": "000868",
      "matricula": "000868",
      "nome": "FELIPE GONCALVES DA SILVA",
      "cpf": "70101945213",
      "status": "Demitido",
      "data_admissao": "15/01/2025",
      "data_admissao_iso": "2025-01-15T03:00:00Z",
      "data_demissao": "15/03/2025",
      "data_demissao_iso": "2025-03-15T03:00:00Z",
      "email": "",
      "nome_funcao": "000298 - AUXILIAR DE SERVIÇOS GERAIS"
    },
    {
      "id_api": "104",
      "codigo": "000872",
      "matricula": "000872",
      "nome": "ANA CRISTINA FERREIRA SIQUEIRA",
      "cpf": "71138463272",
      "status": "Demitido",
      "data_admissao": "24/01/2025",
      "data_admissao_iso": "2025-01-24T03:00:00Z",
      "data_demissao": "11/02/2025",
      "data_demissao_iso": "2025-02-11T03:00:00Z",
      "email": "",
      "nome_funcao": "000321 - AUXILIAR DE PRODUÇÃO"
    },
    {
      "id_api": "819",
      "codigo": "000873",
      "matricula": "000873",
      "nome": "FERNANDO SALES COSTA",
      "cpf": "82780064234",
      "status": "Demitido",
      "data_admissao": "24/01/2025",
      "data_admissao_iso": "2025-01-24T03:00:00Z",
      "data_demissao": "12/05/2025",
      "data_demissao_iso": "2025-05-12T03:00:00Z",
      "email": "",
      "nome_funcao": "000326 - ASSISTENTE DE QUALIDADE"
    },
    {
      "id_api": "817",
      "codigo": "000874",
      "matricula": "000874",
      "nome": "ARLEM BENJAMIN DE SOUZA",
      "cpf": "90230876234",
      "status": "Demitido",
      "data_admissao": "24/01/2025",
      "data_admissao_iso": "2025-01-24T03:00:00Z",
      "data_demissao": "12/05/2025",
      "data_demissao_iso": "2025-05-12T03:00:00Z",
      "email": "",
      "nome_funcao": "000321 - AUXILIAR DE PRODUÇÃO"
    },
    {
      "id_api": "815",
      "codigo": "000877",
      "matricula": "000877",
      "nome": "LUAN GABRIEL MOTA SAMPAIO SILVA",
      "cpf": "1982927240",
      "status": "Demitido",
      "data_admissao": "24/01/2025",
      "data_admissao_iso": "2025-01-24T03:00:00Z",
      "data_demissao": "05/08/2025",
      "data_demissao_iso": "2025-08-05T03:00:00Z",
      "email": "",
      "nome_funcao": "000326 - ASSISTENTE DE QUALIDADE"
    },
    {
      "id_api": "820",
      "codigo": "000878",
      "matricula": "000878",
      "nome": "ESAQUE RIBEIRO DE LIMA",
      "cpf": "3923493290",
      "status": "Demitido",
      "data_admissao": "24/01/2025",
      "data_admissao_iso": "2025-01-24T03:00:00Z",
      "data_demissao": "19/08/2025",
      "data_demissao_iso": "2025-08-19T03:00:00Z",
      "email": "",
      "nome_funcao": "000321 - AUXILIAR DE PRODUÇÃO"
    },
    {
      "id_api": "816",
      "codigo": "000879",
      "matricula": "000879",
      "nome": "LEONARDO PORTELA CASTELO BRANCO",
      "cpf": "486343286",
      "status": "Demitido",
      "data_admissao": "24/01/2025",
      "data_admissao_iso": "2025-01-24T03:00:00Z",
      "data_demissao": "24/03/2025",
      "data_demissao_iso": "2025-03-24T03:00:00Z",
      "email": "",
      "nome_funcao": "000321 - AUXILIAR DE PRODUÇÃO"
    },
    {
      "id_api": "823",
      "codigo": "000882",
      "matricula": "000882",
      "nome": "JACKSON DE LIMA COSTA",
      "cpf": "67273912204",
      "status": "Demitido",
      "data_admissao": "27/01/2025",
      "data_admissao_iso": "2025-01-27T03:00:00Z",
      "data_demissao": "24/02/2025",
      "data_demissao_iso": "2025-02-24T03:00:00Z",
      "email": "",
      "nome_funcao": "000321 - AUXILIAR DE PRODUÇÃO"
    },
    {
      "id_api": "126",
      "codigo": "000883",
      "matricula": "000883",
      "nome": "THALIA OLIVEIRA NUNES",
      "cpf": "3662848279",
      "status": "Demitido",
      "data_admissao": "04/02/2025",
      "data_admissao_iso": "2025-02-04T03:00:00Z",
      "data_demissao": "31/10/2025",
      "data_demissao_iso": "2025-10-31T03:00:00Z",
      "email": "",
      "nome_funcao": "000015 - ASSISTENTE CONTABIL"
    },
    {
      "id_api": "503",
      "codigo": "000886",
      "matricula": "000886",
      "nome": "PAULO CESAR CESARIO GOMES EVANGELISTA",
      "cpf": "61901520234",
      "status": "Demitido",
      "data_admissao": "13/02/2025",
      "data_admissao_iso": "2025-02-13T03:00:00Z",
      "data_demissao": "10/09/2025",
      "data_demissao_iso": "2025-09-10T03:00:00Z",
      "email": "paulocesarioevangelista@gmail.com",
      "nome_funcao": "000321 - AUXILIAR DE PRODUÇÃO"
    },
    {
      "id_api": "508",
      "codigo": "000888",
      "matricula": "000888",
      "nome": "WEVERTON PINHEIRO GUIMARAES",
      "cpf": "2616332280",
      "status": "Demitido",
      "data_admissao": "13/02/2025",
      "data_admissao_iso": "2025-02-13T03:00:00Z",
      "data_demissao": "14/03/2025",
      "data_demissao_iso": "2025-03-14T03:00:00Z",
      "email": "",
      "nome_funcao": "000298 - AUXILIAR DE SERVIÇOS GERAIS"
    },
    {
      "id_api": "637",
      "codigo": "000892",
      "matricula": "000892",
      "nome": "FABIO ROBERTO MACHADO DO CARMO",
      "cpf": "73035882215",
      "status": "Demitido",
      "data_admissao": "26/02/2025",
      "data_admissao_iso": "2025-02-26T03:00:00Z",
      "data_demissao": "28/04/2025",
      "data_demissao_iso": "2025-04-28T03:00:00Z",
      "email": "fabiorobertomachado999@gmail.com",
      "nome_funcao": "000321 - AUXILIAR DE PRODUÇÃO"
    },
    {
      "id_api": "857",
      "codigo": "000893",
      "matricula": "000893",
      "nome": "FELIPE DE LIMA MONTENEGRO",
      "cpf": "590254251",
      "status": "Demitido",
      "data_admissao": "26/02/2025",
      "data_admissao_iso": "2025-02-26T03:00:00Z",
      "data_demissao": "26/04/2025",
      "data_demissao_iso": "2025-04-26T03:00:00Z",
      "email": "fdelimamontenegro@gmail.com",
      "nome_funcao": "000272 - AUXILIAR DE LOGISTICA"
    },
    {
      "id_api": "737",
      "codigo": "000895",
      "matricula": "000895",
      "nome": "JOAB PINHEIRO DE JESUS",
      "cpf": "1436862248",
      "status": "Demitido",
      "data_admissao": "26/02/2025",
      "data_admissao_iso": "2025-02-26T03:00:00Z",
      "data_demissao": "21/03/2025",
      "data_demissao_iso": "2025-03-21T03:00:00Z",
      "email": "",
      "nome_funcao": "000321 - AUXILIAR DE PRODUÇÃO"
    },
    {
      "id_api": "494",
      "codigo": "000897",
      "matricula": "000897",
      "nome": "NOEMIA SILVA DOS SANTOS",
      "cpf": "3701917221",
      "status": "Demitido",
      "data_admissao": "26/02/2025",
      "data_admissao_iso": "2025-02-26T03:00:00Z",
      "data_demissao": "14/03/2025",
      "data_demissao_iso": "2025-03-14T03:00:00Z",
      "email": "noemiasilva753@gmail.com",
      "nome_funcao": "000321 - AUXILIAR DE PRODUÇÃO"
    },
    {
      "id_api": "647",
      "codigo": "000899",
      "matricula": "000899",
      "nome": "TAYLLOR SEIXAS SILVA",
      "cpf": "8728334299",
      "status": "Demitido",
      "data_admissao": "26/02/2025",
      "data_admissao_iso": "2025-02-26T03:00:00Z",
      "data_demissao": "15/04/2025",
      "data_demissao_iso": "2025-04-15T03:00:00Z",
      "email": "tayllorseixas350@gmail.com",
      "nome_funcao": "000321 - AUXILIAR DE PRODUÇÃO"
    },
    {
      "id_api": "875",
      "codigo": "000901",
      "matricula": "000901",
      "nome": "ALAN TIAGOS PINHEIRO",
      "cpf": "351893202",
      "status": "Demitido",
      "data_admissao": "17/03/2025",
      "data_admissao_iso": "2025-03-17T03:00:00Z",
      "data_demissao": "15/05/2025",
      "data_demissao_iso": "2025-05-15T03:00:00Z",
      "email": "tiagoalan118@gmail.com",
      "nome_funcao": "000321 - AUXILIAR DE PRODUÇÃO"
    },
    {
      "id_api": "697",
      "codigo": "000904",
      "matricula": "000904",
      "nome": "GUILHERME RICHARD OLIVEIRA MELO",
      "cpf": "70072972262",
      "status": "Demitido",
      "data_admissao": "17/03/2025",
      "data_admissao_iso": "2025-03-17T03:00:00Z",
      "data_demissao": "06/01/2026",
      "data_demissao_iso": "2026-01-06T03:00:00Z",
      "email": "guilhermerichardoliveiramelo@gmail.com",
      "nome_funcao": "000321 - AUXILIAR DE PRODUÇÃO"
    },
    {
      "id_api": "709",
      "codigo": "000905",
      "matricula": "000905",
      "nome": "JANDERSON KAIQUE SILVA DOS SANTOS",
      "cpf": "6283329209",
      "status": "Demitido",
      "data_admissao": "17/03/2025",
      "data_admissao_iso": "2025-03-17T03:00:00Z",
      "data_demissao": "15/05/2025",
      "data_demissao_iso": "2025-05-15T03:00:00Z",
      "email": "jandersonk2424@gmail.com",
      "nome_funcao": "000321 - AUXILIAR DE PRODUÇÃO"
    },
    {
      "id_api": "864",
      "codigo": "000906",
      "matricula": "000906",
      "nome": "KLEISON JUNIO ANDRADE DE ARAUJO",
      "cpf": "4209640298",
      "status": "Demitido",
      "data_admissao": "17/03/2025",
      "data_admissao_iso": "2025-03-17T03:00:00Z",
      "data_demissao": "07/05/2025",
      "data_demissao_iso": "2025-05-07T03:00:00Z",
      "email": "",
      "nome_funcao": "000298 - AUXILIAR DE SERVIÇOS GERAIS"
    },
    {
      "id_api": "874",
      "codigo": "000907",
      "matricula": "000907",
      "nome": "KLEUTON GUSTAVO SILVA DO  NASCIMENTO",
      "cpf": "70130589209",
      "status": "Demitido",
      "data_admissao": "17/03/2025",
      "data_admissao_iso": "2025-03-17T03:00:00Z",
      "data_demissao": "15/05/2025",
      "data_demissao_iso": "2025-05-15T03:00:00Z",
      "email": "",
      "nome_funcao": "000321 - AUXILIAR DE PRODUÇÃO"
    },
    {
      "id_api": "710",
      "codigo": "000908",
      "matricula": "000908",
      "nome": "MARCIA SAMPAIO MENEZES DOS SANTOS",
      "cpf": "60942525272",
      "status": "Demitido",
      "data_admissao": "17/03/2025",
      "data_admissao_iso": "2025-03-17T03:00:00Z",
      "data_demissao": "18/06/2025",
      "data_demissao_iso": "2025-06-18T03:00:00Z",
      "email": "msampaiomenezes@gmail.com",
      "nome_funcao": "000321 - AUXILIAR DE PRODUÇÃO"
    },
    {
      "id_api": "850",
      "codigo": "000909",
      "matricula": "000909",
      "nome": "SEBASTIAO DE SOUZA AZEVEDO FILHO",
      "cpf": "75736950200",
      "status": "Demitido",
      "data_admissao": "17/03/2025",
      "data_admissao_iso": "2025-03-17T03:00:00Z",
      "data_demissao": "15/05/2025",
      "data_demissao_iso": "2025-05-15T03:00:00Z",
      "email": "sabasouza038@gmail.com",
      "nome_funcao": "000321 - AUXILIAR DE PRODUÇÃO"
    },
    {
      "id_api": "603",
      "codigo": "000910",
      "matricula": "000910",
      "nome": "VALTER NASCIMENTO DA CRUZ",
      "cpf": "81580789234",
      "status": "Demitido",
      "data_admissao": "17/03/2025",
      "data_admissao_iso": "2025-03-17T03:00:00Z",
      "data_demissao": "31/08/2025",
      "data_demissao_iso": "2025-08-31T03:00:00Z",
      "email": "valternc11@gmail.com",
      "nome_funcao": "000322 - OPERADOR DE MAQUINA DE CARTONAGEM"
    },
    {
      "id_api": "745",
      "codigo": "000911",
      "matricula": "000911",
      "nome": "KEWEN BRUNO DA CONCEICAO",
      "cpf": "4960463228",
      "status": "Demitido",
      "data_admissao": "25/03/2025",
      "data_admissao_iso": "2025-03-25T03:00:00Z",
      "data_demissao": "10/06/2025",
      "data_demissao_iso": "2025-06-10T03:00:00Z",
      "email": "",
      "nome_funcao": "000310 - ARTIFICE"
    },
    {
      "id_api": "872",
      "codigo": "000914",
      "matricula": "000914",
      "nome": "BRUNO ARAUJO SICSU",
      "cpf": "7335057248",
      "status": "Demitido",
      "data_admissao": "25/03/2025",
      "data_admissao_iso": "2025-03-25T03:00:00Z",
      "data_demissao": "14/05/2025",
      "data_demissao_iso": "2025-05-14T03:00:00Z",
      "email": "",
      "nome_funcao": "000321 - AUXILIAR DE PRODUÇÃO"
    },
    {
      "id_api": "764",
      "codigo": "000916",
      "matricula": "000916",
      "nome": "JEFFERSON DE ABREU DOS SANTOS",
      "cpf": "3486309218",
      "status": "Demitido",
      "data_admissao": "25/03/2025",
      "data_admissao_iso": "2025-03-25T03:00:00Z",
      "data_demissao": "28/03/2025",
      "data_demissao_iso": "2025-03-28T03:00:00Z",
      "email": "",
      "nome_funcao": "000321 - AUXILIAR DE PRODUÇÃO"
    },
    {
      "id_api": "762",
      "codigo": "000917",
      "matricula": "000917",
      "nome": "DANRLEY DOS SANTOS SILVA",
      "cpf": "2415806250",
      "status": "Demitido",
      "data_admissao": "25/03/2025",
      "data_admissao_iso": "2025-03-25T03:00:00Z",
      "data_demissao": "23/05/2025",
      "data_demissao_iso": "2025-05-23T03:00:00Z",
      "email": "dans96982@gmail.com",
      "nome_funcao": "000272 - AUXILIAR DE LOGISTICA"
    },
    {
      "id_api": "813",
      "codigo": "000919",
      "matricula": "000919",
      "nome": "ENZO GABRIEL PRESTES HOUNSELL",
      "cpf": "70428865267",
      "status": "Demitido",
      "data_admissao": "01/04/2025",
      "data_admissao_iso": "2025-04-01T03:00:00Z",
      "data_demissao": "30/04/2025",
      "data_demissao_iso": "2025-04-30T03:00:00Z",
      "email": "enzogabrielph2001@gmail.com",
      "nome_funcao": "000321 - AUXILIAR DE PRODUÇÃO"
    },
    {
      "id_api": "785",
      "codigo": "000920",
      "matricula": "000920",
      "nome": "IAN LEVI CORREA MARQUES",
      "cpf": "70179489208",
      "status": "Demitido",
      "data_admissao": "01/04/2025",
      "data_admissao_iso": "2025-04-01T03:00:00Z",
      "data_demissao": "11/04/2025",
      "data_demissao_iso": "2025-04-11T03:00:00Z",
      "email": "o.ianlevi2022@gmail.com",
      "nome_funcao": "000321 - AUXILIAR DE PRODUÇÃO"
    },
    {
      "id_api": "821",
      "codigo": "000921",
      "matricula": "000921",
      "nome": "JAIRO DA SILVA RODRIGUES",
      "cpf": "77101774253",
      "status": "Demitido",
      "data_admissao": "01/04/2025",
      "data_admissao_iso": "2025-04-01T03:00:00Z",
      "data_demissao": "30/05/2025",
      "data_demissao_iso": "2025-05-30T03:00:00Z",
      "email": "jairo.rodriguesjb35@gmail.com",
      "nome_funcao": "000321 - AUXILIAR DE PRODUÇÃO"
    },
    {
      "id_api": "860",
      "codigo": "000922",
      "matricula": "000922",
      "nome": "JOELMIR SANDOVAL MUNHOZ",
      "cpf": "2890670228",
      "status": "Demitido",
      "data_admissao": "01/04/2025",
      "data_admissao_iso": "2025-04-01T03:00:00Z",
      "data_demissao": "30/04/2025",
      "data_demissao_iso": "2025-04-30T03:00:00Z",
      "email": "joelmirtbt2009@hotmail.com",
      "nome_funcao": "000321 - AUXILIAR DE PRODUÇÃO"
    },
    {
      "id_api": "799",
      "codigo": "000923",
      "matricula": "000923",
      "nome": "JOSE RAIMUNDO GEOVAN BARROS GARCIA",
      "cpf": "3712324227",
      "status": "Demitido",
      "data_admissao": "01/04/2025",
      "data_admissao_iso": "2025-04-01T03:00:00Z",
      "data_demissao": "07/08/2025",
      "data_demissao_iso": "2025-08-07T03:00:00Z",
      "email": "",
      "nome_funcao": "000321 - AUXILIAR DE PRODUÇÃO"
    },
    {
      "id_api": "798",
      "codigo": "000924",
      "matricula": "000924",
      "nome": "LUAN QUEIROZ DE OLIVEIRA",
      "cpf": "70074546236",
      "status": "Demitido",
      "data_admissao": "01/04/2025",
      "data_admissao_iso": "2025-04-01T03:00:00Z",
      "data_demissao": "12/08/2025",
      "data_demissao_iso": "2025-08-12T03:00:00Z",
      "email": "luanqueiroz1.56@gmail.com",
      "nome_funcao": "000321 - AUXILIAR DE PRODUÇÃO"
    },
    {
      "id_api": "822",
      "codigo": "000925",
      "matricula": "000925",
      "nome": "MATEUS RODRIGO BRITO DA COSTA",
      "cpf": "2462121285",
      "status": "Demitido",
      "data_admissao": "01/04/2025",
      "data_admissao_iso": "2025-04-01T03:00:00Z",
      "data_demissao": "12/08/2025",
      "data_demissao_iso": "2025-08-12T03:00:00Z",
      "email": "mateusohan@gmail.com",
      "nome_funcao": "000321 - AUXILIAR DE PRODUÇÃO"
    },
    {
      "id_api": "887",
      "codigo": "000926",
      "matricula": "000926",
      "nome": "AGENILSON GONÇALVES ALENCAR",
      "cpf": "2446361250",
      "status": "Demitido",
      "data_admissao": "01/04/2025",
      "data_admissao_iso": "2025-04-01T03:00:00Z",
      "data_demissao": "30/05/2025",
      "data_demissao_iso": "2025-05-30T03:00:00Z",
      "email": "agenilsonalencar752@gmail.com",
      "nome_funcao": "000321 - AUXILIAR DE PRODUÇÃO"
    },
    {
      "id_api": "812",
      "codigo": "000927",
      "matricula": "000927",
      "nome": "DAVID KENNEDY MONTEIRO SOUZA",
      "cpf": "70317723200",
      "status": "Demitido",
      "data_admissao": "01/04/2025",
      "data_admissao_iso": "2025-04-01T03:00:00Z",
      "data_demissao": "10/04/2025",
      "data_demissao_iso": "2025-04-10T03:00:00Z",
      "email": "davidkmont@gmail.com",
      "nome_funcao": "000321 - AUXILIAR DE PRODUÇÃO"
    },
    {
      "id_api": "811",
      "codigo": "000928",
      "matricula": "000928",
      "nome": "ELIAS NASCIMENTO DOS SANTOS",
      "cpf": "71904972268",
      "status": "Demitido",
      "data_admissao": "01/04/2025",
      "data_admissao_iso": "2025-04-01T03:00:00Z",
      "data_demissao": "09/06/2025",
      "data_demissao_iso": "2025-06-09T03:00:00Z",
      "email": "",
      "nome_funcao": "000322 - OPERADOR DE MAQUINA DE CARTONAGEM"
    },
    {
      "id_api": "169",
      "codigo": "000929",
      "matricula": "000929",
      "nome": "MINEIA LIMA DE OLIVEIRA",
      "cpf": "58039236215",
      "status": "Demitido",
      "data_admissao": "01/04/2025",
      "data_admissao_iso": "2025-04-01T03:00:00Z",
      "data_demissao": "15/09/2025",
      "data_demissao_iso": "2025-09-15T03:00:00Z",
      "email": "mineiaoliveira@hotmail.com",
      "nome_funcao": "000344 - ASSISTENTE FINANCEIRO"
    },
    {
      "id_api": "854",
      "codigo": "000932",
      "matricula": "000932",
      "nome": "ANDERSON COSTA HOYOS",
      "cpf": "79494722272",
      "status": "Demitido",
      "data_admissao": "15/04/2025",
      "data_admissao_iso": "2025-04-15T03:00:00Z",
      "data_demissao": "13/05/2025",
      "data_demissao_iso": "2025-05-13T03:00:00Z",
      "email": "andersoncosta151515@gmail.com",
      "nome_funcao": "000272 - AUXILIAR DE LOGISTICA"
    },
    {
      "id_api": "852",
      "codigo": "000933",
      "matricula": "000933",
      "nome": "MARCIO BARRETO CURICA",
      "cpf": "52382230215",
      "status": "Demitido",
      "data_admissao": "15/04/2025",
      "data_admissao_iso": "2025-04-15T03:00:00Z",
      "data_demissao": "14/05/2025",
      "data_demissao_iso": "2025-05-14T03:00:00Z",
      "email": "mb6052704@gmail.com",
      "nome_funcao": "000272 - AUXILIAR DE LOGISTICA"
    },
    {
      "id_api": "873",
      "codigo": "000934",
      "matricula": "000934",
      "nome": "WENDELL DOS SANTOS OLIVEIRA",
      "cpf": "94184291287",
      "status": "Demitido",
      "data_admissao": "15/04/2025",
      "data_admissao_iso": "2025-04-15T03:00:00Z",
      "data_demissao": "14/05/2025",
      "data_demissao_iso": "2025-05-14T03:00:00Z",
      "email": "wendelloliver17@gmail.com",
      "nome_funcao": "000272 - AUXILIAR DE LOGISTICA"
    },
    {
      "id_api": "892",
      "codigo": "000937",
      "matricula": "000937",
      "nome": "RAIMUNDA DAS GRAÇAS MONTEIRO DA COSTA",
      "cpf": "65283635287",
      "status": "Demitido",
      "data_admissao": "22/04/2025",
      "data_admissao_iso": "2025-04-22T03:00:00Z",
      "data_demissao": "20/06/2025",
      "data_demissao_iso": "2025-06-20T03:00:00Z",
      "email": "raimunda18@gmail.com",
      "nome_funcao": "000298 - AUXILIAR DE SERVIÇOS GERAIS"
    },
    {
      "id_api": "861",
      "codigo": "000938",
      "matricula": "000938",
      "nome": "JOSE RAIMUNDO QUEIROZ DE JESUS",
      "cpf": "1009571290",
      "status": "Demitido",
      "data_admissao": "06/05/2025",
      "data_admissao_iso": "2025-05-06T03:00:00Z",
      "data_demissao": "06/01/2026",
      "data_demissao_iso": "2026-01-06T03:00:00Z",
      "email": "",
      "nome_funcao": "000322 - OPERADOR DE MAQUINA DE CARTONAGEM"
    },
    {
      "id_api": "865",
      "codigo": "000939",
      "matricula": "000939",
      "nome": "LORENZO MELO POSTAL",
      "cpf": "70359218261",
      "status": "Demitido",
      "data_admissao": "12/05/2025",
      "data_admissao_iso": "2025-05-12T03:00:00Z",
      "data_demissao": "23/10/2025",
      "data_demissao_iso": "2025-10-23T03:00:00Z",
      "email": "lorenzomelo1991@gmail.com",
      "nome_funcao": "000004 - APRENDIZ ASSIST ADM IND"
    },
    {
      "id_api": "868",
      "codigo": "000940",
      "matricula": "000940",
      "nome": "ALEXANDRE ARAUJO RODRIGUES",
      "cpf": "2394365200",
      "status": "Demitido",
      "data_admissao": "13/05/2025",
      "data_admissao_iso": "2025-05-13T03:00:00Z",
      "data_demissao": "28/07/2025",
      "data_demissao_iso": "2025-07-28T03:00:00Z",
      "email": "9219alexx@gmail.com",
      "nome_funcao": "000321 - AUXILIAR DE PRODUÇÃO"
    },
    {
      "id_api": "866",
      "codigo": "000941",
      "matricula": "000941",
      "nome": "CAIO CESAR DOS SANTOS FRANCA",
      "cpf": "70102806225",
      "status": "Demitido",
      "data_admissao": "13/05/2025",
      "data_admissao_iso": "2025-05-13T03:00:00Z",
      "data_demissao": "11/07/2025",
      "data_demissao_iso": "2025-07-11T03:00:00Z",
      "email": "",
      "nome_funcao": "000321 - AUXILIAR DE PRODUÇÃO"
    },
    {
      "id_api": "869",
      "codigo": "000942",
      "matricula": "000942",
      "nome": "DIOGO SENA DE CASTRO",
      "cpf": "1373396237",
      "status": "Demitido",
      "data_admissao": "13/05/2025",
      "data_admissao_iso": "2025-05-13T03:00:00Z",
      "data_demissao": "06/01/2026",
      "data_demissao_iso": "2026-01-06T03:00:00Z",
      "email": "",
      "nome_funcao": "000321 - AUXILIAR DE PRODUÇÃO"
    },
    {
      "id_api": "894",
      "codigo": "000943",
      "matricula": "000943",
      "nome": "LEONARDO MOURA DE CASTRO",
      "cpf": "70217334296",
      "status": "Demitido",
      "data_admissao": "13/05/2025",
      "data_admissao_iso": "2025-05-13T03:00:00Z",
      "data_demissao": "11/07/2025",
      "data_demissao_iso": "2025-07-11T03:00:00Z",
      "email": "castroleonardo935@gmail.com",
      "nome_funcao": "000321 - AUXILIAR DE PRODUÇÃO"
    },
    {
      "id_api": "331",
      "codigo": "000945",
      "matricula": "000945",
      "nome": "SERGIO DA SILVA CARVALHEDO",
      "cpf": "65081943215",
      "status": "Demitido",
      "data_admissao": "13/05/2025",
      "data_admissao_iso": "2025-05-13T03:00:00Z",
      "data_demissao": "07/10/2025",
      "data_demissao_iso": "2025-10-07T03:00:00Z",
      "email": "sergiocarvalhedo7@gmail.com",
      "nome_funcao": "000078 - VIGIA"
    },
    {
      "id_api": "877",
      "codigo": "000948",
      "matricula": "000948",
      "nome": "JOSEFP ANDRADE DA SILVA",
      "cpf": "3704609285",
      "status": "Demitido",
      "data_admissao": "21/05/2025",
      "data_admissao_iso": "2025-05-21T03:00:00Z",
      "data_demissao": "19/07/2025",
      "data_demissao_iso": "2025-07-19T03:00:00Z",
      "email": "negaojoy@gmail.com",
      "nome_funcao": "000272 - AUXILIAR DE LOGISTICA"
    },
    {
      "id_api": "882",
      "codigo": "000949",
      "matricula": "000949",
      "nome": "ALIRIO OMAR ALVES FERREIRA",
      "cpf": "70383611202",
      "status": "Demitido",
      "data_admissao": "21/05/2025",
      "data_admissao_iso": "2025-05-21T03:00:00Z",
      "data_demissao": "29/05/2025",
      "data_demissao_iso": "2025-05-29T03:00:00Z",
      "email": "",
      "nome_funcao": "000321 - AUXILIAR DE PRODUÇÃO"
    },
    {
      "id_api": "879",
      "codigo": "000951",
      "matricula": "000951",
      "nome": "DOUGLAS FELIPE BARBOSA DOS SANTOS",
      "cpf": "2742960201",
      "status": "Demitido",
      "data_admissao": "21/05/2025",
      "data_admissao_iso": "2025-05-21T03:00:00Z",
      "data_demissao": "18/08/2025",
      "data_demissao_iso": "2025-08-18T03:00:00Z",
      "email": "",
      "nome_funcao": "000321 - AUXILIAR DE PRODUÇÃO"
    },
    {
      "id_api": "265",
      "codigo": "000954",
      "matricula": "000954",
      "nome": "MATHEUS OLIVEIRA DE MOURA",
      "cpf": "70402581296",
      "status": "Demitido",
      "data_admissao": "21/05/2025",
      "data_admissao_iso": "2025-05-21T03:00:00Z",
      "data_demissao": "19/07/2025",
      "data_demissao_iso": "2025-07-19T03:00:00Z",
      "email": "moura.oliveira.matheus99@gmail.com",
      "nome_funcao": "000321 - AUXILIAR DE PRODUÇÃO"
    },
    {
      "id_api": "881",
      "codigo": "000955",
      "matricula": "000955",
      "nome": "PAULO HENRIQUE DE ARAUJO LOBATO",
      "cpf": "70380924218",
      "status": "Demitido",
      "data_admissao": "21/05/2025",
      "data_admissao_iso": "2025-05-21T03:00:00Z",
      "data_demissao": "19/07/2025",
      "data_demissao_iso": "2025-07-19T03:00:00Z",
      "email": "",
      "nome_funcao": "000321 - AUXILIAR DE PRODUÇÃO"
    },
    {
      "id_api": "885",
      "codigo": "000956",
      "matricula": "000956",
      "nome": "WENDEL LUCAS RIBEIRO BARROSO",
      "cpf": "70553749285",
      "status": "Demitido",
      "data_admissao": "21/05/2025",
      "data_admissao_iso": "2025-05-21T03:00:00Z",
      "data_demissao": "19/07/2025",
      "data_demissao_iso": "2025-07-19T03:00:00Z",
      "email": "wendellucas560@gmail.com",
      "nome_funcao": "000321 - AUXILIAR DE PRODUÇÃO"
    },
    {
      "id_api": "164",
      "codigo": "000961",
      "matricula": "000961",
      "nome": "LISSANDRA TIAGO DE SOUZA",
      "cpf": "95190996204",
      "status": "Demitido",
      "data_admissao": "10/06/2025",
      "data_admissao_iso": "2025-06-10T03:00:00Z",
      "data_demissao": "11/06/2025",
      "data_demissao_iso": "2025-06-11T03:00:00Z",
      "email": "",
      "nome_funcao": "000321 - AUXILIAR DE PRODUÇÃO"
    },
    {
      "id_api": "1115",
      "codigo": "000969",
      "matricula": "000969",
      "nome": "AYRTON MAIA DA SILVA",
      "cpf": "963385208",
      "status": "Demitido",
      "data_admissao": "22/07/2025",
      "data_admissao_iso": "2025-07-22T03:00:00Z",
      "data_demissao": "22/07/2025",
      "data_demissao_iso": "2025-07-22T03:00:00Z",
      "email": "ayrtonsilvaam@gmail.com",
      "nome_funcao": "000272 - AUXILIAR DE LOGISTICA"
    },
    {
      "id_api": "1123",
      "codigo": "000973",
      "matricula": "000973",
      "nome": "BRUNO DE SOUZA FEITOSA",
      "cpf": "70143753266",
      "status": "Demitido",
      "data_admissao": "29/07/2025",
      "data_admissao_iso": "2025-07-29T03:00:00Z",
      "data_demissao": "04/12/2025",
      "data_demissao_iso": "2025-12-04T03:00:00Z",
      "email": "",
      "nome_funcao": "000272 - AUXILIAR DE LOGISTICA"
    },
    {
      "id_api": "1124",
      "codigo": "000974",
      "matricula": "000974",
      "nome": "MICAEL GOMES DE ARAUJO PEREIRA",
      "cpf": "3740711280",
      "status": "Demitido",
      "data_admissao": "29/07/2025",
      "data_admissao_iso": "2025-07-29T03:00:00Z",
      "data_demissao": "01/08/2025",
      "data_demissao_iso": "2025-08-01T03:00:00Z",
      "email": "",
      "nome_funcao": "000272 - AUXILIAR DE LOGISTICA"
    },
    {
      "id_api": "1125",
      "codigo": "000975",
      "matricula": "000975",
      "nome": "MICHEL MARCIO DOS SANTOS DA COSTA",
      "cpf": "710684223",
      "status": "Demitido",
      "data_admissao": "29/07/2025",
      "data_admissao_iso": "2025-07-29T03:00:00Z",
      "data_demissao": "26/09/2025",
      "data_demissao_iso": "2025-09-26T03:00:00Z",
      "email": "",
      "nome_funcao": "000272 - AUXILIAR DE LOGISTICA"
    },
    {
      "id_api": "1156",
      "codigo": "000976",
      "matricula": "000976",
      "nome": "ANDRE MESSIAS GAMA DOURADO",
      "cpf": "8532678203",
      "status": "Demitido",
      "data_admissao": "05/08/2025",
      "data_admissao_iso": "2025-08-05T03:00:00Z",
      "data_demissao": "04/12/2025",
      "data_demissao_iso": "2025-12-04T03:00:00Z",
      "email": "andremessias127@gmail.com",
      "nome_funcao": "000321 - AUXILIAR DE PRODUÇÃO"
    },
    {
      "id_api": "1222",
      "codigo": "000978",
      "matricula": "000978",
      "nome": "ADRIANO HENRIQUE DE ARAUJO CABRAL",
      "cpf": "136109292",
      "status": "Demitido",
      "data_admissao": "12/08/2025",
      "data_admissao_iso": "2025-08-12T03:00:00Z",
      "data_demissao": "13/08/2025",
      "data_demissao_iso": "2025-08-13T03:00:00Z",
      "email": "adrianohr3lb@gmail.com",
      "nome_funcao": "000272 - AUXILIAR DE LOGISTICA"
    },
    {
      "id_api": "1223",
      "codigo": "000979",
      "matricula": "000979",
      "nome": "JOSE MARIA SENA DE ALBUQUERQUE",
      "cpf": "19559356291",
      "status": "Demitido",
      "data_admissao": "12/08/2025",
      "data_admissao_iso": "2025-08-12T03:00:00Z",
      "data_demissao": "25/09/2025",
      "data_demissao_iso": "2025-09-25T03:00:00Z",
      "email": "",
      "nome_funcao": "000114 - Mecânico de manutenção de máquinas, em geral \r\n"
    },
    {
      "id_api": "1255",
      "codigo": "000980",
      "matricula": "000980",
      "nome": "CLOVIS DE SOUZA FILHO",
      "cpf": "2951599285",
      "status": "Demitido",
      "data_admissao": "21/08/2025",
      "data_admissao_iso": "2025-08-21T03:00:00Z",
      "data_demissao": "09/10/2025",
      "data_demissao_iso": "2025-10-09T03:00:00Z",
      "email": "",
      "nome_funcao": "000321 - AUXILIAR DE PRODUÇÃO"
    },
    {
      "id_api": "1256",
      "codigo": "000981",
      "matricula": "000981",
      "nome": "DAVID PHILIPE DE OLIVEIRA DUARTE",
      "cpf": "1896793282",
      "status": "Demitido",
      "data_admissao": "21/08/2025",
      "data_admissao_iso": "2025-08-21T03:00:00Z",
      "data_demissao": "01/09/2025",
      "data_demissao_iso": "2025-09-01T03:00:00Z",
      "email": "",
      "nome_funcao": "000321 - AUXILIAR DE PRODUÇÃO"
    },
    {
      "id_api": "1259",
      "codigo": "000984",
      "matricula": "000984",
      "nome": "JOAO RICARDO BARRETO DA SILVA",
      "cpf": "47352434291",
      "status": "Demitido",
      "data_admissao": "21/08/2025",
      "data_admissao_iso": "2025-08-21T03:00:00Z",
      "data_demissao": "19/09/2025",
      "data_demissao_iso": "2025-09-19T03:00:00Z",
      "email": "",
      "nome_funcao": "000272 - AUXILIAR DE LOGISTICA"
    },
    {
      "id_api": "1260",
      "codigo": "000985",
      "matricula": "000985",
      "nome": "HENRIQUE ROCHA DE ARAUJO",
      "cpf": "70365518280",
      "status": "Demitido",
      "data_admissao": "21/08/2025",
      "data_admissao_iso": "2025-08-21T03:00:00Z",
      "data_demissao": "19/10/2025",
      "data_demissao_iso": "2025-10-19T03:00:00Z",
      "email": "hraraujo2122@gmail.com",
      "nome_funcao": "000321 - AUXILIAR DE PRODUÇÃO"
    },
    {
      "id_api": "1321",
      "codigo": "000987",
      "matricula": "000987",
      "nome": "LUIZ CARLOS TEIXEIRA DA CRUZ",
      "cpf": "176040285",
      "status": "Demitido",
      "data_admissao": "02/09/2025",
      "data_admissao_iso": "2025-09-02T03:00:00Z",
      "data_demissao": "01/10/2025",
      "data_demissao_iso": "2025-10-01T03:00:00Z",
      "email": "luizct038@gmail.com",
      "nome_funcao": "000321 - AUXILIAR DE PRODUÇÃO"
    },
    {
      "id_api": "1322",
      "codigo": "000988",
      "matricula": "000988",
      "nome": "WILLIAM PEREIRA DE SALES",
      "cpf": "1788033248",
      "status": "Demitido",
      "data_admissao": "02/09/2025",
      "data_admissao_iso": "2025-09-02T03:00:00Z",
      "data_demissao": "31/10/2025",
      "data_demissao_iso": "2025-10-31T03:00:00Z",
      "email": "williamsales517@gmail.com",
      "nome_funcao": "000321 - AUXILIAR DE PRODUÇÃO"
    },
    {
      "id_api": "1389",
      "codigo": "000993",
      "matricula": "000993",
      "nome": "RAIMUNDO NONATO SAMUEL DE SOUZA",
      "cpf": "94523851204",
      "status": "Demitido",
      "data_admissao": "18/09/2025",
      "data_admissao_iso": "2025-09-18T03:00:00Z",
      "data_demissao": "17/10/2025",
      "data_demissao_iso": "2025-10-17T03:00:00Z",
      "email": "dpessoal@hevi.com.br",
      "nome_funcao": "000321 - AUXILIAR DE PRODUÇÃO"
    },
    {
      "id_api": "1422",
      "codigo": "000996",
      "matricula": "000996",
      "nome": "EMERSON PEREIRA DE SOUZA JUNIOR",
      "cpf": "70142810207",
      "status": "Demitido",
      "data_admissao": "23/09/2025",
      "data_admissao_iso": "2025-09-23T03:00:00Z",
      "data_demissao": "07/10/2025",
      "data_demissao_iso": "2025-10-07T03:00:00Z",
      "email": "",
      "nome_funcao": "000321 - AUXILIAR DE PRODUÇÃO"
    },
    {
      "id_api": "1423",
      "codigo": "000997",
      "matricula": "000997",
      "nome": "ENDERSON DOS SANTOS DE BARROS",
      "cpf": "86459376204",
      "status": "Demitido",
      "data_admissao": "23/09/2025",
      "data_admissao_iso": "2025-09-23T03:00:00Z",
      "data_demissao": "01/10/2025",
      "data_demissao_iso": "2025-10-01T03:00:00Z",
      "email": "",
      "nome_funcao": "000321 - AUXILIAR DE PRODUÇÃO"
    },
    {
      "id_api": "1424",
      "codigo": "000998",
      "matricula": "000998",
      "nome": "FRANCISCO DIEGO LIMA DE VASCONCELOS",
      "cpf": "8712104280",
      "status": "Demitido",
      "data_admissao": "23/09/2025",
      "data_admissao_iso": "2025-09-23T03:00:00Z",
      "data_demissao": "14/10/2025",
      "data_demissao_iso": "2025-10-14T03:00:00Z",
      "email": "",
      "nome_funcao": "000321 - AUXILIAR DE PRODUÇÃO"
    },
    {
      "id_api": "1425",
      "codigo": "000999",
      "matricula": "000999",
      "nome": "KLEIN AGUILAR DOS SANTOS",
      "cpf": "94872422287",
      "status": "Demitido",
      "data_admissao": "23/09/2025",
      "data_admissao_iso": "2025-09-23T03:00:00Z",
      "data_demissao": "06/01/2026",
      "data_demissao_iso": "2026-01-06T03:00:00Z",
      "email": "",
      "nome_funcao": "000321 - AUXILIAR DE PRODUÇÃO"
    },
    {
      "id_api": "1519",
      "codigo": "001003",
      "matricula": "001003",
      "nome": "EUZEBIO COELHO DA SILVA",
      "cpf": "5746668265",
      "status": "Demitido",
      "data_admissao": "14/10/2025",
      "data_admissao_iso": "2025-10-14T03:00:00Z",
      "data_demissao": "12/11/2025",
      "data_demissao_iso": "2025-11-12T03:00:00Z",
      "email": "euzebio689@gmail.com",
      "nome_funcao": "000272 - AUXILIAR DE LOGISTICA"
    },
    {
      "id_api": "1588",
      "codigo": "001008",
      "matricula": "001008",
      "nome": "NABIMAEL NASCIMENTO DOS SANTOS",
      "cpf": "3666534236",
      "status": "Demitido",
      "data_admissao": "04/11/2025",
      "data_admissao_iso": "2025-11-04T03:00:00Z",
      "data_demissao": "02/01/2026",
      "data_demissao_iso": "2026-01-02T03:00:00Z",
      "email": "",
      "nome_funcao": "000315 - AUXILIAR DE ELETRICISTA"
    },
    {
      "id_api": "1589",
      "codigo": "001009",
      "matricula": "001009",
      "nome": "ROSANA JANAINA MARTINS PIRES",
      "cpf": "71827650206",
      "status": "Demitido",
      "data_admissao": "04/11/2025",
      "data_admissao_iso": "2025-11-04T03:00:00Z",
      "data_demissao": "03/12/2025",
      "data_demissao_iso": "2025-12-03T03:00:00Z",
      "email": "",
      "nome_funcao": "000298 - AUXILIAR DE SERVIÇOS GERAIS"
    },
    {
      "id_api": "1651",
      "codigo": "001012",
      "matricula": "001012",
      "nome": "ANA PAULA AMORIM LOPES",
      "cpf": "99082497204",
      "status": "Demitido",
      "data_admissao": "18/11/2025",
      "data_admissao_iso": "2025-11-18T03:00:00Z",
      "data_demissao": "24/11/2025",
      "data_demissao_iso": "2025-11-24T03:00:00Z",
      "email": "ana_paula1808@hotmail.com",
      "nome_funcao": "000015 - ASSISTENTE CONTABIL"
    },
    {
      "id_api": "1653",
      "codigo": "001014",
      "matricula": "001014",
      "nome": "MARCIO COSTA MORIZ",
      "cpf": "54015669215",
      "status": "Demitido",
      "data_admissao": "18/11/2025",
      "data_admissao_iso": "2025-11-18T03:00:00Z",
      "data_demissao": "16/01/2026",
      "data_demissao_iso": "2026-01-16T03:00:00Z",
      "email": "kyotomoriz@gmail.com",
      "nome_funcao": "000298 - AUXILIAR DE SERVIÇOS GERAIS"
    },
    {
      "id_api": "1717",
      "codigo": "001018",
      "matricula": "001018",
      "nome": "ALESSANDRO VIEIRA DOS SANTOS",
      "cpf": "70148313213",
      "status": "Demitido",
      "data_admissao": "19/01/2026",
      "data_admissao_iso": "2026-01-19T03:00:00Z",
      "data_demissao": "23/01/2026",
      "data_demissao_iso": "2026-01-23T03:00:00Z",
      "email": "",
      "nome_funcao": "000321 - AUXILIAR DE PRODUÇÃO"
    }
  ]
}